tweet_preproc,sentiment
milei no leer ni el constitución tampoco él importar ser uno loco peor que cfk,neg
el propuesta de milei de plebiscitar el ley del aborto recibir duro crítica y ser ilegal el plebiscito de uno ley penal estar prohibido en el constitución página12 sepa el pueblo votar el próximo 22 de octubre no a milei,neg
el vice de jorge macri él responder a javier milei por usar el palabra mogólico como insulto tn todo noticia,neg
el candidato a gobernador bonaerense de junto por el cambio calificar así a el aspirante presidencial de unión por el patria sergio massa y de el libertad avanzar javier milei,neu
venir pensar que capaz estaba debatir sin demasiado contenido pero que teniar uno as bajo el manga hasta que dijistar que con milei tú despedirir sin indemnización y ahí yo dar contar que tú informar por twitter con cuenta amigo o con pagina 12 cualquiera,pos
intemperante imprudente y extravagante el duro editorial de theeconomist contra javier milei el revista inglés criticar el idea neoliberal de dolarizar página12,neg
a quién llamás tú decir no ser de derecha ser de centro no estar con milei ser radical estudié profesorado de historia en el uba aunque no terminer porque seguí otro carrera lear algo que no ser página12 que él crear gorriar mer él,neu
como él autodefinar este tipo al hablar de el dema basta de este tipo político impresentabl en el argentina votar a él nuevo al cambio milei 2023,pos
el gobierno denunciar robo organizado y él apuntar a javier milei por el propalación del miedo por melisa molín para página 12 del 230823,neg
resultado escrutinio definitivo milei bajar del 30 massa y bullrich él acercar elección paso 2023 página12,neu
no aquí solo veo tonguero de milei en busca de alguno carguito,neu
nuevo advertencia de banco internacional sobre el dolarización de javier milei ser uno canto de sirena,neg
milei él pedir a massa que postergar el presentación del presupuesto 2024 hasta después de el elección general infobae,neu
antes de milei el palabra estado y libertad no ser popular amiga y antes de milei nadie hablar de uno capital humano tomar tranki nomás,pos
yo muero de risa cuando tratar de loco bélico a milei pero ser el único que defender con demencia algo que él molestar y todo opinamos igual que este sr y hablar con conocimiento por que solo defender el verdad con uno realidad que demostrar que tener razón,neu
él decir que haber que jubilar él milei él tender el mano y él él apoya cambier ser uno gran mentira todo junto por el cargo,neu
por más que milei decir mil propuesta él preferir hacer él caso a página 12 y a del caño,pos
fantino ser uno operador de milei desde su creación y vo también por que so is mucho vivo para comerte ese chicana ya este hablar de el sociedad psicótico ser que yo querer vender uno loco el irresponsabilidad de llevar a neron a el rosada no tener presedent,neu
ser que para ser de derecha tenés que sacar patente de hdp formós uno militante de libertad avanzar denunciar a uno candidato de milei por presunto abuso sexual y acoso laboral vía eldestapeweb,neg
javier milei ya prometer uno ajuste brutal tras su victoria en el paso página12,neg
el cuerdo yo traer hasta aca 6 de cada 10 pib en pba no comar todo el comida 42 de pobreza pais quebrado moralmente sector privado destrozado solo sobrevivir el prebendario pero milei este loco,pos
imaginatar él impresentable que ser milei que yo hacer estar de acuerdo con pagina12 y georgina barbarossa al mismo tiempo en el mismo tuit javierdelay mileiesmassa mileieskolectorak,neg
tras el acto contra javier milei cura villero él reunir con sergio massa,neg
que el empleado de cualquiera actividad agradezcar a milei que él hacer fruncir el oee,pos
ese ser traición a el patria o mucho parecido isla malvina javier milei y su asesor imitar a inglaterra dián mondino insistir en que él deber respetar el derecho de autodeterminación de el isleño página12,neg
  el candidato presidencial de el libertad avanzar javier milei elevar formalmente uno comunicado al ejecutivo para que evalúe retrasar el presentación del presupuesto 2024 previsto para este viernes,neu
el libertad vago elección 2023 mendozar investigar a uno candidata de milei que estar de licencia en el trabajo por uno dolor en el pie pero hacer campaña,neg
argentinar el diputado argentino javier milei jmilei del partido llibertadavanza él afirmar favorito en intención de voto para el elección presidencial de 2023 video cortesía todo noticia,pos
gustavo petro él responder a milei ese decir hitler por página 12 del 300823,neg
a él no pero a milei si ahora podrar votar seguro a javier milei ya que no tener ni parte ni arte con el libertad avanzar ahora sin miedo y seguro a votar a milei,neu
milei massa y bullrich relanzar su campaña el estrategia de cada uno para quebrar el escenario de tercio tn,neu
cualquiera que asumir él tener mucho complicado por ese ni el economista de el libertad avanzar él poner de acuerdo pero milei tener uno agravante extremo debilidad político,neg
  jornalista do canal argentino todo noticia tn não sei como não previmos mas milei estar ganhar them lugar inusitado them santiago del estero them san juan them mendoza them córdoba them santa fe ele estar ganhar them todo tú lugar yo bairro popular,pos
porque mucho especular con milei incluso el virgo de milei no haber p0ronga que él venir bien incluso a quien votar al virgo,neg
el país prospero tener moneda y banco central propio combatir el inflación ordenar el gasto no emitir a él loco el 99 de el país hacer este no haber atajo posible ese ser uno ilusión q vender milei para juntar voto y q saber que nunca él ir a hacer,neg
segundo a todo notícia citar fonte dar casa rosado javier milei estario com 30 dos voto as coalizões governista e oposicionistar teriam 25 cada,pos
milei estar loco peor que cfk,neg
al menemismo nunca él ir a perdonar que ensuciar el libertad total como idea con el corrupción al kirchnerismo que hacer él mismo con el progresismo en general y encima permitir que él reivindicar al patilludo milei hacer él mismo con el kirchnerismo ser uno loop guardalo,neg
ganar milei en primero vuelta mabel,pos
argentinar arriba con el libertad avanzar y javier milei,pos
ser patobullrich contra todo el poder político el poder económico contra el dupla massa milei con medio propio c5n crónico tv tn canal 9 telefir el destape red canal de cable radio diario páginar 12,neu
lees uno nota de página 12 en lugar de leer el programa de gobierno de milei ese él decir todo pd ser el único que presentar uno programa de gobierno yo leer el programa completo él que decir el medio yo chupar bien el 2 huevo,pos
el colegio carlos pellegrini amanecer con graffitis negacionistas y frase de apoyo a milei pintar el placa de el desaparecido página12,neu
milei desde el principio hablar de libertad de moneda que él no él haber escuchar ser problema de él y de él poco que él informar al contestar,pos
ahora decilo sin sentirte obligado todo saber que tu fetiche ser milei,neg
ser afiliar radical desde 1983 milito fuera de el estructura comiteril por desgracia caí en el frente progresista saber todo el movimiento ser lógico que páginar 12 operar en contra de pullaro y él liguir a milei ser fake news ese,neu
peor tu jefe milei que bloquear a todo el que tener pensamiento contrario aunque no haber escribir nada y el libertad donde quedar por suerte vo no hacer él mismo deber reconocer él,neg
él tener data que milei pasar en primero vuelta ser por ese,pos
el derecha diario ser el página 12 de milei ser del pelado que decir que él hacer el campaña gratis a milei porque el mujer él él pedir,neu
isla malvina javier milei y su asesor imitar a inglaterra página12,neu
el derecho de el isleño ser respetar el futuro canciller de milei hablar del reclamo de malvina,pos
luego él putear a el salteño que votar a milei por mi que él quedar en coma,neu
páginar 12 levantar uno encuesta donde el 40 del voto a milei ser jóven y ese voto hasta hacer poco ser nuestro ese ser el franja a el que tú apuntar con el agenda de minoría y él él deír vuelta quizás el realidad decir que el agenda de mayoría ser más importante,pos
sergio massa y patricia bullrich seguir detrás del fenómeno milei pero buscar reencauzar su campaña a uno mes y medio de el elección por federico mayol,neu
quien decir que milei ir adelante el encuestador que no ver el crecimiento de milei o ahora el incomunicador optar por adivinador o manochantaseste personaje ser uno invento mediático como el alberso moderado que él votar uno 20 de elector mediático patetikos,neg
qué proponer milei uno plataforma de dolarización ajuste de jubilación y baja de plan social el propuesta de el libertad avanzar página12,neg
ponelir pero también ser hablar del partido viva el libertad creado en villa culo y confundir él con el partido de milei,neu
y si yo venís con que pato ser el solución preferir a uno loco que si saber como terminar su frase al menos él no depender de uno señor que vender fideo con tuco o de uno ex presidente que tener que salir a dar su apoyo milei no ser dio ni de cerca pero él demá ser,pos
javier milei retomar el campaña mientras hacer recorrida polarizar con massa y descartar uno diálogo con macri,neu
todo el clave de el elección prometer uno octubre en llama haber paso en tercio pero el primero lugar de milei ser el sorpresa junto por el cambio y unión por el patria mucho cerca página12,neu
  n0 c0mpren d0lares c0mpren autit0s que requerir dolar para armar el pieza imp0rtada ser patético genocida que disparar deseo innecesario ser lascivo violador satánico del intelecto humano v0ta milei mileienprimeravuelta,pos
el gallina fusilada milei uno novedad centenario página12,neu
todonoticia todo noticia ya empezar el campaña susto contra milei tn resultar ser que ser el que ayudar a bajar a macri y apenas su decir algo de el kukaracha ahora que milei ganar el paso ya arremetir con el miedo a el propuesta de milei,pos
ser que el dolarizacion solo servir para parar el inflación de ahí a qué ecuador haber hacer otro cosa mal ser otro problema milei siempre decir ese no que ser el solución para todo,pos
catamarca repudio de diputado a el dicho del jefe de campaña de milei,neg
mauricio macri romper el silencio en tn en medio de el polémica sobre su rol en jxc y su guiño a milei,neu
él meter uno loco a mi clase de el nada decir que yo ir a morir y que por qué no votar a milei ayuda que miedo,neg
primero fuente páginar 12 y de último por él menos no ser con el mío con más gana voto a milei vivo el libertad carajo,pos
sar justo uno médico recibir seis disparo tras resistir él al robo de su camioneta infobae massa ser soicio de el delincuente milei no tener huevo para pararlo patricia bullrich ser el unica que restaurar el seguridad en el pais votar bien,neg
riellodecba amigo para aclarar él que venís decir tú dejar este para wall street ser uno inconsistente desde el riñon financiero internacional él apuntar a milei página12 parecer q no él caer bien,neg
poder ser uno técnica para asustar crear uno monstruo como emmanuel goldstein en 1984 milei12 decir fascismo12 decir página12 sacar al menos uno nota diario de milei todo el año,pos
vivir el libertad carajoooo milei presidente,pos
él soltar el mano a todo noticia y clarin a milei obvio inventar uno personaje imbécil y él hacer crecer tanto que él él ser de el mano terrorrr él estar sacar voto al pro ser mucho básico después de el paso él juntar canibalesenc5n,pos
el prensa de cambiemos el nacion americo telefe clarin tn perfil el prensa del peronismo el de k5n paginar 12 empezar a defenestrar a milei el problema ser cuando gobierne tener todo en contra no él como ir a gobernar gremio juez todo,neg
jajajajaaj el economía precario de el hijo de puta de página 12 segundo medida del gobierno de milei 1ra dolarizar eliminar el pauta oficial en su totalidad,pos
lamentablemente haber mucho gente enojado considerar en entremateymate x lt9lider el periodista de página 12 tunykollmann en relación al importante resultado electoral obtenido por javier milei en el paso,neu
yo no querer defender a milei porque él votar a el ser porque poder joder a cualquiera gobierno que venir ser de bullrich mieli o bregmar,neu
el oficialismo buscar hacer control de daño tras el caso morén y creer que milei poder ser el más beneficiado tn todo noticia,neu
tal vezmei està en el mismo situación de plan el diferencia ser que sè que milei ir a tomar siempre el decisión por más libertad y menos estado que ir a hacer pato depender de el humedad ambiente saldra pato o gallareta,neu
massa no ser el que decir que ir a acabar con el ñoquis de el campora y con el kirchnerismo y que ahora militar para él como uno perrito faldero milei presentar 9 proyecto en él que llevar de gestión pero como so is uno termo no tú enterar de nada,pos
el oposición poner el foco en pba  caravana de milei en el plata y recorrido de bullrich por el conurbano,neu
  ayyy el payasesco y metaforico mesía de el política barato baratar el reacción de china a el provocación de milei el candidato él anotar uno roce con uno socio comercial clave para el argentina página12,neu
cuando él ver a javier milei poner él tanto violento decir ‘ por ahí no expresar mauricio macri en tn,neg
nuevo encuesta sergio massa él enfrentar en uno balotaje con javier milei por página 12 del 070923,neu
él ir a poner en cada tuit que ver relacionado con este javier milei no ir a sacar el educación ni el salud gratuito este gente repetir como loro él que decir el gobierno c5n página 12 telam etc todo medio k ensobrado el invito a investigar sobre el plan de gobierno,pos
no creer que milei este loco ese ser uno opinión tuyo mucho subjetivo por cierto para mi loco ser ser de izquierda tener evidencia empirico del fracaso monumental de ese sistema nefasto,neu
pero si ya milei decir que no ir a dolarizar quien él entender loco ya cansar,neg
no cachir que hiciste,neu
ser que militar el voto a milei necesario para que no crecer massa,pos
aguante milei decir uno pibe en cabildo y juramento mientras el canal filo comunista todo noticia regalar plantita,pos
intemperante imprudente y extravagante el duro editorial de the economist contra javier milei,neg
mauricio macri romper el silencio en tn en medio de el polémica sobre su rol en jxc y su guiño a milei,neu
milei presidente libertad y dignidad para todo el argentino,pos
sergio massa y patricia bullrich seguir detrás del fenómeno milei pero buscar reencausar su campaña a uno mes y medio de el elección,neu
porque él tener que bajar grindetti saco uno 16 y no ser seguro que retener el voto de santilli sin contar con el arrastre de milei jxc él desangrar con suerte el pato llegar al 20,neu
sergio massa y patricia bullrich seguir detrás del fenómeno milei pero buscar reencauzar su campaña a uno mes y medio de el elección infobae,neu
o también el junta militar haber asumir el poder total de modo que ser sólo responsable de su acto ante dio y el historia algo mucho parecido a él que pregonar j milei a laje g álvarez y demás político neofascista disfrazado de pensador de el libertad,neg
seguir publicar noticia sobre milei no comulgo con el partido de milei seguir alguno idea pero ser mucho evidente que a el periodista de tn todo noticia estar financiado por larreta jxc nunca hablar en contra de larreta ni de patricia bullrich,neu
si no inventar cosa rara ganar milei en primero vuelta,pos
con ese i amágén no el ayuda ser 3 cabeza págín 12 él él terminar por en argentina querer uno tipo como milei,pos
elon musk borrar el mensaje de apoyo a javier milei y el red él llenar de mem,neg
el partido de milei en el congreso solo ser el y su hermana y luego este rodeado de solo oposición,neu
darío epstein decir que milei tener uno propuesta de dolarización mucho concreto y que por el inflación el peso ser papel pintado que nadie querer,neu
milei mañana en pagina 12 ir a construir hospital publico,neu
laurita no tú dar vergüenza hablar de libertad de expresión con el tremendo operación que jxc él hacer a milei en el medio afín no uno vez sino 24x7 durante el último dos mes y cuando él invitar uno vez cada tanto el periodista llorar modal cuando pasar factura,pos
ser obvio que milei estar por encima de el otro dos tú poder gustar más o menos pero ser el realidad no haber asumir todavía el derrota tanto vergonzoso de el paso,pos
milei el voto blando y el ballottage sergio massa encarar el segundo etapa de su campaña por melisa molín para página 12 del 290823,neu
ajajar ajajaja gracias milei este unir a el rata que saber que él ir llego el momento de cambiar,pos
macri simpatizar con el idea liberal aunque para poder ganar él rodeo de zurdo faltar el batalla cultural que dar milei espert etc para entender el bondad de el idea de el libertad pero hoy en día quedar mucho poco de liberal en jxc estar plagado de zurdo,pos
elección 2023 néstor grindetti salir a cruzar a javier milei por su video viral,neg
ser el encuesta q hacer artemio lopez en pagina 12 en 2021 decir q en el paso ganar kichi x 10 punto y en el de este año predecir q milei sacar eo 16 q vaya a laburar el viejo mercenario ese dps yo ilusionar al pedo,neu
haber que ser bastante trolo y criado por papas que leer página 12 para tener él miedo a el dictadura de milei ramiro marra y uno ejército de gamer,neu
pero el prueba donde estar tu palabra tener el mismo valor que el peso si hacer uno afirmación tanto tajante que milei ir a ir en contra de el constitución deber tener prueba además que tú pedir que yo digar donde decir que no él poder dolarizar,neu
poner guito para que él estar matar en todo el canal a todo hora medio raro ser él matar a el par c5n y ln páginar 12 y tn cerrar el grieta todo contra milei,pos
más de el mitad de el votante de milei votar a alberto y cristín en 2019 viva el libertad carajo,pos
hoy en el título de página 12 ir a salvar a el democracia presentar hasta en wall street temblar con uno gobierno de milei,pos
vean el comparación que hacer el presidente de méxico con milei jejejejej el mero verdad echar uno vistazo al vídeo de tn todo noticia tiktok,neg
el gobernador bonaerense él referir a el propuesta de el oposición y asegurar que el derecha tener a milei y a bullrich suplantado por melconiar,neg
el sindicato de conductor de moto creer que milei buscar sacar más derecho,neg
milei querer recortar mas el jubilación este hdp no saber que el jubilado pasar hambre que infeliz javier milei presentar su propuesta recorte de jubilación privatización y arancelar el salud público infobae,neg
si el reptil usar nuestro impuesto en arreglar realmente el calle este no pasar milei presidente el demá ser todo el mismo mierda,pos
vivir el libertad carajo milei 2023 tú cantar tu cuarenta,pos
yo intrigar al parecer no necesitar dinero yo tener uno labradora y su comida por ser ya senior oscilar en el 7000 pesos tn todo noticia el círculo íntimo de javier milei siete incondicional y cinco mastín inglés a través de googlenews,neg
mientras no él cuent a tu amigo qué milei querer entregar el malvina a el inglés alguno él ir a quedar con el loco de el perro muerto,neg
gustavo petro él responder a milei ese decir hitler página12,neg
ser provido y el papa ser uno imbécil javier milei con viviana canoso 101120,neu
yo causar gracias porque seguir sin enteder porque ir a votar a milei seguir asi que ganar en primero vuelta,pos
formós uno militante de el libertad avanzar denunciar a uno candidato de milei por presunto abuso sexual y acoso laboral,neg
milei medir 1 50 o el loco 2 10,neu
yo no ser malo persona pero mi impresión sobre milei ser malo para mi este loco pertenecer a uno psiquiátrico y no deber jamas  ser presidente no yo gustar su idea pero más que nada yo parecer uno falta de respeto como de dirigir a su par o no pares tratándolo de bestia,neg
menos mal que ser ministro de economía jajajajo no va a ser presidente el único que poder salvar el economía ser milei mileienprimeravuelto,pos
milei presidenteechaber uno vistazo al vídeo de tn todo noticia tiktok,pos
ese este clarísimo porque el gob actual yo hundir en uno pozo difícil de salir claramente el medida de milei apuntar a cavar más fondo en ese pozo y así terminar de hundir a el argentina,neg
  ser inaplicable en sólo uno vuelta más patricia bullrich él diferenciar de javier milei y reforzar el crítica a su plan económico el economía real ser el que agarrás el volante del tractor y empezás a avanzar el 10 de diciembre,neg
en qué él copiar de milei no yo digar que milei inventar el libertad,neu
el hipótesis de uno javier milei ganador desatar movimiento secreto de sergio massa y patricia bullrich,neu
ser extraordinario el titular si él ver obligado a aclarar el fundador de ese espacio a quien ir a votar ser porque milei ir fenómeno,pos
él estar hacer campaña a milei como el periodista de c5n página 12 etc demasiado chupamedismo terminar con el efecto contrario,pos
qué ofrecer javier milei el ciénaga técnica de comunicación y receta fracasada página12,neg
pero milei gritar mucho,neg
el lapidario sentencia de uno exdirector del fmi sobre el plan de javier milei para dolarizar tn todo noticia dolarblue dolar,neg
pero milei ser antipueblo,neg
para uds lanacionma lmajul edufeiok luisnovaresio prossioficial dejar de mirar mal a macri q ya aclaro mucho bien su posición que querer q putee a milei majul ser retorcir mal marino calabro otro q decir uno de cal y otro de arena gente jodido,neu
paso 2023 ganar el fondo milei y el poder judicial pero solo perder quien tirar el toalla antes de tiempo catorce apunte de el elección del domingo página12,neu
desde que milei el paso al lado oscuro de el fuerza no para de decir estupidez darth bullrich,pos
fiscal rio negro el libertad avanzar,neu
no lean página 12 lees el titulo y tú dar gana de votar a milei,pos
yo seguir el elección después de votar pero estar ver todo noticia pero igual ser de mirar el noticia de todo noticia pero igual voto a cambiemos y junto por el cambio pero yo ser anti kirchnerista ni tampoco javier milei,neg
  compartir este artículo de página 12 que explorar el relación entre china y argentino junto con el implicación de uno posible cambio si milei el candidato libertario asumir el presidencia mi perspectiva ser que el interacción con china ser   show more,neg
tú hacer uno pregunta él crees algo a c5n y páginar 12,pos
edufeiok prossioficial dejar de inflar a milei ser uno loco fascista el votante que querer cambiar seguir con el pato bullrich y conocer mucho que en el paso votar a milei y en el próximo elección ir con pato,neg
nadie decir que el problema que señalar milei no ser cierto él que no sonar acertado ser el solución que proponer ni el económica ni el institucional todo amparado bajo uno reclamo legítimo de libertad y ese ser él que repetir sin pensar su fanboys,neg
el conicet y el programa de milei página12,neu
viaje al plan motosierra de milei primero estación uno país sin coparticipación el ultraderechista arrasar en el interior y ahora buscar dejar tierra arrasado página12,neg
cuánto saldrir el tratamiento de diabetes cáncer o vih si javier milei privatizar el sistema de salud de paciente a cliente página12,neg
perder garantizado este comentario ser mandar a votar a milei,neu
ser él mismo fijate a quien vota este mujer ir a entregar el isla malvina por vacuna y después yo decir vender patria a yo ser igual a el k votar ala verdadero opción el libertad avanzar milei presidente villarruel vizar mondino canciller,pos
sergio massa y patricia bullrich seguir detrás del fenómeno milei pero buscar reencauzar su campaña a uno mes y medio de el elección,neu
el reacción del candidato de javier milei cuando melconiar él decir en el cara que ser imposible dolarizar,neu
perfil peor que páginar 12 adulador de el kirchnerista negar el verdad aplaudir el memoria selectivo apoyar a el fábrica de pobre acá él dar el derecha a milei cero pauta oficial para este medio el negacionista ser uds periodista ensobrado,pos
él decir il manifesto diario de el izquierda italiano ser como q él decir página 12 y a saber si el nota no estar escrito x alguno corresponsal argentino q militir en p12 ambito financiero tiempo argentino y afín no yo gustar milei pero uds estar estar desbocado de odio mamucho,neu
milei 2024 peronchos k choriplanero,pos
mujico contra milei yo parecer que ser uno loco página12,neg
obvio c5n ln paginar 12 ambito financiero todo pautero pero no ir ser necesario con milei él acabar,pos
javier milei uno cisne negro electoral para el mercado reflexión de javier timerman y   alvaro garcía linera página12,neg
javier milei el candidato que tú hacer gaslighting cambio de discurso pos paso página12,neg
este chorro macrista dar receta al vender humo milei él pasar,neu
este lunes en el legislatura porteño él hacer uno acto de homenaje a el víctima del terrorismo encabezado por el candidata a vicepresidenta de milei victoria villarruel a el 16 30 haber uno movilización en repudio frente al edificio de perú 160,neu
javier milei ser parir por el crisis de ingreso cuál ser el principal factor que explicar el crecimiento de el ultraderecha página12,neg
el dilema de bullrich para no quedar afuero de el pulseado massamilei por werner pertot para página 12 del 200823,neu
este capitulo ya él ver,neu
qué pasar en el país si milei romper relación con china el impacto en el infraestructura estratégico de el argentina página12,neu
excelente en el balotage milei massa ganar milei y en el botage milei bullrich ganar milei el polentero nunca votariar al candidato del malvado macri él odiar,pos
