tweet_preproc,sentiment
opinión mauricio macri patricia bullrich y sergio massa todo giran alrededor de javier milei,neu
char cordobé cuánto tú pagar el pájaro loco de milei para q sea su jefe de publicidad él notar mucho él notar el odio q él tenés a m macri vo feiman y otro de el nacion ser culpable de el vuelta de el k q h d p igual q hoy liman liman a bulrrich q asco,neg
  junto por el cambio salir a cruzar fuerte a milei por su pedido de demora del presupuesto mario negri y maximiliano ferraro polemizar en el red el planteo del candidato de el libertad avanzar de posponer el tratamiento de el ley de ley,neg
todo contra milei majul el medio perfil crónico págín 12 encuesta el 50 nooo el 80 creer que con uno gobierno de javier milei estar mejor que ahora el victoria de milei seguir dar que hablar el 78 querer uno cambio drástico,pos
caraván de javier milei y el libertad avanzar en el plata tiemblo el casta mileipresidente mileienprimeravuelta,pos
como decir aliverti páginar 12 el combo de milei y bullrich ser uno tragedia electoral para todo inclinación auténticamente progresista este elección de tres tercio el más corrida a el derecha desde el que él ir todo ser alarmante en el escenario regional,neg
hoy él realizar el debate de el candidato que competir en el capital ser en a dos voz del canal todo noticia el eje central ser calidad institucional seguridad y justicia economía educación y trabajo y política sanitario en pandemia vidal milei,neu
en el encuesta de ayer de todo noticia ir arriba de patricia milei yo no tener nada en contra de ese sr pero creer que necesitar uno poco de orden necesitar uno poco de paz y que no yo gritir,neg
el 22 ser el loco en el quiniela el 22 de octubre ser el general el 22 de octubre ser el cumpleaños de javier milei coincidencio no él creer,neu
pero no explicar porque el candidatura de javier milei ser uno peligro peligroso para el libertad y el democracia ser el que censuran candidato y tú obligar a votar a quien él querer si viviríir en década pasado estar gente pertenecerio al fascismo,neg
mauricio macri querer que el diputado de milei apoyar a patricia cuando querar el cambio,neu
publicalo loco ese conventillo de viejo meado no ser mucho de hombre el demá ser todo millonario y no recordar haber escuchar a nadie hablar de loa fondo de campaña él ver que el problema ser milei,neg
milei no resistir el archivo sobre el dolarización para yo no ser uno buen idea página12,neg
che que onda él estar bajar punto a milei noma en pagina 12,pos
  qepd moreno echarri 18ago vamosconlasbricomil milei él rodear de uno casta de asesor con uno perfil definido todo promercado y estrechamente asociado al neoliberalismo noventista página12,neg
  boom encuesta revelar que javier milei arrasar en uno solo vuelta en argentina milei 40 derecho massa 29 peronista bullrich 23 centroderecho fuente infolab tn todo noticia argentino elección milei,pos
el cruce entre juan josé campanella y lilia lemoinir candidata a diputada de javier milei ser peor que el k infobae,neu
m eugenia vidal leandro santoro javier milei y m bregmar estar junto por primero vez en el pantalla de todo noticia hoy él realizar el sorteo de el ubicación y turno de el intervención y quedar estipulado que ser bregmar quién abrir el debate y milei el que cerrar,neu
cuba massa milei molar morir aerolínea argentino reducir su déficit durante el primero semestre del año en uno 61 respecto a igual período de 2022 si él tomar como referencia el balance de 2019 previo a el pandemia el reducción del déficit superar el 80 página12,neu
che lanacion parecer que todo el mal que andar dar vuelta estar conectado con milei que loco no,neu
  legislatura vallado y tensión sindicato dirigente y agrupación de derechos humanos él movilizar en para repudiar el evento en homenaje a el víctima del terrorismo organizado por el vice de milei victoria villarruel,neg
para para todavía no querer que el gordo izquierdista este vea a milei ganar en primero vuelta,pos
hoy salir en página 12 el sincericidio de marcela pagano milei tener pensado usar el aporte del tesoro nacional atn a el libertad avanzar no necesitas hacer nada él matar solo ojo porque aunque no él voter después yo él tener que fumar 4 año,neg
elección 2023 tras el misa contra milei y el encuentro con massa el cura villero él reúnir con bullrich,neu
nuevo encuesta sergio massa él enfrentar en uno balotaje con javier milei patricia bullrich desinflado página12,neu
milei el solucion paginar 12 este en el lado de el delincuente,pos
este malnacido querer bajar aun mas el jubilación mas hambre para el jubilado que pedazo de hdp javier milei presentar su propuesta recorte de jubilación privatización y arancelar el salud público infobae,neg
páginar 12 ayudar a milei el inútil de filmus y el gana con dedito en v,pos
milei él pedir al gobierno que no presentar el presupuesto 2024 con el argumento de que el libertad avanzar junto por el cambio y unión por el patria salir empatado en el paso,neu
che loco haber viento por ahí saber volar el signo de puntuación para el otro lado,neu
che pelotudazo no ser kircho voto a milei no haber caso todo el militonto de junto por el cargo ser retrasar mental,pos
el contundente editorial víctor hugo tras el paso 2023 no estar nada mal el elección para el gobierno qué decir sobre javier milei patricia bullrich y sergio massa página12,neu
javier milei ser mi candidato ganar en primero vuelta,pos
jajaja de el patada en el orto que él ir a comer ir a remontar a el estratosfera y de ahí elegír el lugar donde querer,neu
a ver el vídeo donde milei decir ese sino ser poco creíble,neu
tener uno gran oportunidad para cambiar el historia de nuestro pais milei presidente libertad y dignidad para todo el argentino elección presidencial octubre 2023,pos
que raro el payaso este tirando él mierda a milei lastimo que yo tener bloqueado porque sino él contestar él que él mereciar miserable socialista,pos
sergio massa cargar contra el política económico de javier milei y patricia bullrich tn todo noticia,neg
educación sexual integral mientras javier milei él ataca amnistir internacional él defender el esi no disfrazar a nadie colaborar para quitar el velo sobre el abuso contra el infancia página12,neg
amar él que yo hacer llegar el guerrero por el libertad mi especialidad sumar fiscal del país en tiktok para nuestro futuro presidente jmilei milei,pos
leer página 12 y pensar que el boludo ser el pibito que votar a milei,pos
milei y su casta de economista neoliberal seguidor de josé alfredo martínez de hoz y de domingo cavallo página12,neg
por qué milei siempre hacer carapostura de flogger cuándo él sacar uno foto,neu
tn todo noticia javier milei reaccionar a el condena de cristina kirchner por el causa vialidad él acabar el cuco a través de googlenews,neu
giacomini sobre milei javier ser el vehiculo que saber captar el hastio de el gente con junto por el cambio que ser peor que el kirchnerismo porque jxc venir a cambiar y no cambio nada y con el kirchnerismo no haber ninguno revolucion de el libertad haber simplemente hastio,neg
ver uno encuesta que decir milei primero vuelta,neu
che infobae lindo este el pauta imagen ultrapositivo a massa a el toma vino ni él nombrar y a milei él hacer uno campaña negrísimo,neu
ya ser hora bastar de doble mensaje con milei,neu
internacional en argentina en el elección primario abierto simultáneo y obligatorio paso javier milei encabezar el votación con uno porcentaje de 32 57 seguido de sergio massa con uno 20 64 foto cortesío todo noticia,neu
ajuste y menos derecho el propuesta de milei en el consejo de el américa página12,neg
milei ser el camino vivir el libertad,pos
urgente página 12 y c5n decir que votar a milei que no tener nada que ver con massa,pos
ajajar ajajaaj ajajar dejar mejor voto a milei presidente 2023,pos
quién ser victoria villaruel el vice de javier milei que organizar el homenaje a el víctima de terrrorismo,neg
el viaje del papa a el argentina sólo depender de su salud no de uno eventual triunfo de javier milei,neu
tn todo noticia el salida romántico de javier milei y danielar mier el foto exclusivo a través de googlenews,neu
el propuesta de milei estan gratis en su plataforma electoral para saber el de boooomrich tener que comprartir uno libro que obviamente él no escribio,pos
el intento de macri pegar él a milei jsjsj,neu
organismo de ddhh llamar a repudiar el acto que él hacer en el legislatura porteño contra el política de memoria verdad y justicia ser encabezar por el candidata a vicepresidenta de milei y ser defender por referente de cambiemos por laura val,neg
traicionastir el idea de el libertad no conformar con ese so is detractor de el libertad avanzar y de milei resultar que ahora el de cambiemos ser él mejor de él mejor espacio lleno de radical dinosaurio tú votar por el peluca vllc chau espert,neu
ser que el dolarizacion solo servir para parar el inflación funcionar excelente en ecuador de ahí a qué haber hacer otro cosa mal ser otro problema milei siempre decir ese no que ser el solución para todo,pos
el diputada nacional del pro él sumar a el fuerte crítica de junto por el cambio contra el candidato presidencial de el libertad avanzar javier milei qué distinto ser agregar vidal,neg
en defensa de el verdad histórico el acto de el candidata a vice de milei destinado a reivindicar a el genocida en el legislatura de el caba ser repudiar por el organismo de dd hh que poner al descubierto el provocación por lucianabertoia,neg
empresarioscol carinosaespinal fedecafetero fedepanelacol colantaoficial mgomezmartinez dmarcordoba roelvarmo elpatriota luchar contra el adoctrinamiento con poder requerir nuevo ptds d derecho como vox youtub vallejo vs milei en a dos voz todo noticia,pos
jornalista do canal argentino todo noticia tn não sei como não previmos mas milei estar ganhar them lugar inusitado them santiago del estero them san juan them mendoza them córdoba them santa fe ele estar ganhar them todo tú lugar inclusivar yo bairro popular,pos
milei no tú jugar de frente solo grita él enogir y hablar de cosa que mucho poco gente entender decir él fracadado a 170 de el mejor economista del país no ser jugar de frente ser ser uno idiota loco y delirante,neg
daniel milei estar bloquear a todo acabar de bloquear a laura alonso y mucho más él decir q ni siquiera él arrobar ni él contestar nada tampoco él agredar él hacer por pensar diferente y el libertad de expresión uno candidato a presidente que no tolera al q pensar diferente,neg
todo noticia sumar a milei a jxc ser uno posibilidad patricia bullrich en desde el llano,neu
milei 2023,pos
elección 2023 massa volver a polarizar con milei y buscar tomar distancia del kirchnerismo,neg
sin nombrar él alberto fernández volver a criticar a milei negacionista ser el que hablar de libertad,neg
milei este lôcô,neg
nuevo encuesta del ceop argentina milei y massa al balotaje bullrich relegada cómo ser el votante de cada candidato página12,neu
milei ser massa x q el libertad avanzar no tener estructura a nivel nacional el massismo oficio para regalar él voto ser x ese q salio 1ro en paso y él razon x el q tú asustastar ya que el realidad contradecir tú en tirania k no haber garantia de votar milei = massa = eurnekiar,neg
el libertad no ser uno valor absoluto y no poder ejercer él sin estado para ayudarte con tu duda milei ser cavallo con peluca pero menos inteligente por ese mingo él este pedir que hablar menos en tv y mas con el perro esperar haberte ayudar,neg
mi postura ser bastante similar él que yo ayudar a decidir ser primero que mi criterio ser votar idea y el idea con el q más coincido ser el de el libertad 2do ir a el propuesta concreto milei él tener y ser buena en su mayoría el otro tener sólo slogan,pos
casi 200 economista alertar sobre el riesgo de el dolarización y javier milei él cruzar fracasados,neg
para criticar a milei tén q tener uno tongo en el estado,pos
el sorpresivo respuesta de china frente a el duro crítica de javier milei tn todo noticia,neg
giacomini sobre milei presidente el gente no ir a avalar ninguno reforma profundo en el sentido de el libertad el gente simplemente este hastiada él votar a el pero este a año luz de tener el cosmovision liberal,neg
gran paso para que el argentino ver como haber ser estafar y saqueado victoria villarruel planear auditar el indemnización del estado a víctima de el dictadura si javier milei llegar a el casa rosada infobae,neu
leer el derecha diario ser el página 12 de milei,neu
fuerte rechazo de up y jxc a el posible canciller de milei él que estar hacer ser entregar el malvina,neg
no tener cerebro no tú gastser milei este en otro liga tú ir a decir,neu
yo imaginar el millón de pibes decir yo voté a milei pero ahora que leer este artículo en página 12 hacer como tureno y voto a manuela castañeiro,pos
codigobair el candidato a presidente y gobernadora por el libertad avanzar lla javier milei y carolina piparo encabezar uno caravana que recorrer el calle de el plata junto al candidato local luciano guma,neu
quien entender a infobae primero que milei ser massa ahora ya no ser ahora ser uno peligro para massa y boomrich,neu
si ganar milei seguro yo embocar sin duda porque lalibertadteansar ser el segundo partido político de cri y massa en el interior del pais todo el lista de milei llevar a el q sobrar en el lista de massa y ese él poder comprobar saber quien ser quien en cada localidad,neg
javier milei viajar a miami sin agenda político ser a buscar tranquilidad total,neg
no ser de javier milei ni de el libertad avanzar el mensaje en twitter que decir el discapacitado ser uno gasto para el estado politico por reversoar,neu
el dilema de bullrich para no quedar afuero de el pulseado massamilei página12,neu
yo no ser votante de milei hasta ahora pero este de colectivo de intelectual pidiéndono votar x él que aberrar x el zurdaje corrupto q  yo llevar a este decadencia yo parecer abominable libertad de expresión y respetar al votante por favor bastar de cancelar opinión,pos
en el pueblo tú conocer bien,neu
estafador,neg
macri salir a apoyar a bullrich tener que aclarar que el apoyar con todo él que ese implicar sin agredir a milei como especular pero duer barba al mismo tiempo dejar en ridículo a arranca jxc con el dolarización no él hacer ruido,neu
milei y el judaísmo página12,neu
no ser el partido de milei él llamar parecido pero ser socialista q no entrar en ese mezcla q hacer,neu
elon musk él arrepinteír y borrar el mensaje donde él demostrar su apoyo a javier milei para el elección,neg
solo en uno sistema presidencialista uno irresponsable como este estúpido poder estar 4 año en uno cargo que él quedar enorme después él preguntar por qué el gente votar a milei,pos
pejacsevich estar ahora recaudar fondo para el campaña de javier milei algo que hacer uno mes   el revista noticia   revelar que estar hacer para patricia bullrich de hecho el propio pierre figurar como aportante de 3 millón de pesos según revelar   página 12 23,neu
massa definir el estrategia para polarizar con milei sin demonizar él para evitar que él despegar de uxp,neu
chaco capirodriguez con milei representar a el juventud que ya no él temer a el casta que él robar el libertad noticiasdelparán,pos
el iglesia realizar uno multitudinario misa de desagravio a francisco y a el pobre frente a el agresión de milei que llegar a decir que el papa ser el representante del maligno en el tierra y que el justicia social ser uno mierdo,neg
igual yo no ser uno promotor de jxc ni de kovadlof votá a milei y listo al menos estaremos uno tiempo con el misterio de saber qué mierda ir a hacer y cómo x ahí servir saludo,neu
  siempre él poder estar peor voto masoquista en el masoquismo suceder que el dolor y el displacer dejar de ser advertencia y pasar a ser metos aspiración y algo de ese parecer formar parte del voto a milei sebastián plut psiconalista páginar 12,neg
malvina crecer el repudio por el expresión de el hipotético canciller de javier milei,neg
el reacción de china a el provocación de milei el candidato él anotar uno roce con uno socio comercial clave para el argentina página12,neg
duro respuesta de el iglesia a javier milei por su crítica al papa francisco,neg
acabar de leer él que pusistar el 2 imagen ser de uno seudo diario creado por el que bancar el campaña de milei ser como yo pongar uno de página 12 o el destape no ir a opinar sobre algo que salir ahi,neu
el que quedar en carrera reconfiguran su discurso para el votación de octubre el estrategia y actividad de sergio massa javier milei patricia bullrich y el resto de el que él postular a presidente expectativo por el elección en santa fe,neu
para ricardo alfonsín macri ir a operar para unir él con milei instar a el ucr a romper con el pro página12,neu
masoquista voto masoquista en el masoquismo suceder que el dolor y el displacer dejar de ser advertencia y pasar a ser metos aspiración y algo de ese parecer formar parte del voto a milei sebastián plut psiconalista páginar 12,neg
cachañoqui cachanosis  uno viejo gaga que nadie registrar él él pasar difamar a milei y al espacio este ser uno de el famoso econochanta,pos
jajajajajajajajaj bien que c5n y páginar 12 ser así pero con jxc y milei jajajajajajajaj,pos
el iglesia él responder con dureza a milei por su ataque al papa francisco él él deber uno respeto particular página12 miley aprendar a respetar a el mayor uno vergüenza su maltrato al papa francisco,neg
ser como si él decir pagina 12 o clarin o el nación jajao a quien él importar milei ganar en primero vuelta con diario y medio tradicional en contra no él necesitar para ganar,pos
nuevo encuesta del ceop milei y massa al balotaje bullrich relegada cómo ser el votante de cada candidato página12,neu
quién ser victoria villaruel el vice de javier milei que organizar el homenaje a el víctima de terrrorismo tn,neg
gracias a milei este tipo dar clase sobre casta q ser todo él mismo alguno pregunta escuchar fundamento en absoluto libertad pd él aplico a todo el politico del partido q ser pero yo pasar este teacher por ese grafico con este foto el desesperacion x 1 voto,neu
este devaluación él pedir el fmi el semana pasado antes de recibir el 600 millón de dólares de anticipo tanto crónico paginar 12 estar operar en contra de milei para echar él el culpa ser operador del desgobierno zurdo porque recibir millón de el pauta publicitario,pos
aguantar hasta que ganar milei dogor,pos
el libertad acós denunciar por acoso laboral y sexual a uno candidato de javier milei en formosa,neg
siempre milei siempre el libertad avanzar todo contra milei,pos
milei presidente primero vuelta,pos
el final que no ser el maleficio de macri y el alarma por milei el shock electoral en el que quedar horacio rodríguez larreta después de el paso página12,neg
bullrich buscar instalar tema para profundizar su diferenciación de milei y él preparar para el debate,neu
el jefe de el uocra gerardo martínez sobre el reunión con javier milei yo gustar dialogar con todo,neu
retweeted tn todo noticia todonoticia el economista javier milei considerar que el gobierno ganar uno batalla pero el victoria ser pírrico haber comprar tiempo decir por su parte el diputado,neu
uno de el integrante del equipo económico de milei no ir a dolarizar si no haber dólares,neu
elegis informarte de página 12 ese medio ser ultra k que de noticia objetivo no tener nada en uno artículo literalmente poner balotagge entre ministro de economía sergio massa y el ultraderechista negacionista de javier milei info sin ideología él dudo,pos
  imprensa argentino reportar que o ultradireitista javier milei poderio ser o candidato mais votado das paso com 30 dos voto de acordo com todo notícia citar font dar casa rosado as coalizões governista union por el pátria e oposicionista junto por el cambio   show more,neg
milei buscar calmar a el mercado cumbre de su equipo económico en wall street con banquero e inversionista,pos
  eduardo van der kooy con javier milei en el rosca por todo noticia,neu
yo poner a leer página 12 y advertí que haber 6 nota con foto de sergio massa 6 nota con foto de gerardo milei y 0 nota ni foto de patricia bullrich sacar su concluisión,neu
el zurdo leer cualquiera titulo en pagina 12 y despu andar decir pelotudez como este ser responsabilidad de cada uno buscar el propuesta de milei sobre el educacion publica y no decir burrada como que él ir a acabar el universidad publicar,pos
  mira cómo él definir el diario inglés y liberal intemperante imprudente y extravagante el duro editorial de the economist contra javier milei el revista inglés criticar el idea neoliberal de dolarizar página12,neg
milei no él ver ninguno perfil todo yo resultar esotérico de mal gusto cuando no inmoral ni hablar de el inestabilidad emocional y su relación con perro muerto o su candidata terraplanista para mi no dar ni para ciudadano común,neg
no venir acá para guiar cordero venir para despertar león javier milei el parásito chorro hijo de mil p estar acojonado claro a él mejor haber que hacer uno auditoría a todo el estamento y alguno ir a correr vivo el libertad carajo viva argentino,pos
intelectual antik y milei página12,neu
el que decir que él ir el educación público o el matrimonio igualitario con milei escuchar el propuesta de milei o él leer en página 12,pos
cuánto salir y cómo ser el procedimiento para clonar perro que usar javier milei,neu
el mangazo de javier milei dos mil dólares para sentar él con él,neg
para wall street ser uno inconsistente desde el riñon financiero internacional él apuntar a milei página12,neg
quizás no tú salir el notificación porq no saber usar el red social en el q estar si seguís responder ser de hilo si decir q el proceso de dolarizacion como él plantear milei generar uno problema en serio tener q traerte el párrafo y subrayartelir como a el chico,neg
quién votarir a massa y quién a milei en uno posible balotaje según encuesta,neu
milei defender su plan económico ser uno estupidez decir que dolarizar conducir a uno hiperinflación,neu
elección paso 2023 el propuesta de milei el estrategia de massa y el interna de jxc tras el resultado del 13 de agosto página12,neu
por qué no aclarar su apoyo hacia javier milei hasta acá llego siempre haber algun interés de tras de cierto ideal gente que él hacer revolucionario a favor del pueblo él seguir haber x telegram pero ver que él apoyar al loco el joker argentino the end ya tener uno bipolar,neu
a milei él parecer barbaro ese él llamar libertad de competir si ser presidente preparate para tener él en el hall de tu casa,pos
hablar el cosa en serio quien ser el ingenuo que creer que milei ir a dolarizar si ser financiar por su ex jefe eurnekiar a todo este empresario él convenir que sigar en peso porque su retorno y subsidio él cobrar en peso él él hacer imposible si él dolarizar,neg
batakis hablar y él sumar 1000 voto a milei gracia por el campaña paginar 12,pos
jajajajar javierdelay bienvenido al mundo realla casta tú saludar va entender porque no alcanzar con solo ser presidente milei él pedir a massa que postergar el presentación del presupuesto 2024 hasta después de el elección general infobae,neg
este más que claro que existir uno coordinación entre político más medio de desinformación como clarin el nación págín 12 infobae para evitar el cambio disruptivo que ser milei en su negocio y status quo entender q este ser el madre de el batalla y que no él poder perder,pos
crecer el diferencia en el cgt por milei de el guiño de barrionuevo a el crítica de el moyano tn,neg
con fuerte cruz massa y milei polarizar en medio del relanzamiento de campaña haber perder el brújula,neg
andar al oculista y aprendé a leer y contar porque mi fecha de nacimiento ser 11369 y estar en mi perfil no sabés leer no sabes  contar o estás tanto viejo que sin lent ya no ver tener 54 y milei el mes que venir cumplir 53 si ser uno viejo meado milei qué ser a dormir bebé,neu
no querer ser uno agua fiesta saber q tú seguir por todo tu aporte al equipo de el libertad avanzar consejo hab él interrogar sobre modelos eco y termina en uno votación y si arrancar en votast y él termina con uno if condicional multiple que siempre ser con milei,neu
a bullrich no él atar ni el sandalia y a milei no él atar ni el cordón,neu
de el que criticar alguno escucho el propuesta de milei o solo leer el titular de pagina 12 y c5n,pos
argentino por qué junto por el cambio y milei querer vender el empresa público el agujero negro de el campaña privatizadoro página12,neg
macri ya vender que gobernar vía milei por leandro renou para página 12 del 200823,neu
the economist patricia bullrich cnn el cámpora págín 12 massa prenso obrera todo junto en contra de jmilei y ese ser musico para mi oído porque él verar caer y llorar el 22 de octubre,pos
loco valoro uno montón que tratar de combatir a milei pero por favor dejar de decir el siguiente huevada milei tranzar con el casta político lástimo que milei no querer formar parte de nuestro alianza milei cagar a el liberal que estar trabajar en su campaña,neu
filmus paginar 12 milei y pb no podriar estar mas agradecido,pos
ahora no estar claro si milei ir a   dolarizar,neu
crecer el diferencia en el cgt por milei de el guiño de barrionuevo a el crítica de el moyano,neg
ahora cristín kirchner y axel kicillof defender el estatización de ypf cuestionar a bullrich y a milei y decir que el fallo tener tufillo electoral,neg
