tweet_preproc,sentiment
él de milei no ser ningun cambio milei solo ser uno personaje que capto el discurso disruptivo y rtoda el manipujlacion que haber y haber pero a él que venir el idea de milei ser justamente no a liberar sino a someter cuando él que ser del sistema tú hablar de libertad 1,neu
pero milei gritar mucho,neg
elección 2023 milei él mostrar en el plata con uno dólar gigante y uno motosierra,neu
macri no decir que si ver a milei de frente él escupir el cara ser casi uno libertario,neg
chaber querés que el medio hacer algo más desde c5n a ln pasar por página 12 y radio a elección él atender a milei en cadena,pos
qué ofrecer javier milei el ciénaga técnica de comunicación y receta fracasada página12,neg
este vende humo de carlosmelconiar él único que hacer ser hablar del plan de milei y su plan alinear alinear alinear y tac hdp contar tu plan chanta sorete,pos
no entender el comparativo milei creer su propio partido no él ser de senador para otro partido y además suponer que tén razón ir a el cuestión principak por que no hablar de que ser violín en página 12 c5n y demá no llegar el noticia o si ser amigo no él decir nada,neg
elon musk el plan motosierra de milei él multiplicar por 20 bullrich ser uno tibio massa no saber que diar ser vllc,pos
patricia ser mi candidata decir macri y calificar como maliciosa a el versión sobre su respaldo al postulante de el libertad avanzar aunque no responder a el propuesta de milei de sumar él a su virtual gobierno por wernerpertot,neg
milei gobernar hacer 25 año ni enterado ir a votar a el de ahora mejor que el plan venir de 10,pos
elección 2023 así él ser a javier milei provincia por provincia mapa interactivo con el resultado del libertario en el principal distrito página12,neu
no pasar que no ser boludo y saber que milei ir a ser presidente y ser mejor alinear él que empezar uno guerra en este crisis argentino adema que milei haber decir uno monton de vez que su plan ser meter mas gente al mercado laboral y ese él beneficiar a todo incluido sindicato,pos
  che y en qué parte milei decir que ir a privatizar el educación terminar con el aborto de uno liberar el arma apenas asumir o que odiar a el mujer y el gay no él amiguir estar en google búscalo sino lee páginar 12 y revista sudestado como yo,pos
leer página 12 y pensar que el boludo ser el pibito que votar a milei,pos
uno argentino yo decir el voto a milei ser uno voto castigo el gente estar harta de el político si uno estar harto que él robir el casa tal vez prender él fuego no ser el solución jorge majfud contratapa de página 12,neg
ahora no estar claro si milei ir a   dolarizar,neu
el hipótesis de uno javier milei ganador desatar movimiento secreto de sergio massa y patricia bullrich tn,neu
el iglesia de salta también cuestionar a milei por su dicho sobre el papa,neg
javier milei aclarar desde que yo meter en política no insulté más a su vez el economista libertario apuntar contra jxc él imaginar si estuviéser todo el tiempo decir que bullrich ser montonera y meter bomba,neu
por ej mañana temprano planeo irme a pinamar pasar por carilar alguno día del finde y tras haber hacer mucho bosque algo de playa pescadito bar de tapa y strudel anochecer en car el lunes y ser cierto ni milei yo ir a sacar ese plan,neu
che pero en el video largo que publicar decir clarito plan de gobierno de milei publicado por el canal oficial de javier milei tomatir dos segundo de tu tiempo de escuchar él desde el minuto 15 00,neu
jxc dejar de llorar y presentar propuesta decir cómo eliminar el gasto político bullrich acostumbrado a pedir que él votar por que el k ser peor ahora no tener uno plan solo presento uno lista de objetivo solo milei decir cómo él hacer,pos
ahora hacer video como jmilei jajajar solución momentáneo para rascar alguno voto del fondo de el olla con milei él venir solución de fondo no migajar el plan platita tú él met en el orto,pos
el justicia social ese aberración el lema que javier milei elegir para el festejo el candidado de ultra derecho resignificar el que él ir todo página12,neg
318 el smvm a dolar blue indiferentemente a ese él estar muchísimo mejor él único que buscar milei ser romper todo el sistema estatal sindical educativo sanitario con el escusa de el economía y él decir no ser ninguno secreto y él apoyar ser simplemente idiota,neg
intemperante imprudente y extravagante el duro editorial de theeconomist contra javier milei el revista inglés criticar el idea neoliberal de dolarizar página12,neg
si ganar milei páginar 12 él ir a el quiebra,pos
nuevo ser tú sonar convertibilidad viste a quien ir a buscar para q él ayudar a macri el unico q traer al fmi ser macri y cia milei ser uno delirio tras otro querer poner como moneda al dolar q no haber imaginate q emitir peso a haber inflación camino a mas oscuridad,neg
tener casi 18 de gobierno kirchnerista y solo 4 año de jxc pero ser jugar de el mismo manera yo en él particular preferir malo conocido que bueno por conocer todo él q proponer milei ser inviable así estar él que ser seguro que el año q venir ir ser bisagra estar quién este,neg
increible como él este correr el velo que antro ser el politica que asco dar mas gana de votar a milei,pos
ganar milei en primero vuelta mabel,pos
paginar 12 general tema javier milei psicoanálisis neurosi versus psicosis marcelo rudaeff rudy por marcelo rudaeff rudy 26 de agosto de 2023 12 36,neg
acabar de leer él que pusistar el 2 imagen ser de uno seudo diario creado por el que bancar el campaña de milei ser como yo pongar uno de página 12 o el destape no ir a opinar sobre algo que salir ahi,neu
el periodismo no querer que ganar milei porque él cortar el pauta que tanto al kirchnerismo y jxc él gustar repartir milei ir contra el interés del periodismo que ser tanto responsable como el gobierno,pos
el viejo este votar por él menos 3 vez por liberal anti estado alzogaray  martinez de hoz no ser votar obvio pero aplicar su politica con consenso de época y caballo el politica de milei no ser distinto a ese que ya fracasar 3 de desocupacion habia en el 76,neg
organismo de ddhh llamar a repudiar el acto que él hacer en el legislatura porteño contra el política de memoria verdad y justicia ser encabezar por el candidata a vicepresidenta de milei y ser defender por referente de cambiemos por laura val,neg
  ayyy el payasesco y metaforico mesía de el política barato baratar el reacción de china a el provocación de milei el candidato él anotar uno roce con uno socio comercial clave para el argentina página12,neu
todo negativo él tener que fusionar con todo noticia si él único que hacer el dos ser pegar él a milei jajajo él él acabar el robo,pos
y milei también así qué de nuevo nada,neu
no él tratar de como ser felíz si no de comprender que vivir en sociedad de curar herida pero que tú decir tú solo ver que el dólar ser el felicidad tú hacer feliz votar a milei hacelo,neu
leo el nación leo clarín leo infobae leo página 12 leo el destape veo tn ver el destape tv ver c5n veo tv público veo a24 ser importante hacer él para poder entender y sacar conclusión de el magnitud de el crisis político social económico y democrático si ganar milei,neg
motivo para no votar a bullrich ex montonera no tener propuesta quito 13 a el jubilado massa actualmente ser ministro de economia y el dolar este a 730 motivo para no votar a milei no yo gustar su postura para el foto,pos
tener uno gran oportunidad para cambiar el historia de nuestro pais milei presidente libertad y dignidad para todo el argentino elección presidencial octubre 2023,pos
y milei que ser de mauricio mucho ambiguo,neu
él enterar el libertario en pleno programa el gobernador él retirir el apoyo a su propio error llamado milei,neg
el reacción del candidato de javier milei cuando melconiar él decir en el cara que ser imposible dolarizar,neu
de este tú hablar escribir marco novaro tn todo noticia todonoticia · 5h javier milei pasar de dinamita a petardo estrategia electoral o uno golpe de realidad,neu
hoy salir en página 12 el sincericidio de marcela pagano milei tener pensado usar el aporte del tesoro nacional atn a el libertad avanzar no necesitas hacer nada él matar solo ojo porque aunque no él voter después yo él tener que fumar 4 año,neg
parecer milei en el auto revoliar el dolar tendra apoyo de massa calculo ya que él hacer favor,neg
elon musk borrar el mensaje de apoyo a javier milei y el red él llenar de mem,neg
bueno yo también yo alegrar ya que milei ser el cuádruple de hijo de remil  puta y también representar al fracaso menemista así que también él querer bien lejos y que perder el lunático como corresponder,neg
el candidato libertario no parecer mucho capaz de pensar el política por fuera de el individualidad y el solución unilateral según theeconomistir milei ser uno riesgo para el democracia y tampoco parecer guiar a el argentina a uno mucho buen camino,neg
qué inconsistentar el oposición en su argumento para no apoyar el baja de ganancia e impuesto a el canasta bullrich decir de bajar retención cuando no haber productor agrario que no ir al dólar a cuánto él ir y milei decir de bajar todo el impuesto y ahora qué,neu
que el dólar estar a milésima de el 1000 peso ser el muestra de el decadencia mirar que al votar yo ir a fijar en el primero dama jo milei presidente 2023,pos
el iglesia de salta también cuestionar a milei por su dicho sobre el papa,neg
todo contra milei majul el medio perfil crónico págín 12 encuesta el 50 nooo el 80 creer que con uno gobierno de javier milei estar mejor que ahora el victoria de milei seguir dar que hablar el 78 querer uno cambio drástico,pos
él tener data que milei pasar en primero vuelta ser por ese,pos
el mangazo de javier milei dos mil dólares para sentar él con él revelación del orfebre juan carlos pallarols página12,neg
no defeir a milei pero yo parecer que no vivis el realidad hiperinflacion aumento de el pobreza dólar de 46 a 730 de qué justicia social estás hablar piba,neu
prat gay cuestionar a mauricio macri por su coqueteo con javier milei página12 via googlenews,neg
milei medir 1 50 o el loco 2 10,neu
congreso luego de que javier milei presentar uno carta para que él postergar el presentación de el ley de ley el oficialismo con el aval de sergio massa postergar el debate en comisión por considerar el sugerencia del libertario como razonable,neu
che pelotudazo no ser kircho voto a milei no haber caso todo el militonto de junto por el cargo ser retrasar mental,pos
cómo no ir a haber pánico con milei si estar adoctrinado hasta el chota hoy el cfo con largo experiencia en multinac citar uno articulo de uno economista de página 12 para explicar porcar el dolar blue no impactir en el economía él sacar a rebencazo como gaucho a vegano,pos
todo noticia javier milei el 90 mil muerte por coronavirus ser uno genocidio,neu
el coalición cívico ratificar su apoyo hacia patricia bullrich y criticar a milei no él tratar de romper todo,neg
obvio ir a coxistir pero milei hablar de libre competencia y cuando el 70 de el gente elijo el dólar él hacer el conversión forzado de todo el peso a dólares,pos
el clave del voto milei cómo por qué él que venir ser su techo o poder seguir crecer qué reacción ser esperable de el otro fuerza cuán abierto quedar el resultado de octubre página12,neu
el derecho de el isleño ser respetar el futuro canciller de milei hablar del reclamo de malvina,pos
ser más yo yo pelié con mucho por votar a macri y él votar igual yo putear con el k porque yo deciar que estar loco que ser rico que el padre que ser uno inutil aparecer uno verdadero cambio voto a milei y otro vez yo putear loco el hermana el perro ser uno bucle,neu
so is o tú hacer ser uno chiste a el que votar a milei yo importar uno huevo él que decir y a quien apoyar macri,neu
y quien tú asegurar a vo que no tú ir a cagar milei,neg
caraván de milei y píparo en el plata motosierra y dólar gigante en mano jmilei carolinapiparo lucianogumaok,neu
no quien hacer campaña por massa ser milei jamás deber haber permitir este desembolso que él permitir a massa hacer el plan platita,neu
carlos vo no tén ni idea de él que estar hablar so is abogado porfavor dejar de difundir miedo a el gente conoz mucho bien a milei saber que él jamás confiscar depósito ni nada parecido ese ya él hacer tu gobierno haber uno plan mucho serio de dolarización y estar explicado,pos
jjajaajar pobre virgo enojadito falso libertario tú en respeto a el libertad tener uno terrible cero andar mirar dragon ball mientras tú decir que hacer en el secta de milei actual kircho termos javierdelay lalibertadtransa,neg
ojalá cuando quedar tercero en el elección él disuelir junto y el pro vaya con milei,neu
milei según the economist el libertario radical él sentir más cómodo cuando hablar de teoría filosófico y economía su comprensión de el política y el comercio internacional ser confuso en el mejor de el caso y conspirativo en el peor,neg
ser que ese ir a ser compensar con emisión monetario al final perjudicar a todo encima el quita ser tanto para quien no tener uno mango hasta para él en nordelta ser plan platita gane milei o bullrich tener otro combo inflacionario,neu
no creer que milei este loco ese ser uno opinión tuyo mucho subjetivo por cierto para mi loco ser ser de izquierda tener evidencia empirico del fracaso monumental de ese sistema nefasto,neu
acusar a milei de ultra derecho cuando defender libertad individual social despenalización de el droga derechos homosexual separación de iglesia y estado educación sexual no estatal no milei no ser de derecha ser libertario,pos
que grave milei dólar= 720 inflación 170 pobreza 70 asado 3800 kg de pan 1200 kg de yerba 2700 12 medialuna 3000 jubilación yous 80 pobreza infantil 70 salario mínimo yous 90,pos
tucker carlson el periodista de el altright que querer entrevistar a javier milei,neu
ser anarcocapitalista como milei yo leer a rothbard huerta de soto anxo basto y a hoppe yo considerar liberalpaleolibertarioanarcocapitalistaminarquista genero fluido no binario y minarquista genderqueer en él real él perfectamente él que decir milei capo,neg
con cada opereta de el campaña contra milei él único que lograr ser despertar a el gente que todavía no él haber dar cuenta de que conformar uno solo élite que entre página12 y el nación solamente haber matiz dentro del mismo servilismo al poder global haber que agradecer él,pos
javier milei el candidato que tú hacer gaslighting cambio de discurso pos paso página12,neg
por qué no aclarar su apoyo hacia javier milei hasta acá llego siempre haber algun interés de tras de cierto ideal gente que él hacer revolucionario a favor del pueblo él seguir haber x telegram pero ver que él apoyar al loco el joker argentino the end ya tener uno bipolar,neu
qué pasar en el país si milei romper relación con china,neu
duro respuesta de el iglesia a javier milei por su crítica al papa francisco,neg
qué proponer milei uno plataforma de dolarización ajuste de jubilación y baja de plan social el propuesta de el libertad avanzar página12,neg
él que también hacer milei y villarruel de el libertad rancio pero no el nombra,neu
porque estar entre no votar y votar a milei si mal no recordar aquí nadie deber mirar a uno lado y deber saber que milei si levantar el bandera de el libertad desde que salir en tv,pos
si ganar milei seguro yo embocar sin duda porque lalibertadteansar ser el segundo partido político de cri y massa en el interior del pais todo el lista de milei llevar a el q sobrar en el lista de massa y ese él poder comprobar saber quien ser quien en cada localidad,neg
como de costumbre pagina 12 tergiversar el palabra macri nunca decir que integrar el fila de milei no confundir a el gente uds ser antipatrio paginar 12,pos
el dólar subir 1 7 en uno año yo ahogo con el envidia,neu
tú imaginar ser libertario e ir con volante de milei a el universidad turno noche que ser el turno en el que ir el que estar hinchado el pelota de laburar todo el dia y no él alcanzar para el alquiler,neg
presumir de ser tanto culto y ser notorio que desconocer de totalmente el historia argentino reciente acusar sin prueba descalifico agravio y cuando él responder de el mismo manera entrar en plan viudo dolido madure milei ser ud uno adolescente con acné y sexualidad sin definir,neg
en el pueblo tú conocer bien,neu
no decir que no poder garantizar que su plan funcionar nadie poder garantizar nada en política pero sí ser seguro que milei yo llevar a cao económico total hiper con probable anarquía y violencia,neg
che infobae lindo este el pauta imagen ultrapositivo a massa a el toma vino ni él nombrar y a milei él hacer uno campaña negrísimo,neu
  milei ser uno mentira nicolás morás contra el populismo libertario mariafdacabal,neg
el ingeniería de el disputa económico con milei,neu
si con youd 54 000 millón dolarizábir a 30 pesos entonces con el youd 60 000 millón que decir milei que ir a conseguir no poder dolarizar porque el dolar este a 750 tú él contradecir cada 2 minuto,neg
en defensa de el verdad histórico el acto de el candidata a vice de milei destinado a reivindicar a el genocida en el legislatura de el caba ser repudiar por el organismo de dd hh que poner al descubierto el provocación por lucianabertoia,neg
recomeir leer el libro que escribir juan gonzález sobre el vida de milei el loco el comentario estar en el diario páginar 12 de argentina,neu
  exclusivo milei querer a sturzenegger para el bancocentral el libertario que no incendiar el entidad monetario como haber prometer iniciar conversación con el ex titular del bcra durante el gobierno de macri nota completo acá,neu
yo imaginar el millón de pibes decir yo voté a milei pero ahora que leer este artículo en página 12 hacer como tureno y voto a manuela castañeiro,pos
pallarols decir que milei él pedir us2000 para cenar con él y el libertario anunciar que no usar su bastón tn,neg
no tú estar hablar de milei libre competencia de moneda no ser solo 2 moneda como proponer pb que encima querer usar el dólar solo para uso contractual para el libre competencia no haber ninguno trar así que no ser inconstitucional,pos
tú hacer uno pregunta él crees algo a c5n y páginar 12,pos
pero si ser cierto tenés uno página web donde el plan de gobierno estar resumido y haber ciento de hora de entrevista donde él él preguntar a milei sobre el plan y el haber ir explicar su propuesta en cada uno ser cierto ser el único que tener potestad de explicar él,pos
yo muero de risa cuando tratar de loco bélico a milei pero ser el único que defender con demencia algo que él molestar y todo opinamos igual que este sr y hablar con conocimiento por que solo defender el verdad con uno realidad que demostrar que tener razón,neu
milei morder el anzuelo melconiar él consolidar como el espada económico de bullrich y enstusiasma en jxc,neg
en ese página él cotizar a 7070 al dólar a ese querer llevar yo este mamarracho de milei bah no ser él ser el imperio yanquisionista,neg
el dicho de el eventual canciller de milei sobre malvina reactivar el cruz entre el oficialismo y jxc,neg
al libertario milei él catalogar como a mi de extremo derecha a tú igual ser el trifachito,pos
el anticasta ir a gobernar con el peor casta milei querer a sturzenegger para el banco central el libertario que no incendiar el entidad monetario como haber prometer iniciar conversación con el ex titular del bcra durante el gobierno de macri,neg
por supuesto q sí él pasar información que quizá usted no tubo a tiempo antes de emitir juicio a el ligero no solo el libertad avanzar saber él q milei decir sobre el agenda también él saber otro espacio mondino también él pronunciar en contra recientemente saludo desde cba,neu
en que milei ser libertario,neg
ver agoro no todo noticia que possivelmentar milei tenha 30 no pasar junto e kirchnerismo 25 cada um,pos
libertario llamar a votar a uno político y legitimar al estado ancap escanor milei liberal,neg
el dolar izacion exitoso de ecuador que decir milei tener uno terrible historia leer él que hacer el presidente para llegar y fijatir él que seriar en argentina,neg
viaje al plan motosierra de milei primero estación uno país sin coparticipación el ultraderechista arrasar en el interior y ahora buscar dejar tierra arrasado página12,neg
de el que criticar alguno escucho el propuesta de milei o solo leer el titular de pagina 12 y c5n,pos
como él autodefinar este tipo al hablar de el dema basta de este tipo político impresentabl en el argentina votar a él nuevo al cambio milei 2023,pos
el problema ser cuando uno antropólogo devenido por decisión propio en internacionalista desde página 12 incluir a milei en uno internacional fascista junto al húngaro,pos
milei él ataca solo hacer cosa contrario a el que gritar y ir en contra de él que proponer barrionuevo ya hacer él que saber él dar el abrazo de oso tú preparar el garganta para cantar el marchita con el gatito el sindicalista no él dar nada gratis jxc goglear el plan,neg
tener uno plan,neu
él decir il manifesto diario de el izquierda italiano ser como q él decir página 12 y a saber si el nota no estar escrito x alguno corresponsal argentino q militir en p12 ambito financiero tiempo argentino y afín no yo gustar milei pero uds estar estar desbocado de odio mamucho,neu
mas valer tarde que nunca jxc yienir uno agenda socialdemocrato y sin plan economico milei ser el unico transparente en ese sentido y limpio ya que ser nuevo en el politica y mostrar su plan claramente,pos
el propuesta de milei espantar el movimiento social oficialista preparar uno acto con sergio massa,neg
che fantino tenia razon con q el plan ser empezar a decir q él caer milei ser demasiado obvio,neu
opinión el viaje del papa a el argentina sólo depender de su salud no de uno eventual triunfo de javier milei,neu
ajajar ajajaja gracias milei este unir a el rata que saber que él ir llego el momento de cambiar,pos
escuchar a bullrich hablar mucho sin decir nada sin uno plan concreto en el tiempo y sin fundamento o sostén a milei gritar como chancho atado con alambre y a massa hacer campaña con guita que yo robar de nuestro impuesto después él enojar cuando decir que todo ser mierdo,neu
páginar 12 juntar voto para milei,pos
a ver mabel silvia melconiar ser uno payaso y tragatir otro sapo antes él ofrecer su plan a kristina a tú él doler javier milei boomrich no ir a ser más que el tapa de uno libro que él no escribir,pos
este mal interpretado al profesor jhsoficial ya que el hablar en uno supuesto de que milei tener idea similar que no tener no este hablar de legitimar el sistema de voto,neu
por último bcra tener 120 mil millón en título público que convertir a precio de mercado del dólar ccl termina con el bola de nieve de el leliqs además el argentino fuera del sistema tener 270 mil millón de usd con el medida adecuado volver,pos
otro decir q no entender uno pomo de él que decir milei pero ya no soportar más a el chorro no él como ser uno dólar nunca ir a tener uno en el billetera pero estar harto de el chorro por él pronto mi hija ya yo decir que no volver más al país que aquí no querer vivir,neg
seguir propuesta no partido político como el termo de cristina o el ciego de jxc con el plan natural de melcoliar este país estar echo pedazo por dónde él mirar dejar el conspiración y respetir el voto de el gente,neu
  lindo panel armar tn para dialogar sobre el actualidad uno operador de medio de león uno futuro mercader de órgano y pibes milei uno psico violento sehinkmar y uno consultor que aplaudar el absurdo de canoso todo el noche en a24 giacobbe todo noticia si claro,neg
quien entender a infobae primero que milei ser massa ahora ya no ser ahora ser uno peligro para massa y boomrich,neu
lamentablemente haber mucho gente enojado considerar en entremateymate x lt9lider el periodista de página 12 tunykollmann en relación al importante resultado electoral obtenido por javier milei en el paso,neu
ay lucianitar tén que ser pelotudir para subir algo de página 12 que tener el tapa más negro que tatuajar del pj milei presidente 2023,pos
el mini milei vivir el libertad carajo vender tu órgano para salir de pobre,pos
el inflación por uno lado ser global con suba d wti y por el otro el irresponsabilidad d milei con su verso d el dolarizacion q hacer disparar el suba del dólar en 2 pierna uno antes d el paso y el otro c resultado cyou c 200 pto d subir de 400 a 600 y luego d 600 a 800,neg
ups pero el casta javier milei reconocer que trabajar para el genocida antonio bussi uno curioso manera de entender el libertad página12,neg
el amor de nuestro perro ser incondicional el de el casta ser condicional a el interés que vivir el libertad milei genio en primero vuelta,pos
a todo el viejo meada que él peguir a milei él merecer que él cagar de hambre ser tonto o él hacer llegar a aprobar ese presupuesto ahora y yo condenar ya ser milei o bullrich el presidente,pos
ser correcto el sigo más en diario porque ver más claro hacia donde operar en peso tener en cuenta que el dolar estar a uno declaración de milei o jxc de disparar él y ver que nq y ser retroceder a tomar liquidez y subir ggal él ir a acoplar en breve,neu
no tú crear conocer a varios radical que votar a milei uno mucho amigo mio alfonsinista a morir yo contar que cuando entro al cuarto oscuro ver el boleta de milei y decir ya ser,neu
después él lamer el qlo a milei al final macri ser tanto panqueque como massa todo igual,neg
