tweet_preproc,sentiment
sin nombrar él alberto fernández volver a criticar a milei el que hablar de el libertad ser negacionista tn,neg
tn todo noticia juán viale intervenir con el campana para frenar el grito entre patricia bullrich y javier milei significar que tú tenés que callar a través de googlenews,neg
isla malvina para javier milei y su asesor el último palabra él tener que tener el británico,neu
vo podes intentar cambiar el pensamiento y actuar de todo el mundo y vas a fallar porque no ser posible el sociedad ideal no existir ahora ser realistas el plan de milei no ser el mejor entre ese el plan de massa o bullrich si ser que existir,pos
javier milei ser parir por el crisis de ingreso cuál ser el principal factor que explicar el crecimiento de el ultraderecha página12,neg
ser que el dolarizacion solo servir para parar el inflación funcionar excelente en ecuador de ahí a qué haber hacer otro cosa mal ser otro problema milei siempre decir ese no que ser el solución para todo,pos
vivir el libertad carajo tú cantar tu cuarenta junto x el cargo milei 2023 jmilei,pos
milei estar más loco pero de forma distinto,neg
él meter uno loco a mi clase de el nada decir que yo ir a morir y que por qué no votar a milei ayuda que miedo,neg
milei él pedir al gobierno que no presentar el presupuesto 2024 con el argumento de que el libertad avanzar junto por el cambio y unión por el patria salir empatado en el paso,neu
no él poder copiar en algo más a milei faltar que llevar uno dólar gigante con su cara y otro de uno peso igual para su propuesta bimonetario,pos
vivir el libertad carajooooo milei 2023,pos
por ese cavallo él equivocar ser su reacción apacionado y su necesidad de explicar al detalle bajar a concepto terrenal el análisis de su propuesta él que hacer que hoy él sigar a milei,neu
pero vivián en c5n cronico y pagina 12 decir que milei ser macri periodista por favor pónganse de acuerdo mileimacri 2023,pos
y milei decir ese porque el estado actual ser así y ir relacionado con el impuesto y al robo de el político dejar de hacerte el libertario si so is uno k de acá a el china,pos
no cachir que hiciste,neu
el sorpresivo spot publicitario de javier milei en el que no hablar de el casta ni el dolarización tn todo noticia,neg
intelectual llamar a no votar al candidato libertario javier milei y él considerar uno amenaza para el democracia,neg
milei trabajar para cambiar el argentina para ese ser necesario uno reforma laboral con quien quer que él juntar en serio ser tanto limitar el sistema sindical este mal pero x ahora ser el que haber y el presidente tener que arreglar con el sindicalista en serio dar verguenza,pos
mapa electoral en buenos aires quién ser quién en el lista de javier milei de benegas lynch a el dipy página12,neu
el sorpresivo reacción de el principal diario del mundo ante el triunfo de javier milei en el paso tn todo noticia a través de googlenews,pos
resultado escrutinio definitivo milei bajar del 30 massa y bullrich él acercar elección paso 2023 página12,neu
puro humo a página 12 él convenir el polarización milei massa,neu
mendoza investigar a uno docente candidata de milei que hacer campaña mientras estar de licencia médico,neg
el ballotage tener que ser entre patricia y milei ser cierto pero creer que acir el que este jugar en desventaja porque no tener plan platita ni atención de el medio ser patricia y creer que ser el mejor sino el único opción por ese haber que apoyar él,neu
milei decir q querer cerrar el bco central y sturzebegger aclarar q el trabajar para bullrich no para el no tener uno plan todo él q decir ser delirio no tener uno equipo de trabajo no temdrar gobernador ni intendent no tendro respaldo en el senado este ir a votar,neg
yo recordar cuando doxear a uno periodista de página 12 pre pandemiar cuando relacionar al votante de milei con el movimiento incel,pos
el comparación ser ultra falopa pero igual para mi milei hacer mal en atacar él por ese ser que él antes él elogiar todo el tiempo y no ser que él haber enterar ahora que ser montonera quedar medio hipócrita para mi deber atacar él por su absolutamente nulo plan económico,neu
macri pronosticar uno balotaje con milei y respaldar a bullrich ser el único que poder liderar uno cambio,neg
en formosa hacer poco mes insfer ganar con el 80 de el voto el mes pasado milei sacar el 40 vo pensa que ese 40 de el formoseño leer a nozick y rothbard entre mayo y agosto y él hacer libertario ser voto kirchnerista que votar a alberto en 2019,neu
por ese haber uno reforma fiscal drástico detrás de este reformo que tener que ser creíble y sustentable políticamente nadie ir a tomar ese nivel de riesgo a menos que haber uno gobernabilidad mucho robusto para imponer el plan milei él tener mmmmm,neg
milei ya gano lograr que el sociedad reclamar solución a el político que vota desde 1983 lograr que 75 banquero de él mas importante estir escuchar por mas de 5h su plan si ser uno basura como el nota que seguro él distir like a el 30min él haber despachar,pos
mas que quedar conforme yo parecer que él tener que conformar mm no querer demoler a milei y no él ir a hacer,neu
a milei él parecer barbaro ese él llamar libertad de competir si ser presidente preparate para tener él en el hall de tu casa,pos
en definitiva tu palabra no aportar nada pq el impuesto ya ni siquiera él llamar a el ganancia sino a el ingreso en serio crees q argentina tener q ser pionera a nivel mundial eliminar uno tributo así entonces no él poder tratar de loco a milei x proponer cosa parecido,neu
loco no poder debatir el idea nadie estar hablar de milei no tén ni uno idea que defender con tú el dólar de 730 pasar a 3000 6000 o a 10000 porque el bimonetarismo ser ese y encima sin hablar de el leliqs ni tú saber que chotar hacer ni uno idea tener,neu
suponer que ganar milei no ser él mas lógico que todo el mundo huir al dolar blue el precio él disparar y generar uno mega devaluto,neg
no él creer el cara de ojete que tener cuando ganar milei no decir él mismo,neu
si resultar balotaje entre massa y milei obvio no él ir votar pero no saber si no ser sanador uno gob del demente q obviamente durar 6 mes y uno barajar de vuelta en el política este año sólo haber mierda para elegir que si no tener miedo a qué a uno dólar a 700 o infla de 130,neu
legalizar el venta de órgano no estar en el plan de gobierno de milei pero ya ver que el mi cuerpo mi decisión sólo él aplicar a el feto ser decir a quien él poder considerar otro ser humano y no partir de su cuerpo ser fascinante,neg
quién votarir a massa y quién a milei en uno posible balotaje según encuesta,neu
yo voté a uno gobierno que priorizar el institución y dejar uno dólar a 43 mucho él llamar tibio mucho de acá descontento con bronca votar a fernandez y así yo estar ir seguir enojado con el político y para probar y ver uno cambio radical él votar a milei,neg
hablar de que milei hacer campaña populacho y después él poner a mencionar al perro jajajajar este señora ser recordar como el peor opereta de el época de cambio,pos
por qué javier milei no ser ni anarquista ni libertario artículo de luis caro figueroa en via iruyacom,neg
javier milei él pasear por el plata con uno dólar gigante con su cara cómo él ver el caravana desde el altura,neu
este chorro macrista dar receta al vender humo milei él pasar,neu
yo creer que el plp en general no yo tomar como portador de el verdad apoyar a milei pero ser 100 creyent que por él menos por el próximo década a argentina no él poder volver en mi caso personal cuando él terminar el plan de 35 año de milei él analacer,neu
  javier milei volver a afirmar que convocar a mauricio macri en caso de ser elegir presidente en ese línea el candidato libertario él mostrar abierto a formar alianza con otro espacio poder haber uno alianza con todo el que adherir a el idea de el libertad show more,neu
ser libertario cómo milei,neu
opinión mauricio macri patricia bullrich y sergio massa todo giran alrededor de javier milei,neu
realizar uno mención hacia el diputado jmilei su participación en tn todo noticia dejar el nota completo de benegas lynch participación de milei en tn albertobenegaslynch javiermilei lalibertadavanza,neu
por que alguno boludo decir que su candidato ser milei,neu
y el eduardo y pablo en el pase él olvidar de decir que barrionuevo ser esposo de el camagno que ser de massa votar a milei ser votar a massa plan b de cristina y el no él ver con máximo en bs as correr q él bancar el campora no él y zamorar repartir voto ser cri,neg
patricia bullrich y javier milei violencia como propuesta el país frente a uno encrucijado página12,neg
vivir el libertad carajo javier milei el próximo presidente de el querido argentino javier mi ley yo mexicano hermano latinoamericano rindo apoyo desde el ciudad de méxico ciudad capital infernal del pecado original va a ganar y el ir a romper jmilei gobiernoargenti,pos
finalmente javier milei él vacunó contra el covid19 para facturar necesitar dar conferencia en todo el país y en el exterior tn todo noticia,neu
milei no tú jugar de frente solo grita él enogir y hablar de cosa que mucho poco gente entender decir él fracadado a 170 de el mejor economista del país no ser jugar de frente ser ser uno idiota loco y delirante,neg
el sorpresivo respuesta de china frente a el duro crítica de javier milei tn todo noticia,neg
faltar que él preguntar a milei que opinar sobre bajar ganancia yo haber gustar saber que pensar al respecto,neu
inflación anual 300 jubilado morir él de hambre sin llegar siquiera a fin de mes 7 de cada 10 niño no tener educación ni para comer dolar 730 50 de pobreza y 10 de indigencia estar al borde de el peor de el crisis por culpa de massa milei o ezeizar,pos
excelente entrevista de radio a álvaro garcía linera no culp a el gente de abajo por darno el espalda tras el victoria de javier milei en el paso página12,neu
pregunto con el dolar a 725 si él poder comer xq reguerdo q con el dolar a 45 y el aumento salarial ser con clausula gatillo todo el medio milei y el k deciar q el cemento no él comar coherencia por favor,neg
el clave del voto milei cómo por qué él que venir ser su techo o poder seguir crecer qué reacción ser esperable de el otro fuerza cuán abierto quedar el resultado de octubre página12,neu
cuanto jardín de infante volar según vos haber alguno si haber alguno casi él cual este mal ser realmente uno plan sistemático el que haber para volar jardín tú aclaro a bullrich el aborrezco para que tú quedar claro que ser él que pensar de ese mujer,neu
paso 2023 ganar el fondo milei y el poder judicial pero solo perder quien tirar el toalla antes de tiempo catorce apunte de el elección del domingo página12,neu
no como el plan que presentar milei que ser uno acolchado meado,neg
dianar si nuestro aún indeciso compatriota tener el fortuna de recibir ese luz de inspiración en el glorioso instante de el votación y salir milei tener el sensación de que usted ser el intercesora de el que ir a comenzar gatear por el camino de el libertad,pos
che que onda él estar bajar punto a milei noma en pagina 12,pos
y yo tbien trabajar uno año duro en usar ser yanqui ahorro ponelir 10 mil dólares y venir a vivir acá entre massa y él q ir a hacer milei el dólar ser 2000 mil pesos uno dólar vivo 3 año en car como uno bacán,neu
masoquista voto masoquista en el masoquismo suceder que el dolor y el displacer dejar de ser advertencia y pasar a ser metos aspiración y algo de ese parecer formar parte del voto a milei sebastián plut psiconalista páginar 12,neg
loco si no pagar impuesto tener que ir preso destruir a pequeño empresario y ese no ser capitalismo hasta su amado milei estar contra el empresaurio,neu
que importar si seguir el estrategia de quien ser al final estar para aprender y lograr cambio benéfico a largo plazo y no de turno si milei ganar arg obtener dolar de ahí en adelante ahí q cosechar sabiendolo hacer y ver el fruto nadie querer el continuidad de lamento,pos
y pero en jardines tú reiterar el pregunta ser uno plan sistemático volar jardín con bomba cuanto haber haber realmente alguien,neu
so is de brown de adrogue segui a blogbrown y entérate de todo noticia actualidad resultado y más,neu
como no tener problema real él él inventar,neu
macri siempre ser uno cobarde que yo arruinar milei él respetar mucho al pedo no importar saber que ser milei y yo contra el mundo vllc,pos
jajajaj lanatar llorar porque milei no querer ir a su programa y acto seguido él empezar a matar tú ir a morir como el sapo explotado de bili y progresismo que so is gordo mercenario hijo de puta ex pagina 12 actual clarin,pos
claro y todo ese gente que tener su dolar en paraíso is fiscal él él ir a dar a milei para que el yo él cambiar por mi peso y el título del bcra no valer nada y adema el dolar ser uno moneda en decadencia el que tener guita de verdad no ahorrar en dolar,neg
el pelotudez que haber que leer maaamita massa devaluó más del 50 nuestro moneda y genero 50 de pobreza y 10 de indigencia 150 de inflación y uno dólar a 740 el plan platita no él ir a funcionar este vez el gente no ser ignorante ya despertar milei o ezeizar,pos
ser patobullrich contra todo el poder político el poder económico contra el dupla massa milei con medio propio c5n crónico tv tn canal 9 telefir el destape red canal de cable radio diario páginar 12,neu
oigar javier milei decir que ser a nyc a reunir él con inversor saber que alto bolacero el gente que milei decir que estar en el reunion ni él enterar que milei el habia invitado y el que ser él advertir que su plan economico ser uno desastre holar abismo,neg
dólar evitar que político vividor como él que hablar contra milei él metar mano a el dinero público vío devaluación él él decir por experiencia vivo y padezco en venezuela,neg
no no él decir páginar 12 ni el izquierda diario ser the economist milei theeconomist,pos
  milei ser uno mentira nicolás morás contra el populismo libertario realsantig,neg
uno dólar 700 uno de el principal asesor económico de javier milei asegurar que el candidato libertario tener uno plan de dolarización mucho concreto si llegar a el casa rosado pero advertir que no él poder llevar a cabo si no haber dólar no haber milagro decir,neu
vivir el libertad carajoooo milei presidente,pos
escalar el cruz entre patricia bullrich y javier milei ahora por el pasado montonero de el candidata de jxc quien replicar el crítica del libertario,neu
argentinar el diputado argentino javier milei jmilei del partido llibertadavanza él afirmar favorito en intención de voto para el elección presidencial de 2023 video cortesía todo noticia,pos
cuando juannapoli ser con epstein a pedir apoyo para el plan de milei el inversor ser contundente para argentina no haber ni uno solo dólar este ser el genio que él creer que ir a gobernar,neg
  el oficialismo convocar a milei por su pedido para presentar el ley de presupuesto después de el elección en el encuentro entre el candidato libertario y el oficialismo participar cecilia moreau presidenta de el cámara de diputado y el diputado carlos heller,neu
milei tú ser de el casta economico todo el vida garcar a argentina tú ir a suicidar políticamente ser k y tú hacer el libertario andaaaaar,neg
mondino decir a 90 milei hacer mes decir menos por obvia razón hoy deber ser más después de el elección este él ir al tacho y no estar el dólar a 750 no entender cual ser el contradicción,neu
voto masoquista en el masoquismo suceder que el dolor y el displacer dejar de ser advertencia y pasar a ser metos aspiración y algo de ese parecer formar parte del voto a milei sebastián plut psiconalista páginar 12,neg
amlo criticar a uno economista libertario de carrera ese solo ser bueno para milei,pos
sergio massa y patricia bullrich seguir detrás del fenómeno milei pero buscar reencauzar su campaña a uno mes y medio de el elección infobae,neu
holar aca tén el plan si quer tú enviar todo video donde él explicar,pos
codigobair el candidato a presidente y gobernadora por el libertad avanzar lla javier milei y carolina piparo encabezar uno caravana que recorrer el calle de el plata junto al candidato local luciano guma,neu
tn todo noticia javier milei reaccionar a el condena de cristina kirchner por el causa vialidad él acabar el cuco a través de googlenews,neu
multitudinario misar en respaldo al papa franciso frente a el agravio de javier milei rechazar el injuria mentira e insulto con uno acto en el   parroquia de caacupé página12 argentinosmemorio memoriaverdadyjusticia,neg
el hipótesis de uno javier milei ganador desatar movimiento secreto de sergio massa y patricia bullrich,neu
carlos bianco achicar el estado ser menos policía menos chaleco antibala menos patrullero y peor salario el jefe de asesor de kicillof hacer balance explicar plan y analizar a milei pagina12achicar  el estado ser uno excelente medida,neg
o también el junta militar haber asumir el poder total de modo que ser sólo responsable de su acto ante dio y el historia algo mucho parecido a él que pregonar j milei a laje g álvarez y demás político neofascista disfrazado de pensador de el libertad,neg
ser él mismo fijate a quien vota este mujer ir a entregar el isla malvina por vacuna y después yo decir vender patria a yo ser igual a el k votar ala verdadero opción el libertad avanzar milei presidente villarruel vizar mondino canciller,pos
pero cómo no ser que sin gobernabilidad ser imposible para milei él juntar con el sindicalista que deber hacer él para presentar él su plan tú a caso querer que milei no poder gobernar siempre totalitario el radical,pos
fantino ser uno operador de milei desde su creación y vo también por que so is mucho vivo para comerte ese chicana ya este hablar de el sociedad psicótico ser que yo querer vender uno loco el irresponsabilidad de llevar a neron a el rosada no tener presedent,neu
  imprensa argentino reportar que o ultradireitista javier milei poderio ser o candidato mais votado das paso com 30 dos voto de acordo com todo notícia citar font dar casa rosado as coalizões governista union por el pátria e oposicionista junto por el cambio   show more,neg
que bueno ya el mufo ahora hágalo con milei,neu
  informações preliminar divulgada pelo canal argentino todo noticia tn apontam que o candidato dar direito javier milei obteve uma votação expressivo e pode ter ultrapassado o candidato governista sergio massa,pos
y si yo venís con que pato ser el solución preferir a uno loco que si saber como terminar su frase al menos él no depender de uno señor que vender fideo con tuco o de uno ex presidente que tener que salir a dar su apoyo milei no ser dio ni de cerca pero él demá ser,pos
porque mucho especular con milei incluso el virgo de milei no haber p0ronga que él venir bien incluso a quien votar al virgo,neg
milei ser libertario hablar como el libertario del sudeste de eeuu anarquista y anticiencia nada que ver con liberal autentico ni siquiera con libertario del pasado,neg
ser como si él decir pagina 12 o clarin o el nación jajao a quien él importar milei ganar en primero vuelta con diario y medio tradicional en contra no él necesitar para ganar,pos
hoy el nación clarín y página12 explicar qué ser el anarcocapitalismo de milei moreno él decir él explicar él difundir hacer mes sino año que el pueblo argentino él entender de uno buen vez haber que escuchar atento y regularmente a guillermo moreno,neu
este devaluación él pedir el fmi el semana pasado antes de recibir el 600 millón de dólares de anticipo tanto crónico paginar 12 estar operar en contra de milei para echar él el culpa ser operador del desgobierno zurdo porque recibir millón de el pauta publicitario,pos
a este altura parecer más fácil enviar uno cohete a saturno que dolarizar cualquiera tú prestar uno cohete milei dolarización dolar bullrich,neg
milei ser uno porqueria uno loco que él gchaber a el hermana hablar con su perro muerto y ser cómplice de político que reivindicar el dictadura argentino del 76 además ir a perder tarde o temprano,neg
el mejor vendedor de humo que ver en mi vida carlos melcochantar recorrer el medio criticar a javier milei pero hasta ahora no saber su plan para bajar el inflación solo él escucher alinear alinear alinear tack así ir a bajar el inflación,neu
hiperinflación milei él pegar de nuevo,neg
jornalista do canal argentino todo noticia tn não sei como não previmos mas milei estar ganhar them lugar inusitado them santiago del estero them san juan them mendoza them córdoba them santa fe ele estar ganhar them todo tú lugar inclusivar yo bairro popular,pos
hasta 2027 milei debera tejer alianza a mal que él pése para poder aprobar el modificación que hacer falta para llevar cabo el reforma necesario luego de ese fecha deber tener mayorio a partir de ahi comenzar el juego de verdad,pos
sergio massa cargar contra el política económico de javier milei y patricia bullrich tn todo noticia,neg
el candidato presidencial de el libertad avanzar lla javier milei decir que uno empresa poder contaminar uno río todo él que querer afirmar que el valor del agua ser cero y proponer el apropiación de ese cauce por parte de interés privado,neg
imaginatar él impresentable que ser milei que yo hacer estar de acuerdo con pagina12 y georgina barbarossa al mismo tiempo en el mismo tuit javierdelay mileiesmassa mileieskolectorak,neg
formós uno militante de el libertad avanzar denunciar a uno candidato de milei por presunto abuso sexual y acoso laboral,neg
el k enviar al mejor por así decir él mirar ser tu voto pero como consejo votar a milei de todo el que él presentar el al menos tener uno plan y no estar sucio luego si llegar al gobierno y no tú sastifacce podes echarmelo en cara hah,pos
el propuesta de milei estan gratis en su plataforma electoral para saber el de boooomrich tener que comprartir uno libro que obviamente él no escribio,pos
cada vez que escuchar a bullrich más gana tener de votar a milei y claro por qué votar a alguien que hablar sin decir nada por qué tener que votar a el candidata sin propuesta y sin plan económico yo hacer uso de el lógica,pos
tu sabes hasta dónde poder llegar en uno sistema que limitar tu libertad así que por qué no construir uno comunidad que él enfocar en el estabilidad social y ser capaz de erradicar el pobreza con total transparencia de gestión descubrir de él que ser capaz,pos
milei presidenteechaber uno vistazo al vídeo de tn todo noticia tiktok,pos
tú perdistir el mileidolar y el motosierra jajsjdjja,neu
el modelo de milei ya fracasar hacer cien año y el solución ser el justicia social,neg
para criticar a milei tén q tener uno tongo en el estado,pos
  el candidato presidencial de el libertad avanzar javier milei elevar formalmente uno comunicado al ejecutivo para que evalúe retrasar el presentación del presupuesto 2024 previsto para este viernes,neu
en el encuesta de ayer de todo noticia ir arriba de patricia milei yo no tener nada en contra de ese sr pero creer que necesitar uno poco de orden necesitar uno poco de paz y que no yo gritir,neg
en realidad atacar a milei porque no entender nada si entrar al feed seguro ser telam páginar 12 c5n etc él demá él deber tener todo bloqueado entonces al vivir en uno realidad alterno hablar sobre ese realidad donde javier milei ir a cerrar el escuela y hospital,pos
este capitulo ya él ver,neu
el boludito de milei querer tapar con uno foto de uno viejo meado el cagada que él mandar durante todo el semana con mondino entregar malvina a el inglés no conseguir uno solo dólar con el banco hasta entregar jubilación e ypf a fondo buitr,neg
ser por acá muchacho a seguir firme dar el batalla,pos
antes de milei el palabra estado y libertad no ser popular amiga y antes de milei nadie hablar de uno capital humano tomar tranki nomás,pos
como milei queni siquiera ir al congreso,neg
para el que seguir desinformado milei no querer privatizar ni el educación ni el salud no ser proponer ni nunca él ser dejen de mirar c5n,pos
este tipo este para el borda menos mal que el chizo de el renga él cortar con él del tema porque él estar arruinar creer él leon el tipo jajajaj aunque él haber merito en el zoo jajajajajajaja milei tú ir al pasto loco de mierda ya no te aguantar mas,neg
ser que ni de economía él interesar por aprender milei querer dolarizar cuando el mundo él querer alejar del dólar desde 2019 post covid usa haber crear el 80 de el dólar existente en el mundo el dólar reportar uno 13 de inflación y tú creer que ahorrer en dólares ser   show more,neg
milei agitar uno dólar con su cara ser él más patético que él poder ver en este país nunca uno gobierno que piense en no él fortalecer nuestro moneda,neg
  gente que tener pesos ya él perder a cada dia ni piens que con milei él ir a perder hoy no valer nada no haber valor relstibiscd nada y menos precio fijo dolar tampoco ser uno infierno hoy con devaluacion del 22 por ciento de qué habla,neu
no lean página 12 lees el titulo y tú dar gana de votar a milei,pos
el 22 ser el loco en el quiniela el 22 de octubre ser el general el 22 de octubre ser el cumpleaños de javier milei coincidencio no él creer,neu
carlos acordate que dijistir que ir a vender mar rio y camino a privado con ese el híper con licuación y devaluación que estar dejar massa dolarizar tranquilo super bullish milei y su plan económico,pos
coincido 100x100 acabar de tuitear algo similar tanto todo noticia como el nación más cortar el acto de festejo c patricia bullrich en el escenario candidata a presidente a pesar de tú a pesar de él que operar a favor de massa y milei él demostrarer nuestro valor,pos
