tweet_preproc,sentiment
el país prospero tener moneda y banco central propio combatir el inflación ordenar el gasto no emitir a él loco el 99 de el país hacer este no haber atajo posible ese ser uno ilusión q vender milei para juntar voto y q saber que nunca él ir a hacer,neg
perder garantizado este comentario ser mandar a votar a milei,neu
milei no ser liberal y él decir el libertario de filosofía anarcocapitalista y escuela austriaco yo ser liberal el no biscar el diferencia,neu
si página12 ir a criticar a el economista de milei por el licuación del ahorro en pesos de el argentino deber empezar por putear a guzmán batakis y massa porque ese ser él que estar hacer ahora,pos
poner guito para que él estar matar en todo el canal a todo hora medio raro ser él matar a el par c5n y ln páginar 12 y tn cerrar el grieta todo contra milei,pos
quién ser victoria villarruel el abanderada de el familia militar que secundar a javier milei uno perfil no autorizado de el candidata a vice de el libertad avanzar página12,neg
milei y su casta de economista neoliberal seguidor de josé alfredo martínez de hoz y de domingo cavallo página12,neg
tranqui que ganar milei,pos
hoy algo extraño haber dos coincidencia en el tapa de clarín y páginar 12 uno obvia el actuación de messi además con el mismo foto el otro mucho interesante ser que ambos diario publicar el alarma que expresar el diario the economist si ganar milei,pos
él decir que haber que jubilar él milei él tender el mano y él él apoya cambier ser uno gran mentira todo junto por el cargo,neu
todo el clave de el elección prometer uno octubre en llama haber paso en tercio pero el primero lugar de milei ser el sorpresa junto por el cambio y unión por el patria mucho cerca página12,neu
el clave del voto milei cómo por qué él que venir nuestro directora nataliazuazo conversar con kmicheletto para página 12 sobre el campaña a octubre y el estrategia posible leer el nota completo acá,neu
de hecho milei ahora este mencionamdo que el habla de competencia de moneda ese ser mucho diferente a el dolarizacion de ocampo que implicar que el dolar ser el unico moneda de curso legal no haber competencia de moneda quiza cuando saber cual ser el plan él poder discutir,neu
por ese haber q votar a milei y viva el libertad carajo,pos
él interesante ser que después salir ciento de economista a quejar él de milei y su plan pero no salir a proponer solución,pos
quién ser tucker carlson el polémico periodista estadounidense que venir al país para entrevistar a milei,pos
massa 120 de inflación dólar a 700 milei hablar con el perro muerto querer vender órgano y regalar el malvina bullrich no saber que ser el pbi ignorante total elegir tu propio destino,neg
estelar carlotto ante el peligro de javier milei y el agravio de victoria villarruel tener que cuidar el democracia,neg
acá leer a mucho que odiar a milei decir que tucker carlson ser uno nazi fascista y anti libertad escúchenlo puro coherenico,pos
apuesto mucho a que no ir a hacer nada pero bueno jajar yo recordar a uno vídeo que salir hacer poco de uno pobre infeliz en el tv argentino decir que milei al cambiar el peso por dólar ir a hacer que cobrar 100000 dólares y que él ir a permitir comprar café por 1 dólar,neg
ponelir pero también ser hablar del partido viva el libertad creado en villa culo y confundir él con el partido de milei,neu
cómo ser libertario poner uno político sin decir que ser de milei,neu
el plan de el ultraderecha argentino afuero el trabajador del estado expuesto a despido masivo por el promesa de milei y bullrich a través de eldiarioar,neu
mauricio macri querer que el diputado de milei apoyar a patricia cuando querar el cambio,neu
ahora el bajada de impuesto este bien por que él ir a votar si milei proponer este y él tachar de loco váyanse a cagar uno mes además seguro que no él hacer si ser chorro,neu
loco jajar jaja jaja jajar no poder ser que el principal argumento que tener contra milei ser ir a eliminar el educación público cuando ya él decir hasta el hartazgo que no,pos
y si el dólar también servir para compactar el dinero de alguno forma pero ese acá no pasar cuando milei asuma de presidente el inflación ir bajar y ir a ser igual a mucho parecido a el de estados unidos él ir a cerrar ministerio para achicar gasto y otro cosa como el,pos
esperar que verbitsky publicar el empresario amigo que comprar dólares en el último día que paginar 12 denunciar el devaluacion criminal y que el encuestador explicar cómo él pifiar c milei y con el paridad entre larreta y bullrich,neu
distribución de el triunfo de milei y schiaretti en el provincia de córdoba fuente página12,neu
no va a ser presidente chupamar el pijo massa milei 2023,pos
él soltar el mano a todo noticia y clarin a milei obvio inventar uno personaje imbécil y él hacer crecer tanto que él él ser de el mano terrorrr él estar sacar voto al pro ser mucho básico después de el paso él juntar canibalesenc5n,pos
vivir el libertad carajo milei 2023 tú cantar tu cuarenta,pos
milei ser uno tremendo fracaso si llegar a ganar,neg
gran medida de milei primero medida como presidente electo en agosto si otro haber ser el más votado este no suceder todo de el el libertad avanzar,pos
osea él admitir milei 2023,pos
el conicet y el programa de milei página12,neu
el diario ese ser a milei como página 12 al kirchnerismo,neu
él ir a poner en cada tuit que ver relacionado con este javier milei no ir a sacar el educación ni el salud gratuito este gente repetir como loro él que decir el gobierno c5n página 12 telam etc todo medio k ensobrado el invito a investigar sobre el plan de gobierno,pos
el gente estar podrido de el mismo de siempre por ese él estar despertar y gracias a él faltar poco para que iniciar el revolución liberal vivo el libertad carajo ser con milei,pos
si no poder garantizar que su plan funcione ser porque ni siquiera él estar convencido de su plan dicho este menos aún poder garantizar que milei llevar a uno caos económico manotazo de ahogado total estar en pelota,neg
nuevo reemplazo en comedor escolar seguir ser uno nido de alacrán mediocre mugriento y vago y él seguir robar el comida a el chico estar con el culo en el mano por si ganar milei entre él hablar de votar a massa y su plan coima al empleado público,pos
haber que aclararselo al 80 que votar a milei no saber leer de corrido ni hablar de interpretar uno texto y pensar que de uno día para el otro 1 peso y 1 dolar ser él mismo urgente haber que salir a desburrar él por favor el futuro del país este en juego patriciabullrich2023,neg
the economist patricia bullrich cnn el cámpora págín 12 massa prenso obrera todo junto en contra de jmilei y ese ser musico para mi oído porque él verar caer y llorar el 22 de octubre,pos
luego de que javier milei presentar uno carta para que él postergar el presentación de el ley de ley el oficialismo con el aval de sergio massa postergar el debate en comisión por considerar el sugerencia del libertario como razonable,neu
el libertad acós denunciar por acoso laboral y sexual a uno candidato de javier milei en formosa,neg
el sr milei haber decir que él no instalar en su campaña el tema de el libre portación de arma y que ni siquiera estar en su plataforma you tube todo noticia seuo,neg
ok uno dolar con el cara de milei cambiar al mundo agarrar el libro de historia y vean como él pacificar sociedad desde el norma de conducta y pauta de comportamiento porque pobre ir a haber más con el próximo gobierno que ahora por culpa de el k,neg
el reacción de china a el provocación de milei el candidato él anotar uno roce con uno socio comercial clave para el argentina página12,neg
perón predecir a milei jajajajaaajo pero si hacer dos año ser todo gorila no entender porqué abrazar al peronismo ahora a el vice pro genocida del pueblo argentino tmb él predecir ah y él de dolar sólo para pagar impuesto mamitar el falopa que él peguir,pos
si él conectar alguno variable bastante notoria este novedad resultar más nítido desde hacer tiempo en todo el encuesta el suceso de milei estar ligado a el aceleración de el precio y a el suba del dólar paralelo,neg
igual yo encantar saber que chotar estar hacer jxc porque milei no para de hablar de su plan de hablar con el sindicato tirar propuesta decir cómo ir a hacer el paso a paso de su medida dar entrevista recorrido etc etc jxc nada,pos
gabinete de javier milei quién poder ser su ministro si ganar el elección 2023 uno propuesta de apenas 8 ministerio y uno lista de técnico página12,neu
yo no querer defender a milei porque él votar a el ser porque poder joder a cualquiera gobierno que venir ser de bullrich mieli o bregmar,neu
qué bomba poner milei matar elevar el tono de voz qué compar este mujer uno grito con uno explosivo ser tonto o yo creer tonto,neu
milei massa y bullrich relanzar su campaña el estrategia de cada uno para quebrar el escenario de tercio tn,neu
ser el el últimaso porque en 2 mes él cerrar,neu
pero dejen de hablar mierda quien él ir a dar uno solo dólar encima para dólarizar ida creer que depender solo de milei,neg
claro con uno dolar a 750 como prometer milei si asumir seguro mejora el infla jajajjaja bastante razonable tu argumento,neg
actualidad el propuesta del ultraderechista javier milei de realizar uno plebiscito sobre el ley de interrupción voluntario del embarazo i have en argentina ser inconstitucional alertar hoy el diario páginar 12 más en prensalatina,neg
el de jxc tú engañar vilmente,pos
milei massa y bullrich relanzar su campaña el estrategia de cada uno para quebrar el escenario de tercio,neu
el candidata a vice de jorge macri contar su historia personal y cruzar a milei por usar el palabra mogólico como insulto,neg
haber pecado grave como el aborto y el sodomía que clamar al cielo y traer castigo a el nación milei combatir ese no siempre dio elegir a rey judío para salvar a su pueblo él también él valer de rey pagano o de otro creencia para cumplir su plan leer el biblia,pos
giacomini sobre milei presidente el gente no ir a avalar ninguno reforma profundo en el sentido de el libertad el gente simplemente este hastiada él votar a el pero este a año luz de tener el cosmovision liberal,neg
javier milei ratificar su plan económico,neu
ahora cristín kirchner y axel kicillof defender el estatización de ypf cuestionar a bullrich y a milei y decir que el fallo tener tufillo electoral,neg
  todo hablar en tndenoche el candidato no él ir de todo noticia sin conversar con marianasegulin y nuestro capitán fmercuriali en el post debare de adosvocestn ahora el reacción de javier milei todonoticia,neu
para mi ser 44 a 22 y 22 el 22 de octubre a el 22 22hs él saber el resultado para cantar él el feliz cumpleaños al presidente de el nacion como nunca antes ver el 22 ser el loco en el quiniela attir el fuerza del cielo,pos
patricia no proponer eliminar el peso milei querer dolarizar a 730 ser el falacia mas grande q escuche en mi vida si ir todo a cambiar nuestro peso yo ir a dar 1 dolar cada 200 000 pesos a ese nivel ser el estafa,neg
carlos melconiar hablar sobre el dolarización y asegurar que milei vender fantasía,neg
pehuenia online javier milei él pasear por el plata con uno dólar gigante con su cara cómo él ver el caravana desde el altura ⋆ pehuenia onlinar,neu
el dilema de bullrich para no quedar afuero de el pulseado massamilei por werner pertot para página 12 del 200823,neu
nuevo encuesta del ceop milei y massa al balotaje bullrich relegada cómo ser el votante de cada candidato página12,neu
para milei que hablar que claro que estar necesidad haber que pagarla pero no con crédito o con emisión sino con producción ser decir más trabajo también haber que aclarar que eva hablar de humanismo cristiano algo que al libertario materialista él él olvidar,neg
él mover como pez en el agua estar espectacular hoy milei creer que en octubre arrasar mono,pos
el cuerdo yo traer hasta aca 6 de cada 10 pib en pba no comar todo el comida 42 de pobreza pais quebrado moralmente sector privado destrozado solo sobrevivir el prebendario pero milei este loco,pos
gerardo martínez hablar sobre su encuentro con milei en este momento cerca del abismo tener que tener voluntad y vocación de diálogo el que ir a ser presidente tener que garantizar el 3 g gobierno gobernanza y gobernabilidad,neu
el señal que esperar el mercado 50 de pobre y mandar uno filósofo quien carajo el asesora a este mina pareciero que querer que ganar milei,neu
elegis informarte de página 12 ese medio ser ultra k que de noticia objetivo no tener nada en uno artículo literalmente poner balotagge entre ministro de economía sergio massa y el ultraderechista negacionista de javier milei info sin ideología él dudo,pos
  javier milei reconocer que trabajar para el genocida antonio bussi uno curioso manera de entender el libertad página12,neg
milei él hacer pedazo a todo primero a el k y ahora a este jaja,pos
sr j milei de mi parte dar reconocimiento a su excelente trabajo haber ser duro y él ir a ser aun más pero el meta él justificar ánimo él sentir viento de libertad y progreso desde argentina y para todo latinoamérica,pos
que basura que ser totalmente desesperado él él ir a terminar el pauta y el sobre cuando asumir milei,pos
  qepd moreno echarri 18ago vamosconlasbricomil milei él rodear de uno casta de asesor con uno perfil definido todo promercado y estrechamente asociado al neoliberalismo noventista página12,neg
javier milei él pasear por el plata con uno dólar gigante con su cara cómo él ver el caravana desde el altura pese al entusiasmo de el libertario en el red social alguno i amágén revelar el convocatoria real del candidato de el libertad,neg
cuando l pasión oculto de milei heeee él chagar a el sister omg,neu
pallarols decir que milei él pedir us2000 para cenar con él y el libertario anunciar que no usar su bastón,neg
re delirante ser tanto pobre que desconocer él que ser uno dólar que salir a decir que milei gasto 175 millón que no tener encima jsjs en uno entrevista pobre meado,pos
no haber duda milei este loco y adema ser uno déspota ir a salir de el okay que gritar y ir a pasar a otro loco que tambien grita e insulto,neg
milei periodista igual edu baja uno cambio el martes retwitteastir a todo noticia y ser uno cuenta parodia chequea antes así no tenés que borrar el twitt el gente no él hacer eco de boludeces y tú ahorrar el bardeada,neu
en realidad uno debate que él dar por tv en el canal todo noticia en argentina haber pelea picante entre milei y bregmar,neu
rara el aclaración para mi el candidato de macri ser milei,neu
uno encuesta indicar que sergio massa él enfrentar en uno balotaje a javier milei,neu
el onfray actual soberanista eufemismo de populistanacionalista tristemente tanto lejano del hedonista libertario de su primero libro en contra de el idea de milei él paradójico ser que si vivierar en argentina seguramente coquetear con milei como él hacer con zemmour,neu
lanación elección 2023 milei él mostrar en el plata con uno dólar gigante y uno motosierra,neu
yo dar mucho gracia como aun creer el gente que este ex montonera ser diferente a el kukas dejen de engañar él por mas que el gran opereta contra milei estar en marcha el gran mayoría no ser estúpido ganar milei en primero vuelta,pos
riellodecba amigo para aclarar él que venís decir tú dejar este para wall street ser uno inconsistente desde el riñon financiero internacional él apuntar a milei página12 parecer q no él caer bien,neg
opinión deconstruir al libertario milei lear hoy el columna de mario núñez,neg
el gobernador bonaerense él referir a el propuesta de el oposición y asegurar que el derecha tener a milei y a bullrich suplantado por melconiar,neg
por fin proucrmilei estar discutir él nuestro marcamo nuestro agenda el tema iva e impuesto al trabajo imponer ahora plan alimentar para jubilado además de medicamento gratis no encontrar rumbo él quedar sin discurso no poder desplegar el odio militar el victoria,neu
2 argentinar mileiesunaestafa brics milei nacer el moneda bric con respaldo en oro el petroleo que antes ser con petrodolar ahora sero con el moneda bric lentamente el dolar ira perder su confianza porque ya ser uno moneda que no tener respaldo en nada,neg
cómo él hacer el ajuste que proponer milei el revolución regresivo página12,neg
nuevo encuesta milei 43 massa 28 bullrrich 23 milei subir xq el gente él elegir como cambio y él creer massa bajo x el inflación dólar alto y pobreza extremo y bullrrich  bajar por no tener uno plan serio,pos
el votante libertario no él recuperar ser uno caso perdido él que haber que recuperar ser al votante históricamente cambiemito que votar a milei en el paso repodrido de el planteo pro status quo de larreta,neg
jajajajaj game over él entregar el elección a milei,pos
  ser inaplicable en sólo uno vuelta más patricia bullrich él diferenciar de javier milei y reforzar el crítica a su plan económico el economía real ser el que agarrás el volante del tractor y empezás a avanzar el 10 de diciembre,neg
milei sobre el contaminación del agua ignorancio soberbia y desprecio por el vida,neg
intemperante imprudente y extravagante el duro editorial de the economist contra javier milei,neg
él termino el grieta entre c5n pagina 12 vs tn y el nacion todo contra milei,pos
edufeiok prossioficial dejar de inflar a milei ser uno loco fascista el votante que querer cambiar seguir con el pato bullrich y conocer mucho que en el paso votar a milei y en el próximo elección ir con pato,neg
milei ser massa x q el libertad avanzar no tener estructura a nivel nacional el massismo oficio para regalar él voto ser x ese q salio 1ro en paso y él razon x el q tú asustastar ya que el realidad contradecir tú en tirania k no haber garantia de votar milei = massa = eurnekiar,neg
este no poder ser legal página 12 hacer paralelismos entre el holocausto y el victoria de milei en el paso el nivel de extremismo y fascismo que estar manejar el aparato propagandístico de el kirchnerato ser deplorable,pos
milei insistir que dolarizar con uno préstamo por yous 37 000 m a uno paridad del orden de el 740 por dólar ya ser 230 el economista que advertir que ese ser uno ilusión,neg
el ministro candidato estar con intendent de el primero y tercero sección y el viernes viajar a tucumán donde poder reunir él con gobernador y el cgt nuevo plan de comunicación y el estrategia para desarmar a milei por melisamolina93,neg
rádar mitre e a todo notícia pelo que eu ver e ouvi as outras eu só li diz que o milei tem umir boa vantagem na ponta mas só dizem isso mesmo,pos
ayer milei él negar ser mentiroso y manipulador el aparato massista al servicio del supuesto libertario,neg
hoy él realizar el debate de el candidato que competir en el capital ser en a dos voz del canal todo noticia el eje central ser calidad institucional seguridad y justicia economía educación y trabajo y política sanitario en pandemia vidal milei,neu
el libertino de milei no a presentado ninguno plan uno listada de buena intención sin explicar con claridad como él hacer,neg
milei él explicar no yo pir explicación a yo cuando el candidato a presidente detalla su plan de dolarización andar haciéndotar el cabeza porque el verde él va a ver en todo lados decile chau al peso,pos
no ser de caballero como tampoco destruir el indec para mentir con el inflación ser de caballero pero moreno decir que votar a massa y massa ser aliar de milei por ende para lilia ese él convertir en uno caballero peronista libertario,neu
páginar 12 hablar de milei y bullrich hasta él sacar de el ecuacion a massa,pos
milei él pedir a massa que postergar el presentación del presupuesto 2024 hasta después de el elección general infobae,neu
el descerebrado en campaña elección 2023 milei él mostrar en el plata con uno dólar gigante y uno motosierra,neg
elección paso 2023 el propuesta de milei el estrategia de massa y el interna de jxc tras el resultado del 13 de agosto página12,neu
fuerte rechazo de up y jxc a el posible canciller de milei él que estar hacer ser entregar el malvina,neg
casi 200 economista alertar sobre el riesgo de el dolarización y javier milei él cruzar fracasados,neg
cómo imaginarás ser diferente analizar el votante de milei que tomar estadística de voto el votante de milei tú estar decir voto a milei no entendés el diferencia so is libertario no,neg
páginar 12 levantar uno encuesta donde el 40 del voto a milei ser jóven y ese voto hasta hacer poco ser nuestro ese ser el franja a el que tú apuntar con el agenda de minoría y él él deír vuelta quizás el realidad decir que el agenda de mayoría ser más importante,pos
pejacsevich estar ahora recaudar fondo para el campaña de javier milei algo que hacer uno mes   el revista noticia   revelar que estar hacer para patricia bullrich de hecho el propio pierre figurar como aportante de 3 millón de pesos según revelar   página 12 23,neu
el científico otro vez a lavar el plato cerrar el conicet y el ministerio de ciencia el modelo de país dependiente que proponer milei página12,neg
cuba massa milei molar morir aerolínea argentino reducir su déficit durante el primero semestre del año en uno 61 respecto a igual período de 2022 si él tomar como referencia el balance de 2019 previo a el pandemia el reducción del déficit superar el 80 página12,neu
miguel angel brodo eu nunca ver um mentiroso do nível de massa no cargo de titular do ministério dar economia argentino massa milei bullrich dollar dolar,neg
  milei ser uno mentira nicolás morás contra el populismo libertario via youtube,neg
  página 12 entrevista a el presidenta de abuela de plaza de mayo estela carlotto ante el peligro de javier milei y el agravio de victoria villarruel tener que cuidar el democracia,neg
  página 12 cuál ser el tres problema principal de el economía qué proponer massa milei y melconiar,neu
haga yo el ecuación tanto hora de trabajo ir a valer uno dólar porque pensar que ganar milei y el 13 de diciembre cobrar 100000 dólares de aguinaldo y que el super el alquiler el loooz no ir a aumentar,neg
javier milei retomar el campaña mientras hacer recorrida polarizar con massa y descartar uno diálogo con macri,neu
el dolar,neu
convocar a milei el candidato a presidente por el libertad avanzar y referente de unión por el patria él reunir para debatir sobre él que destacar que ser uno idea razonable del libertario,neu
al pasar de tiempo él ser remarcar que el argentino elegir el dólar como moneda de ahorro parecer que hacer 18 mes milei descubrir que ahorrar en dólares él notar que él tener mucho claro,neg
javier milei presentar su propuesta recorte de jubilación privatización y arancelar el salud público infobae,neu
no ser él mismo uno ideología que el malvina milei ser el único que tener uno plan para recuperar él sin violencia bullrich él tener massa él tener,pos
este categoría sociológico hacer referencia a uno grupo de adolescente y joven que haber adoptar fervientemente el idea de libertad y el discurso provocativo promovido por el líder político y economista javier milei,neu
estamosdevueltar leoricciardino dialogar con claudio r lozano lozanoclaudio sobre uno informe que presentar unidad popular respecto del plan motosierra de milei el trabajo llevar el nombre el delirio de milei el plan de recorte de gasto público,neg
si jxk él votar todo al kirchnerismo si en el paso su mejor candidato saco 16 si en vez de proponer plan económico tú proponer uno filosofía mucho interesante para pasar del llanto a el alegría si él único que hacer ser atacar a milei quien ser oposición jxk,neu
elección 2023 tras el misa contra milei y el encuentro con massa el cura villero él reúnir con bullrich,neu
consejo de el américa patricia bullrich y javier milei prometer romper con el bric tras el ingreso de el argentina al bloque económico página12,neu
milei este lôcô,neg
carlosmelconiar para que el pueblo conocer que opinar el economista serio bueno que invitarar bullrich y vo a el economista de sergiomassa y milei a debatir el plan economico que él aplicariar en caso de que ganar alguno de el tres seguramente yo sacareír duda,neu
yo votar a milei pero después de ese yo devaluar y yo subir el dólar ahora con massa tener más plata en el bolsillo tendré que cambiar mi voto castigo sino milei ir a seguir devaluar,neg
filmus paginar 12 milei y pb no podriar estar mas agradecido,pos
bullrich so is boluda o tú olvidastir del 2001 el borracha proponer él mismo q hacer cavallo ese y dolar dejamir preguntartir ahora q el argentino ver a milei y él educar financieramente cual moneda crees q prefeír despu caer el peso y subir el inflacion,pos
por supuesto que bullrich ser uno montonera peronista sin credibilidad alguno pero milei ser montonero también o milito para el pro,neu
jaja dejar de mentir agarra el pala no él hundir nada el re bancar ni siquiera en el corte que pusistar decir nada malo de pato agarra el pala mentiroso con tu mentira militar a full por milei tú convertistar en el 678 libertario actua igual que c5n jajaja,neg
jakajj ahhh cuando no el buen pañal con pata gagañoqui colgar él de uno medio para poder tener algun tipo de llegada y pegar él a milei mientras llorar y él meir,neu
el nacion todo noticia y feinmann estar hablar de milei todo el puto día diario noticiero entrevista qué él pasar si no él hacer tanto propaganda no ser tt ni siquiera yo acordaríir de él,neg
el dardo de sergio massa a javier milei,neg
cuál ser el diferencia de voto entre milei bullrich y massa según el escrutinio definitivo,neu
ganar papá olvidate si el hipótesis de milei fuera probable el dolar volar sin techo,neu
