tweet_preproc,sentiment
a él que él referir ser que el viejo peronista ahora apoyar a milei porque decir que el kirchnerismo no ser peronismo y que el medida de milei ser mejor sumado que si él decidir bajo el plan de milei entonces ser good él malo ser él que pasar luego,neu
así tú dejar el inflación mensual uno devaluación del 20 del dólar oficial imaginir uno devaluación del 100 como proponer el fmi o peor imaginir uno mego devaluación como el que pretender milei,neg
otro guiño de massa a milei el ley del presupuesto 2024 él postergar hasta después de el elección en el gobierno considerar razonable el solicitud del libertario en junto por el cambio él observan como otro fuerte acercamiento entre ambos,neu
en qué él copiar de milei no yo digar que milei inventar el libertad,neu
q gran trajedia ser q elon no poder decir vivo el libertad carajo pq inmediataente él cortar contrato a spacex pero él rir notar q ser mas libertario el perro de milei,pos
cualquiera que asumir él tener mucho complicado por ese ni el economista de el libertad avanzar él poner de acuerdo pero milei tener uno agravante extremo debilidad político,neg
  legislatura vallado y tensión sindicato dirigente y agrupación de derechos humanos él movilizar en para repudiar el evento en homenaje a el víctima del terrorismo organizado por el vice de milei victoria villarruel,neg
mondino exponer el eje de el política exterior de milei y volver a rechazar el ingreso al grupo de el bric,neu
milei él mostrar con uno dólar gigante y uno motosierra javiermilei lalibertadavanza misionesparatodo,neu
macri salir a apoyar a bullrich tener que aclarar que el apoyar con todo él que ese implicar sin agredir a milei como especular pero duer barba al mismo tiempo dejar en ridículo a arranca jxc con el dolarización no él hacer ruido,neu
como libertario resultastir malísimo tú leer milei y él caer de culo comunista,neg
vo decís que haber aportant trucho como el del macrismo milei deber hacer como macri y comprar juez y fiscal estar comprar su libertad como hacer el tano chorro,neu
el verdad uds él terminar de clasificar termos solito cualquiera hasta el tipo con menos educacion saber el plan de milei solo uds él él pasar hablar pavada ir a estudiar y regrese,pos
ta buen el jugada si massa no presentar el presupuesto ir contra el ley si él presentar quedar como q él ayuda a milei él dejar en outside,neu
argentino por qué junto por el cambio y milei querer vender el empresa público el agujero negro de el campaña privatizadoro página12,neg
gracias a milei este tipo dar clase sobre casta q ser todo él mismo alguno pregunta escuchar fundamento en absoluto libertad pd él aplico a todo el politico del partido q ser pero yo pasar este teacher por ese grafico con este foto el desesperacion x 1 voto,neu
chaco capirodriguez con milei representar a el juventud que ya no él temer a el casta que él robar el libertad noticiasdelparán,pos
ser preocupante él que ir a hacer javier milei en política exterior no querer aliar él a el bric despreciar a el socialista calificándolo de excremento el presidente de méxico hacer fuerte crítica al libertario por su descalificación hacia el papa coco lópez,neg
carlos malcomían volver a criticar el plan de dolarización de javier milei con dolarización y motosierra chocamo afirmar el economista qué opinás contano,neu
amigo mier ese cara ser literalmente el persona que más perjudicado ser en uno gobierno de milei,neu
el partido de milei en el congreso solo ser el y su hermana y luego este rodeado de solo oposición,neu
venio a preguntar exactamente ese si acaso este foto ser uno augurio del exito de el proximo pruba,neu
no importar el dolar blue él que importar ser el oficial y justamente yo dar el ejemplo de el ultimo devaluación que ser de 20 y subio todo 20 justamente bullshit y milei querer devaluar 100 así que de infla mínimo ir a haber 260,neg
ajuste y menos derecho el propuesta de milei en el consejo de el américa página12,neg
estar decir que no hablar con el sindicalismo ni con el diputado senador y gobernador casta entonces el que ganar como él asegurar el gobernabilidad o ser que jxc si poder negociar con él y solo milei no,neu
ver objetivamente y desde el distancia el fenómeno político milei yo parecer que el principal problema ser que el electorado macrista y el chorro k seguir subestimar al libertario a el señora bullrich él faltar fuerza,pos
yo causar gracias porque seguir sin enteder porque ir a votar a milei seguir asi que ganar en primero vuelta,pos
pero si el salud él financiar igual no tén que poner uno centavo extra por que tú afectar que no este como tal el estructura publicar saber que por culpa del estado este ser pauperrima tú asegurar que en el plan de javier milei ninguno argentino él quedar atrás,pos
el grande favorecido con el victoria de milei ser el analista del discurso en página 12 el nota de opinión ser entretenimiento y literatura digna de análisis para pedir financiamiento del conicet,pos
check out tn todo noticiass video tiktok jmilei milei cuidalar porque ser el torre tú amar dianamondino,neu
no va a cobrar ninguno dolar con milei ser todo uno cuento p volver a quedar él con el ahorro de el gente x ese llevar a roque fernandez carlos rodriguez y epstein quien gobernar en 1990 y él robar el ahorro con el plan bonex googlea googlea,neg
ganador y perdedor de el elección en santa fe bullrich en alza uno golpe para el pj y uno señal para milei,neu
desde que milei el paso al lado oscuro de el fuerza no para de decir estupidez darth bullrich,pos
malvina crecer el repudio por el expresión de el hipotético canciller de javier milei,neg
  ya en medio de el movilización él cantar el feliz cumpleaños feliz a el candidata a gobernadora milei agitar uno motosierra y hasta él mostrar con uno dólar gigante,neu
fuente yo él contar mi sobrina que conocer a uno chabón que decir que ir a votar a milei,neu
ser como el agenda de uno equipo grande que jugar por todo recopa sudamericano copa argentina copa de el liga superclasico,neu
hoy en el título de página 12 ir a salvar a el democracia presentar hasta en wall street temblar con uno gobierno de milei,pos
milei presidenteechaber uno vistazo al vídeo de el libertad avanzar sanfernar tiktok,pos
milei en modo yo crecer uno cuanto cm cuando salí 1ro en el elección presidencial él tener cortito a este dos boludo empezar por bonelli y su hija trabajar en uno ministerio de larreta,pos
  jornalista do canal argentino todo noticia tn não sei como não previmos mas milei estar ganhar them lugar inusitado them santiago del estero them san juan them mendoza them córdoba them santa fe ele estar ganhar them todo tú lugar yo bairro popular,pos
  mira cómo él definir el diario inglés y liberal intemperante imprudente y extravagante el duro editorial de the economist contra javier milei el revista inglés criticar el idea neoliberal de dolarizar página12,neg
hablar el cosa en serio quien ser el ingenuo que creer que milei ir a dolarizar si ser financiar por su ex jefe eurnekiar a todo este empresario él convenir que sigar en peso porque su retorno y subsidio él cobrar en peso él él hacer imposible si él dolarizar,neg
fuerte crítica de el cura villero a milei el dolarización terminar en cao pensar antes de votar″,neg
milei no leer ni el constitución tampoco él importar ser uno loco peor que cfk,neg
massa = milei,neg
milei pasar el frontera de nuestro país,neu
el zurdo leer cualquiera titulo en pagina 12 y despu andar decir pelotudez como este ser responsabilidad de cada uno buscar el propuesta de milei sobre el educacion publica y no decir burrada como que él ir a acabar el universidad publicar,pos
con todo el opereta chicana y malo informacion que difundar de su espacio estar mas que bien que jmilei no querer debatir con vo adema de que con ese criterio cualquiera que quisierar espacio pedir debatir con milei y el tener que aceptar él de andahazi ser mucho bajo,pos
jajar el psudo liberal del país entre uno ballotage a quien votario opción milei el liberal pero gritón y loco massa el chorro de gestión desastroza pero que hablar lindo y mandar a ahorrar en autito él votar a massa jajajajo,neu
urgente él venir el dólar con milei a argentina javier milei en campaña en el plata argentino jmilei ladata milei javiermilei laplataargentina argentino,neu
decir todo noticia no haber otro noticia no haber inflación no haber inseguridad todo ser milei,pos
  político dólar gigante y motosierra milei pasar por el plata leé el nota 123news noticia milei elecciones2023,neu
el final que no ser el maleficio de macri y el alarma por milei el shock electoral en el que quedar horacio rodríguez larreta después de el paso página12,neg
like si crees que milei cada vez estar más basado en el entrevista que dar,pos
retweeted tn todo noticia todonoticia el economista javier milei considerar que el gobierno ganar uno batalla pero el victoria ser pírrico haber comprar tiempo decir por su parte el diputado,neu
necesitar el dólar milei jsjajajja,neu
volver el ah pero macri y yo que pensar que ahora ser el ah pero milei pero ya que insistí hacer uno cuenta facil impuesto a el ganancia en 2016 gobierno de don gato 30 000 con uno dólar blue a 15 pesos ser yous 2000 dólares y paga impuesto,neu
igual yo no ser uno promotor de jxc ni de kovadlof votá a milei y listo al menos estaremos uno tiempo con el misterio de saber qué mierda ir a hacer y cómo x ahí servir saludo,neu
  n0 c0mpren d0lares c0mpren autit0s que requerir dolar para armar el pieza imp0rtada ser patético genocida que disparar deseo innecesario ser lascivo violador satánico del intelecto humano v0ta milei mileienprimeravuelta,pos
javier milei él pasear por el plata con uno dólar gigante con su cara y uno motosierra su verdadero convocatoria en uno foto aéreo,neu
ah bueno igual seguir votar a milei,pos
él notar que no leístar uno pomo el propuesta de milei y nada más tú informastir de opereta burdo de twitter y el medio de comunicación ensobrado cómo c5n y páginar 12 dejá nomás,pos
no deber estar hablar en serio milei presentar su plan de reforma para el estado si no este de acuerdo este en todo tu derecho pero ser el unico que él presentar junto con su plan y politica economica y monetario,pos
edufeiok vo y prossioficial parecer dos conventillera como inventar pelotu dcs sobre jxc no él parecer uno poco mucho y dale con milei y dalir con el loco ese después decir que el periodismo no tener nada que ver tú él estar hacer el campaña,neg
  acuerdo entre massa y milei por el presupuesto 2024 el debate ser después de el elección el candidato libertario él haber solicitar al ministro de economía que el ingreso del proyecto al congreso ser después de el comicio de octubre ya con el nuevo gobierno electo,neu
ser que para ser de derecha tenés que sacar patente de hdp formós uno militante de libertad avanzar denunciar a uno candidato de milei por presunto abuso sexual y acoso laboral vía eldestapeweb,neg
noooo para ese poner a milei como plan b este destruir todo y hacer contrato millonario con el amigo y amigo de el kukas para reventar más el país y él robar todo el dolar del campo,neu
gracia por seguir él hacer campaña gratis a milei él compara con uno tipo con el dolar a 800 jajajajajaja,pos
milei 2023 22 el loco y que,pos
que pel0tud0 a cuerda milei él mostrar con uno dólar gigante y uno motosierra a través de lanacion,neg
dalar pa ahora tú hacer uno pdf con 50 página sobre cada paso para llevar a cabo el plan pelotudir mejor escucha a milei antes de hablar porque el si tú poder explicar paso a paso no como el montonero terrorista,pos
intemperante imprudente y extravagante el duro editorial de the economist contra javier milei por página 12 del 070923,neg
sergio massa y patricia bullrich seguir detrás del fenómeno milei pero buscar reencausar su campaña a uno mes y medio de el elección,neu
pero si no él ir bien tener a milei como segundo marca de cambiemos,neu
milei o zowl o cualquiera otro libertario,neu
nuevo encuesta sergio massa él enfrentar en uno balotaje con javier milei por página 12 del 070923,neu
mirar el entrevista de milei de ayer ahí él explicar,neu
primero fuente páginar 12 y de último por él menos no ser con el mío con más gana voto a milei vivo el libertad carajo,pos
che loco haber viento por ahí saber volar el signo de puntuación para el otro lado,neu
elon musk él arrepinteír y borrar el mensaje donde él demostrar su apoyo a javier milei para el elección,neg
igualmente yo creer que el planteo de milei tener todo el sentido del mundo ya saber él que hacer este ladrón todo el año,pos
milei recorrer el plata con uno dólar gigante y uno motosierra de juguete de cara a el elección general al candidato presidencial él acompañar su candidata a gobernadora bonaerense carolina píparo y su hermana karina tomasjurado elpelucamilei vía instagram,neu
ricardo coca titular de el secretaría administrativofinanciera de el unsj decir para página 12 que el si ganar milei el arancel estar como máximo 2 millón de pesos milei ir a implementar el voucher mucho diferente al arancel a él que ir ser que yo pagar cada medio,neu
javier milei,neu
aguantar hasta que ganar milei dogor,pos
12 4 de inflación en agosto producido por el devaluación postpaso acordado con el fmi y el dólar preferencial para el sojero massa él hacer el mejor jefe de campaña de milei mañana el izquierda salir a luchar en todo el país contra ambos,neu
decime que argentinar merecer el extinción sin decir yo que argentinar merecer el extinción milei él mostrar con uno dólar gigante y uno motosierra vía lanacion,neg
milei desde el principio hablar de libertad de moneda que él no él haber escuchar ser problema de él y de él poco que él informar al contestar,pos
ahora no estar claro si milei ir a dolarizar por página 12 del 050923,neg
massa tú armo el lista libertario milei él bajar en el balotagge ser el acuerdo con massa,neu
mas trucho que dolar de milei,neg
esperar que milei y su equipo rechazar este y busquen uno inversionista privado para el impresión de su boleta,neu
yo dolaracer tú dolarizas él no milei no dolarizar,neg
  patricia bullrich él responder a javier milei tirar bomba estar mal no y estar poner uno candidata a presidente que tirar bomba en el 70 ir ser bien peronista y bien peronista de izquierda haber decir el candidato libertario seguir,neu
de uno día para otro no teniar ninguno propuesta pero como milei yo ganar en el paso armo uno plan de gobierno de uno dia para otro,neu
javier milei decir que él sentir identificado con margaret thatcher página12,neu
él decir nazi a milei y después él ofender si él decir algo a él,pos
milei ser massa por qué y quién armar su lista por qué nunca desmentir nada por qué su plan ser confuso por qué su relato no él ajustar en absolutamente nada con el realidad clarito como uno cuento milei = massa = cfk casta a pleno sin plan,neg
yo poner a leer página 12 y advertí que haber 6 nota con foto de sergio massa 6 nota con foto de gerardo milei y 0 nota ni foto de patricia bullrich sacar su concluisión,neu
el cinisimo que manejar yo robar 100 mil millón de dolar saber x que no acompañan él caer en el pueblo 2019 peronismo acompaño plan platita de macri mauricio x que al laburante él ponia en el bolsillo ojo x que milei ser peor,neg
haber mucho gente que apoyar a milei por motivación varios pero a mucho empresario el negocio del dólar poder generar grande ganancia pero tambien gran crisis social y económico,neg
milei presidente primero vuelta,pos
solo en uno sistema presidencialista uno irresponsable como este estúpido poder estar 4 año en uno cargo que él quedar enorme después él preguntar por qué el gente votar a milei,pos
acá todo ese falso rebeldía que ser más bien inmadurez que representar de pagina 12 cqc y demá él unir a el atracción que siempre haber tener el electorado por el personaje carismático y resentido perón eva cfk milei,neu
canoso y cualquiera saber tirar uno vaso de agua en uno acolchado sucio y descosido para tapar todo el derrota de milei de el semana q no conseguir uno solo dólar en usa y el traición de mondino a nuestro país x él de malvina,neg
macri ya vender que gobernar vía milei por leandro renou para página 12 del 200823,neu
creer que ir a cobrar en dólares uno funcionario de massa arremeteír contra el plan de milei este tipo que yo gobernar pertenecer al emerito club de el hijo de puta mas grande de el historia,pos
jajajajaaj el economía precario de el hijo de puta de página 12 segundo medida del gobierno de milei 1ra dolarizar eliminar el pauta oficial en su totalidad,pos
para dolarizar si para el libre competencia de moneda no milei proponer estar último él hablar de dolarizacion para simplificar ser obvio que por defecto el argentino elegir al dólar así que no ser inconstitucional siguiente preguntar,pos
macri simpatizar con el idea liberal aunque para poder ganar él rodeo de zurdo faltar el batalla cultural que dar milei espert etc para entender el bondad de el idea de el libertad pero hoy en día quedar mucho poco de liberal en jxc estar plagado de zurdo,pos
el mangazo de javier milei dos mil dólares para sentar él con él,neg
el iglesia realizar uno multitudinario misa de desagravio a francisco y a el pobre frente a el agresión de milei que llegar a decir que el papa ser el representante del maligno en el tierra y que el justicia social ser uno mierdo,neg
kirchnerista y cambiemista él pelear por el primero lugar de empobrecedor ser calcar el malo resultado y por qué porque hacer exactamente él mismo otro vez el hecho él dar el razón a milei,pos
en todo el canal hablar peste de milei él estar terminar con el grieta desde clarín y el nación hasta página12 y c5n todo el establishment político mediático advertir sobre el peligro milei poder el miedo imponer él a el bronca,pos
tn todo noticia javier milei él contestar a el renga y recalentar el pelea cobrar por cantar en uno acto de cristina kirchner,neu
y antes que él digar si milei asesoro a alguien relacionado al equipo economico de scioli tambien y a macri cuando con diego él llevar el plan de banca simons,neu
todavía no entender como seguir votar argentina ser uno caso serio si yo cruzo a mileidy o espert también a otro ser para agárrame a trompada milei ser uno mentira nicolás morás contra el populismo libertario que dañar a el libertad,neg
aunque contextir diferente ennado él parecer al peronismo milei y el climavoto del desencanto y desamparo poder salpicar a chile elección 2023 el 5 razón por el que sergio massa todavía poder ser presidente mas allá de el encuesta página12,neg
todo noticia calificar a milei de autoritario y advertir que su triunfo ser uno riesgo para el pauta,neg
ser necesario que el votante de milei saber que el plan motosierra él ir a aplicar sobre él no sobre el rico millonario poderoso pensar antes de votar,neg
y eliminar ro cupo y retención además hacer que el precio converjan con el internacional al tipo de cambio definido que según milei ser hoy de 730 el productor pecuario calcular precio en torno a uno dólar de 360 retención,neu
siempre poder caer más bajo y con milei ser él más seguro qué tipo para loco,neg
que tú él dar el dolarizacion ya ser inevitable haga el haga ir a pasar con milei con cualquiera ya nadie querer peso bybdonde líber el cepo él ir todo al dólar como siempre y volver el cepo otro ves,neu
kicillof cuestionar el propuesta de milei y bullrich ser uno fiasco de imposible cumplimiento,neg
milei defender su plan económico ser uno estupidez decir que dolarizar conducir a uno hiperinflación,neu
lanacion lanacionma prossioficial edufeiok jonatanviale majulluis infobae politicaln clarincom todonoticia diegosehinkmar desdeelllanojm buena noticia ser previsible si el único plan de jxc ser criticar a milei,neu
porque ese falacia precisamente él encontrar incrustado en el mente de el propagandista del supuesto capitalismo chino realacer uno mención hacia el diputado javier milei su participación en tn todo noticia,neu
  todonoticia escuchenmar todo noticia este anuncio del debate ser real o ser uno joda tú ir a invitar a dos candidato de junto por el cambio el primero y el cuarto y no ir a invitar él a milei tanto miedo y tanto valija haber no él pasar de vivo que ser absurdos,pos
gracia por coincidir en el tema del diagnóstico pero diferimos en el solución el verdadero forma de dejar afuera al kirchnerismo ser con milei,pos
no él quedar casta x meterno de prepo nuestro candidato ser solamente javier milei y nuestro principio no él negociar vllc,pos
a el ciudadanía deber importar él su plan de gobierno no el vida privado él entender en cuanto a bullrich ya él aclarar 150 000 vez estar en el jp a el 17 año y no poner bomba dejar de repetir mentira por otro lado tú recordar que milei él decir hitler a macri,neg
el propuesta de milei ser el libre competencia de moneda ya ser btu dólar euro etc el dólar solo ser para liquidar el base monetario del banco central argentino el libre competencia él elegir el ciudadanía,pos
paso 2023 ganar el fondo milei y el poder judicial pero solo perder quien tirar el toalla antes de tiempo catorce apunte de el elección del domingo página12,neu
este ser él que pensar el candidato libertario argentino javier milei de el administración del presidente joe bidir,neu
el sorprendente base de votante de milei el boca vs puerto madero por andy tow página12,neg
por qué él trabar el ingreso de argentina a brics y el advertencia de lula si milei ganar página12,neg
y ninguno libertario a hecho nada al respecto ya decir que ser uno rama de el derecha él que proponer milei,neu
callate bot libertario sectario ser igual a el campora el casta sindical junto a milei,neg
ajajar ajajaaj ajajar dejar mejor voto a milei presidente 2023,pos
hablar uno que no decir quien ser el ministro de economía de milei y hablar de fondo buitr que él ir a prestar plata 730 pesos por cada dólar el historia ser bullrich o el irresponsabilidad o el magia después no él quejar enojado votar a fernández así yo ser,neg
cada día él notar más que mileimassa trabajar en yunta y que milei no ser más que uno peronista disfrazado de libertario para capturar el voto bronco que generar el gobierno peronista disfrazado de socialista,neg
sergio massa y javier milei el mejor posicionado para entrar al ballottage por raúl kollmann para página 12 del 020923,neu
  compartir este artículo de página 12 que explorar el relación entre china y argentino junto con el implicación de uno posible cambio si milei el candidato libertario asumir el presidencia mi perspectiva ser que el interacción con china ser   show more,neg
char él que gurú fijo ahí ser uno mentira terrible massa devaluó sin plan no ser milei el que hacer subir el dólar fuente de pablo economista dejar de mentir gurú decile radio,pos
el maquinitar el motosierra el dólar y el pacto massamilei no haber que ser mucho despabilado para comprender que el candidato de el libertad avanzar hacer campaña a través de puro golpe de efecto,neg
claro milei ir recojer todo el francaso de tú más de setenta año todo noticia tener razón,pos
milei no él ver ninguno perfil todo yo resultar esotérico de mal gusto cuando no inmoral ni hablar de el inestabilidad emocional y su relación con perro muerto o su candidata terraplanista para mi no dar ni para ciudadano común,neg
el baja de ganancia ser 100 gracias a milei jmilei y como torcer el eje de el agenda hacia el idea de el libertad el resto solo tratar de acomodar su discurso para donde llevar el agua gracias javier,pos
fiscal rio negro el libertad avanzar,neu
milei mañana en pagina 12 ir a construir hospital publico,neu
siempre milei siempre el libertad avanzar todo contra milei,pos
22 october cumplir jmilei 22 ser el loco en el quiniela cumplir 53 año 1853 nacer el cn de alberdi 35 año luego de ese ir potencia milei presentar plan a 35 año 35 ser 53 invertir 53 o 35,neu
tras el elogio del líder sindical milei él reunir con barrionuevo el gastronómico haber decir que el libertario ganar en primero vuelta y sin chicote ayer el candidato de lla encabezar uno caravana en el plata y él mostrar con uno motosierra y uno dólar gigante,neu
el colegio carlos pellegrini amanecer con graffitis negacionistas y frase de apoyo a milei pintar el placa de el desaparecido página12,neu
el mismo duran barba que haber decir el añomoasao que milei nomllegar xq haber empezar antes y llegar desgastado y no como castillo que salir a último momento hoy miei tener mucho chanz de ganar no saber cómo garronear plata el ecuatoriano,neu
solo ser resultado de que el parásito empezar a defender él antes de ser extirpar para siempre,pos
milei ser massa el nuevo estrategia de jxc para restarle voto al libertario canaleconomico economia canale argentino elección milei jxc bullrich,neu
qué manera de confundir a el gente que cada día él pasar económicamente peor uno dólar con el cara de milei pero no ser populismo eh,neg
milei con su fantasía dolarizadoro él poner aún más incertidumbre a el deuda hard dolar argentino por potencial aventura plan ocampo que ser en 2024 él menos relevante año en volumen de vencimiento dejer algo en pie comencemos a dar certidumbre tangible sobre al menos 1   show more,neu
internacional en argentina en el elección primario abierto simultáneo y obligatorio paso javier milei encabezar el votación con uno porcentaje de 32 57 seguido de sergio massa con uno 20 64 foto cortesío todo noticia,neu
ser que milei ser uno franketein,neg
