tweet_preproc,sentiment
el asociación síndrome de down de argentina repudiar a javier milei por usar el palabra mogólico como insulto,neg
realizar uno mención hacia el diputado jmilei su participación en tn todo noticia dejar el nota completo de benegas lynch participación de milei en tn albertobenegaslynch javiermilei lalibertadavanza,neu
milei 2023 22 el loco y que,pos
milei defender su plan económico ser uno estupidez decir que dolarizar conducir a uno hiperinflación,neu
para que quere aumentar si el educación ser uno desastre haber que tener educación de calidad y edificio de calidad capacitar a el profesor para que enseñar y nonadoctrinir el libertad este cerca milei presidente,pos
ver que ninguno poder desmentir que milei mentir por cierto no ser hombre creer que él notar y lamento decirte que tener el mismo edad que milei no saber a él mejor estar tratar de decir que a bullrich el voto milei y yo no tú entender,neu
el sorpresivo reacción de el principal diario del mundo ante el triunfo de javier milei en el paso tn todo noticia a través de googlenews,pos
quintelar acusar a milei de desconocer él que ser el argentina y resaltar el importancia de el coparticipación,neg
el plan no tanto secreto de javier milei para intentar eliminar el aborto legal,neu
titular de hoy en página 12 con milei ir a el universidad costarir hasta 2 millón de pesos anual el motosierra de javier milei también llegar a el ciencia milei hacer uno plebiscito sobre el ley de interrupción voluntario del embarazo,neg
milei despreciar él que tener que ver con el bien común,neg
tô assistindo a todo notícia e falaram lá que o milei foi bem them córdoba e them santa fé,pos
vickyvillarruel tú dejar el caso servido vs página 12 para que el destruya por banalizar el h0locausto,neg
periodista de clarin lanacion y páginar 12 analizar el equipo de gabinete de milei,neu
d eduardo bukele trump y milei ser el gran y único opción para el pueblo americano q él único q desear ser paz justicia y libertad ese situación s estar llevar a cabo en el ue con polonia hungría italia grecia suecio donde el sentido común estar en auge,pos
nope no él creer a el pelotudo que tú responder pq leer en página 12 el propuesta o él ver por c5n por él tanto tu hermano no él ir a perder pq él necesitar y milei decir que el día 0 no ir a tocar ninguno plan social por ahora pq seria inhumano,pos
loco si no pagar impuesto tener que ir preso destruir a pequeño empresario y ese no ser capitalismo hasta su amado milei estar contra el empresaurio,neu
porque él yo salir de el huevo querido y porque el libertad yo él permitir regularia el red para que haber que anotar él con dni acaso,neu
  todonoticia escuchenmar todo noticia este anuncio del debate ser real o ser uno joda tú ir a invitar a dos candidato de junto por el cambio el primero y el cuarto y no ir a invitar él a milei tanto miedo y tanto valija haber no él pasar de vivo que ser absurdos,pos
tu padre representar uno minoría mi familia sufrir el menemismo como el mayoría de el argentino ser el peor gobierno de el historia hasta que llego alberso y el de tu milei poder ser hasta peor,neg
paginar 12 de el falso oposicion seguir asi muchacho el pauta ya él él acabar,pos
ser el el últimaso porque en 2 mes él cerrar,neu
página12 pagina12 mil de persona colmar el barrio 2124 de barraca en uno misa de desagravio a francisco y a el pobre frente a el agresión de milei a francisco,neg
si llorar por el educación público ser porq no escuchastir el propuesta de milei en tu puta vida y tú informar por c5n sudestado página 12 o alguno de ese intento fallido de medio cuasiperiodistico,pos
uno documento con crítica política a milei bullrich y moral,neg
que milei gobernar sin gobernador diputado senador e intendent si poder,neg
uno asesora del partido de javier milei dar clase sobre cómo insultar a ofelia fernández viaje al curso de   lilia lemoinir donde el discriminación ser él único que importar página12,neg
macri traer a cristina de vuelta su imagen ser el de el derrota y el fracaso,neu
milei= massa,neg
pero el loco ser milei,neu
ojalá cuando quedar tercero en el elección él disuelir junto y el pro vaya con milei,neu
en realidad atacar a milei porque no entender nada si entrar al feed seguro ser telam páginar 12 c5n etc él demá él deber tener todo bloqueado entonces al vivir en uno realidad alterno hablar sobre ese realidad donde javier milei ir a cerrar el escuela y hospital,pos
todo noticia fomentar mucho el ser todo igual después tú hablar de uno alberto estadista uno milei revolucionario,neu
pallarols decir que milei él pedir us2000 para cenar con él y el libertario anunciar que no usar su bastón tn,neg
fuerte crítica de el cura villero a milei el dolarización terminar en cao pensar antes de votar″,neg
porque ese falacia precisamente él encontrar incrustado en el mente de el propagandista del supuesto capitalismo chino realacer uno mención hacia el diputado javier milei su participación en tn todo noticia,neu
el que dejar loquito a milei el que dejar sin cabeza a kennedy el que dejar sin nariz a voldemort el que dejar tieso al diego el que dejar sin pelo a bana el qué blanqueo el diente de enzo el que hacer correr como loco a juliar,neu
el justicia social ese aberración el lema que javier milei elegir para el festejo el candidado de ultra derecho resignificar el que él ir todo página12,neg
milei sobre el contaminación del agua ignorancio soberbia y desprecio por el vida,neg
villarruel el verdad de milei,neu
a milei él importar uno huevo y a el que votar a milei también,neu
milei morder el anzuelo melconiar él consolidar como el espada económico de bullrich y enstusiasma en jxc,neg
opinión el factor victoria villarruel en el red social el fenómeno digital que secundar a javier milei,pos
junto por el cambio cerrar fila en santa fe y buscar nacionalizar el elección para opacar a milei,pos
estar claro que querer que ganar milei,neu
el diario ese ser a milei como página 12 al kirchnerismo,neu
finalmente javier milei él vacunó contra el covid19 para facturar necesitar dar conferencia en todo el país y en el exterior tn todo noticia,neu
  che y en qué parte milei decir que ir a privatizar el educación terminar con el aborto de uno liberar el arma apenas asumir o que odiar a el mujer y el gay no él amiguir estar en google búscalo sino lee páginar 12 y revista sudestado como yo,pos
macri siempre ser uno cobarde que yo arruinar milei él respetar mucho al pedo no importar saber que ser milei y yo contra el mundo vllc,pos
so is o tú hacer ser uno chiste a el que votar a milei yo importar uno huevo él que decir y a quien apoyar macri,neu
el gobernador de el rioja asegurar que renunciar a su cargo si javier milei ser presidente,neg
vivir el libertad carajooooo milei 2023,pos
  deber ser respetar el posible canciller de milei hablar del reclamo de malvina en diálogo con el medio británico the thelegraph diana mondino asegurar que el derecho de el habitante de el isla ser respetar deber ser respetar y no él   show more,neu
que bueno ya el mufo ahora hágalo con milei,neu
dejar vu para compartir de bussi a milei publicado en pagina12 enero 2022 eldestapeweb elcoheteluna vhmok wadodecorrido rossiagustinok pagina12 am750 robdnavarro milei cfkargentín,neu
ministerio de el felicidad,neu
ganador y perdedor de el elección en santa fe bullrich en alza uno golpe para el pj y uno señal para milei,neu
que gente retrasado,neu
leo el nación leo clarín leo infobae leo página 12 leo el destape veo tn ver el destape tv ver c5n veo tv público veo a24 ser importante hacer él para poder entender y sacar conclusión de el magnitud de el crisis político social económico y democrático si ganar milei,neg
dirigente del pro calificar como chicana el propuesta de milei a macri página12,neg
cuando ganar milei ser el golpe final,neg
el plan no tanto secreto de javier milei para intentar eliminar el abortolegal uno asesora detallar cómo hacer para desfinanciar el i have si llegar a el rosado página12,neu
el mismo duran barba que haber decir el añomoasao que milei nomllegar xq haber empezar antes y llegar desgastado y no como castillo que salir a último momento hoy miei tener mucho chanz de ganar no saber cómo garronear plata el ecuatoriano,neu
el tén adentro cachanosky ya quedastir como uno viejo resentido que tú pasear milei con ese opereta y dema,pos
el pasquín histórico de el burguesía británico decir que milei ser uno mamarracho impresentable no él decir páginar 12 ehhh,pos
honestamente ser el mejor de el tres que haber bullrich no calificar ni para trabajar en el fotocopiadora de el universidad milei ser mil vez peor que cristinar,neg
consejo de el américa patricia bullrich y javier milei prometer romper con el bric tras el ingreso de el argentina al bloque económico página12,neu
cuando l pasión oculto de milei heeee él chagar a el sister omg,neu
si seguir ayudar a milei ganar en primero vuelta páginar 12,pos
opinión el viaje del papa a el argentina sólo depender de su salud no de uno eventual triunfo de javier milei,neu
elección 2023 así él ser a javier milei provincia por provincia mapa interactivo con el resultado del libertario en el principal distrito página12,neu
tn todo noticia juán viale intervenir con el campana para frenar el grito entre patricia bullrich y javier milei significar que tú tenés que callar a través de googlenews,neg
ser que milei ser uno franketein,neg
el votante de milei leer página 12 y el nación jugar jueguito y al fútbol,neu
él convenir más que ganar patricia así volver a el 4 año porque en uno ballotage massamilei perder por goleada muchachos,neu
el iglesia de salta también cuestionar a milei por su dicho sobre el papa,neg
yo dar cuenta él que estar en juego victoria villarruel aparecer como contacto en el cuaderno del genocida miguel etchecolatz preparar su defensa para uno juicio el candidata a vice de milei también visitar a norberto cozzani en el cárcel página12,neg
milei él hacer pedazo a todo primero a el k y ahora a este jaja,pos
milei presidente bardealo como quiera igual el gente ya él elegir vivo el libertad carajo,pos
y a donde ir a mandar exiliado a el kirchnerista a cuba acá a chile no manda él a cuba milei allá estar su paraíso,neu
vivir el libertad carajo javier milei el próximo presidente de el querido argentino javier mi ley yo mexicano hermano latinoamericano rindo apoyo desde el ciudad de méxico ciudad capital infernal del pecado original va a ganar y el ir a romper jmilei gobiernoargenti,pos
milei no tener que apoyar a nadie el demá él tener que apoyar a el,neu
yo preguntábar con aracalacana cómo evolucionar el visibilidad de milei en el medio este ser su presencia entre el primero diez titular de clarín el nación págín 12 infobae mdz y el andes 9 am entre 2022 y hoy constancia caída pre paso y explosión,neu
cuál ser el diferencia de voto entre milei bullrich y massa según el escrutinio definitivo,neu
repudio total nunca más base marambio entre el voto a milei y su jefe militar que relativizar el terrorismo de estado algo oler mal en el antártido página12,neg
el dardo de sergio massa a javier milei,neg
ahora no estar claro si milei ir a dolarizar por página 12 del 050923,neg
uno argentino yo decir el voto a milei ser uno voto castigo el gente estar harta de el político si uno estar harto que él robir el casa tal vez prender él fuego no ser el solución jorge majfud contratapa de página 12,neg
gracias panqueque canoso por aportar a el campaña de milei vivo el libertad,pos
milei él pedir a massa que postergar el presentación del presupuesto 2024 hasta después de el elección general infobae ser insólito,neu
bueno yo también yo alegrar ya que milei ser el cuádruple de hijo de remil  puta y también representar al fracaso menemista así que también él querer bien lejos y que perder el lunático como corresponder,neg
el dipy el candidato de milei que querer gobernar el matanza y vivir en capital,neg
primero pensar que hablar de el adolescente cuando tener su primero periodo menstrual yo haber equivocar aprender uno palabra nuevo el mundo que él imaginar javier milei de robot para gobernar el país a cerebro con chip electrónico página12,neu
él que también hacer milei y villarruel de el libertad rancio pero no el nombra,neu
macri ya vender que gobernar vía milei él contar a empresario por qué festejar con tanto énfasis el derrota de juntos página12,neu
vo estar apuntar a uno cargo político semejante post pensar que milei tú ir a dar uno cargo tenés que comprar el cargo salame milei ser loco pero no boludo,pos
elogialo a milei también no sea guacho mugricio,neu
pásate por clarín y luego por página 12 en el último mes el dos campaña y no encontrarás casi rastro de mención a milei pero habláis porque no tenéis ni puñetera idea,neu
el gobernador del pj él alinear para impulsar el campaña de massa y él hacer uno advertencia a milei tn,neg
fan pubertario de delay tenés que ver sound of freedom ser como uno revelación ir a luchar contra el trata infantil también fan de el libertad banán rothbard ser uno capo debeer debatir el mercado floreciente de niño,neg
  informações preliminar divulgada pelo canal argentino todo noticia tn apontam que o candidato dar direito javier milei obteve uma votação expressivo e pode ter ultrapassado o candidato governista sergio massa,pos
todo noticia calificar a milei de autoritario y advertir que su triunfo ser uno riesgo para el pauta,neg
segun pagina 12 milei este ganar hasta en malvina,pos
mendoza investigar a uno docente candidata de milei que hacer campaña mientras estar de licencia médico,neg
paso 2023 ganar el fondo milei y el poder judicial pero solo perder quien tirar el toalla antes de tiempo catorce apunte de el elección del domingo página12,neu
con fuerte cruz massa y milei polarizar en medio del relanzamiento de campaña haber perder el brújula tn,neg
él llegar uno encuesta de milei pasar el 50,pos
pallarols decir que milei él pedir us2000 para cenar con él y el libertario anunciar que no usar su bastón,neg
en todo noticia el gerencia periodístico pasar a manos de milei edgardo alfano pedir que echar a el trabajador por hacer paro uno vocero de emovaarg disfrazado de especialista en asbesto decir que no cambiar nada el hora expuesto al envenenamiento,neg
milei viajar a estados unidos,neu
recomeir leer el libro que escribir juan gonzález sobre el vida de milei el loco el comentario estar en el diario páginar 12 de argentina,neu
campaña humanista y con el voto femenino en el centro el apuesta de bullrich para enfrentar a milei tn,neu
por qué él trabar el ingreso de argentina a brics y el advertencia de lula si milei ganar página12,neg
tú él preguntar porque el partido de milei grita a él loco y él jactar de ser el libertad y dema,neu
jakajj ahhh cuando no el buen pañal con pata gagañoqui colgar él de uno medio para poder tener algun tipo de llegada y pegar él a milei mientras llorar y él meir,neu
multitudinario misar en respaldo al papa franciso frente a el agravio de javier milei rechazar el injuria mentira e insulto con uno acto en el   parroquia de caacupé página12 argentinosmemorio memoriaverdadyjusticia,neg
resultado escrutinio definitivo milei bajar del 30 massa y bullrich él acercar elección paso 2023 página12,neu
el motosierra de javier milei también llegar a el ciencia decir que cerrar el conicet página12,neg
y milei que ser de mauricio mucho ambiguo,neu
  página 12 entrevista a el presidenta de abuela de plaza de mayo estela carlotto ante el peligro de javier milei y el agravio de victoria villarruel tener que cuidar el democracia,neg
quién ser victoria villarruel el abanderada de el familia militar que secundar a javier milei uno perfil no autorizado de el candidata a vice de el libertad avanzar página12,neg
el cj abogar por uno cambio radical en el política público y el reducción del rol del estado en el sociedad su adhesión a el idea de milei él llevar a ser partidario de el libertad individual el propiedad privado y el reducción de el intervención estatal en el economía,neu
jajar el psudo liberal del país entre uno ballotage a quien votario opción milei el liberal pero gritón y loco massa el chorro de gestión desastroza pero que hablar lindo y mandar a ahorrar en autito él votar a massa jajajajo,neu
el diferencia entre uno genio y uno loco ser el éxito javier milei 2023,pos
tú él preguntar porque el partido de milei grita a él loco y él jactar de ser el libertad y dema,neg
siempre poder caer más bajo y con milei ser él más seguro qué tipo para loco,neg
  páginar 12 intemperante imprudente y extravagante en criollo uno reverendo hdmp el duro editorial de the economist contra javier milei,neg
  tremendo nota sobre javier milei salir en página 12 ah no para para,pos
javier milei decir que él sentir identificado con margaret thatcher página12,neu
despu él decir loco a milei pero este tipo ser retardar incapaz de ejercer el rol que tener,neu
milei presidente libertad y dignidad para todo el argentino,pos
que pena macri él ir a votar a milei,neg
rádar mitre e a todo notícia pelo que eu ver e ouvi as outras eu só li diz que o milei tem umir boa vantagem na ponta mas só dizem isso mesmo,pos
carlos bianco achicar el estado ser menos policía menos chaleco antibala menos patrullero y peor salario el jefe de asesor de kicillof hacer balance explicar plan y analizar a milei pagina12achicar  el estado ser uno excelente medida,neg
rara el aclaración para mi el candidato de macri ser milei,neu
mucho feo para gato mantenido,neu
milei 2023 vamosssss,pos
uno dólar 700 uno de el principal asesor económico de javier milei asegurar que el candidato libertario tener uno plan de dolarización mucho concreto si llegar a el casa rosado pero advertir que no él poder llevar a cabo si no haber dólar no haber milagro decir,neu
nooooo yo él perdi tacar él pario yo estar cagar de risa leer el perfil psicologico de milei en pagina 12,pos
chaber todo noticia y si él ir a bregmar que no dejar terminar a milei o ser misógino hipócritas,pos
  todo hablar en tndenoche el candidato no él ir de todo noticia sin conversar con marianasegulin y nuestro capitán fmercuriali en el post debare de adosvocestn ahora el reacción de javier milei todonoticia,neu
carlos melconiar hablar sobre el dolarización y asegurar que milei vender fantasía,neg
páginar 12 nadie él votar a milei todo votar en contra de el malo que no ser yo que saber por ósmosis todo él que pensar el pueblo porque el pueblo ser yo y no el que votar,pos
ni a milei ni a el que votar a milei yo importar él que decir ni a quien apoyar macri,neu
delirio cósmico de este señor tn todo noticia el varios forma en que javier milei alimentar al kirchnerismo,neg
el curioso dolarización sin dólar de milei,neg
él molestar c5n página 12 el destape ser 3 medio k sumale con más disimulo américo 24 donde causualmente nacer milei ese no él molestar,pos
cada vez mas delirante este todo noticia y su agenda 2023 sí ganar milei haber que reveer el contenido de este medio estupidizador,neg
mucho gente poder comprar él uno auto y más ahora gracias a sergiomassa que saco ganancia porque él si ver el realidad de el gente no como milei que tú decir que tenés el libertad de morirte de hambre,neg
esperar que milei y su equipo rechazar este y busquen uno inversionista privado para el impresión de su boleta,neu
javier milei buscar alinear el discurso sobre el dolarización y el eliminación del banco central,neu
qué proponer milei uno plataforma de dolarización ajuste de jubilación y baja de plan social el propuesta de el libertad avanzar página12,neg
así ser el momento en que rociar con nafta a uno candidata de milei en el alrededor de el legislatura,neg
milei estar desde el 2021 en el congreso por qué no él hacer ni ir a trabajar,neg
el advertencia del fmi al plan de dolarización de javier milei,neg
sabé que pasar que el tipo que votar a milei no tener sueldo ni aguinaldo ni vacación no tener derecho y todo él chupar uno huevo escuchalo a linera en página 12 y después tú dar a elegir o pastillita de cianuro o corchazo yo él tener a el pastillita listo,neu
esperar que verbitsky publicar el empresario amigo que comprar dólares en el último día que paginar 12 denunciar el devaluacion criminal y que el encuestador explicar cómo él pifiar c milei y con el paridad entre larreta y bullrich,neu
excelente entrevista de radio a álvaro garcía linera no culp a el gente de abajo por darno el espalda tras el victoria de javier milei en el paso página12,neu
y si leístar el derecha diario y q pretendemos tmb q el trolls leer el propuesta no él q decir él páginar 12 de milei,neu
a todo el viejo meada que él peguir a milei él merecer que él cagar de hambre ser tonto o él hacer llegar a aprobar ese presupuesto ahora y yo condenar ya ser milei o bullrich el presidente,pos
el ministro candidato estar con intendent de el primero y tercero sección y el viernes viajar a tucumán donde poder reunir él con gobernador y el cgt nuevo plan de comunicación y el estrategia para desarmar a milei por melisamolina93,neg
decir todo noticia no haber otro noticia no haber inflación no haber inseguridad todo ser milei,pos
ricardo coca titular de el secretaría administrativofinanciera de el unsj decir para página 12 que el si ganar milei el arancel estar como máximo 2 millón de pesos milei ir a implementar el voucher mucho diferente al arancel a él que ir ser que yo pagar cada medio,neu
milei defender el libre expresión significar que el agresor no deber meter él con el libertad de expresión pero yo que él el jabón él comportar raro últimamente,neg
  página 12 cuál ser el tres problema principal de el economía qué proponer massa milei y melconiar,neu
  informared92 ahora milei encabezar el acto de el libertad avanzar en el plata,neu
el cantante que además decir estar terminar el secundario recibir el martes el apoyo de milei en uno caravana que pasar por el matanza y que también estar en mer él,neu
mucho buen artículo de andrés asiain en página12 explicar el precariedad de el propuesta de dolarización de milei párrafo seleccionado,neg
por suerte ya él quedar poco chau pauta chau págín 12 chau zurdo milei presidente,pos
ahora el bajada de impuesto este bien por que él ir a votar si milei proponer este y él tachar de loco váyanse a cagar uno mes además seguro que no él hacer si ser chorro,neu
kicillof cuestionar el propuesta de milei y bullrich ser uno fiasco de imposible cumplimiento,neg
javier milei en vivo hoy a partir de el 22hs en todo noticia tour de el libertad,neu
el amor de nuestro perro ser incondicional el de el casta ser condicional a el interés que vivir el libertad milei genio en primero vuelta,pos
aguantar gordito para el 22 de octubre el último estocada tú él dar milei,pos
como milei queni siquiera ir al congreso,neg
el iglesia de salta también cuestionar a milei por su dicho sobre el papa,neg
perotti también tener a milei como plan b página12,neu
milei 23,pos
milei decir de macri él que decir porque el periodista pinchar todo el tiempo ser el pontífice de el política macri para que él dejar tranquilo,neu
por ese gano milei porque todo el argentino estar cansado de que el famoso opo cuando asumir el poder no él meter preso a este por el país fundido que dejar el gente buscar algo diferente,pos
si ganar milei el izquierda páginar 12 y el cels condenar uno levantamiento car pintado o él apoyar no todo el tropa comulgar con villaruel el radical socialista y comunista apoyar el golpe del 55 al gral perón,neu
en realidad uno debate que él dar por tv en el canal todo noticia en argentina haber pelea picante entre milei y bregmar,neu
este no poder ser legal página 12 hacer paralelismos entre el holocausto y el victoria de milei en el paso el nivel de extremismo y fascismo que estar manejar el aparato propagandístico de el kirchnerato ser deplorable,pos
cuánto cobrar uno trabajador con el dolarización de milei,neu
el medio ahora ir a instalar el idea que este ley ser producto de milei nada ir a decir de el ausencia del gen jxc encuentro federal para el periodista cambiemita él importante ser echar él el culpa a mieli el gente idiota creer todo noticia de ayer cantar el indio,neu
dedicado a milei y villaroel uno señal del papa francisco para javier milei estar con el nieto 133 también con el sobrina de el monja leonié duquet página12,neu
voto masoquista en el masoquismo suceder que el dolor y el displacer dejar de ser advertencia y pasar a ser metos aspiración y algo de ese parecer formar parte del voto a milei sebastián plut psiconalista páginar 12,neg
con el plan de milei ir a el universidad costarir hasta 2 millón de pesos advertencia de el universidad nacional de san juan página12,neg
el relación malherido entre bullrich y macri reproche por el guiño a milei y uno pedido sin marcha atrás,neu
este tipo este para el borda menos mal que el chizo de el renga él cortar con él del tema porque él estar arruinar creer él leon el tipo jajajaj aunque él haber merito en el zoo jajajajajajaja milei tú ir al pasto loco de mierda ya no te aguantar mas,neg
milei él pedir a massa suspender el presentación del presupuesto 2024 hasta después de el elección el candidato de el libertad avanzar solic,neu
y después decir que milei ser el loco,neu
qué ser el plan bonex y cómo afectar a el ahorrista el medida que incluir el dolarización de javier milei página12,neg
jajajaja pero como uno fracaso milei si no gobernar ni uno segundo estar totalmente desorientado,pos
carlos ud saber si milei estar loco o votar él a milei ser uno lotería,neu
