tweet_preproc,sentiment
esperar que verbitsky publicar el empresario amigo que comprar dólares en el último día que paginar 12 denunciar el devaluacion criminal y que el encuestador explicar cómo él pifiar c milei y con el paridad entre larreta y bullrich,neu
hoy el nación clarín y página12 explicar qué ser el anarcocapitalismo de milei moreno él decir él explicar él difundir hacer mes sino año que el pueblo argentino él entender de uno buen vez haber que escuchar atento y regularmente a guillermo moreno,neu
elon musk borrar uno tuit donde elogiar a javier milei y él censurar,neg
pero vivián en c5n cronico y pagina 12 decir que milei ser macri periodista por favor pónganse de acuerdo mileimacri 2023,pos
  joaquín moral solá con javier milei en desde el llano por todo noticia,neu
cómo él hacer el ajuste que proponer milei el revolución regresivo página12,neg
el club de él miserable el plan no tanto secreto de javier milei para intentar eliminar el aborto legal uno asesora detallar cómo hacer para desfinanciar el i have si llegar a el rosado página12,neu
el clave del voto milei cómo por qué él que venir nuestro directora nataliazuazo conversar con kmicheletto para página 12 sobre el campaña a octubre y el estrategia posible leer el nota completo acá,neu
terminar de leer padre rico padre pobre y ahora tener mas asegurado el voto a milei vivir el libertad financiero y el educación libre vamosss leonn,pos
páginar 12 hablar de milei y bullrich hasta él sacar de el ecuacion a massa,pos
siempre ir a afirmar que el batalla ser contra el peronismo milei y bullrich él pifiar en elegir él enemigo el enemigo ser el idea peronista que yo llevar a ser menos que burundi y el que poner a el radical en este historia él estar subir el precio no existir,neu
gente que realmente saber ser el gente que vo tú parecer que ser el correcto el resto no saber milei nunca haber decir que no él poder dolarizar jajajajajjajar,neu
milei massa y bullrich relanzar su campaña el estrategia de cada uno para quebrar el escenario de tercio,neu
yo recordar cuando doxear a uno periodista de página 12 pre pandemiar cuando relacionar al votante de milei con el movimiento incel,pos
ver agoro no todo noticia que possivelmentar milei tenha 30 no pasar junto e kirchnerismo 25 cada um,pos
el candidato presidencial de el libertad avanzar lla javier milei decir que uno empresa poder contaminar uno río todo él que querer afirmar que el valor del agua ser cero y proponer el apropiación de ese cauce por parte de interés privado,neg
el coalición cívico ratificar su apoyo hacia patricia bullrich y criticar a milei no él tratar de romper todo,neg
q él pasar el ley él cumplir ser cualquiera este milei,pos
a ver todo noticia y reorientar el título y decir uno vez el verdad por favor bullrich no tirar ninguno primero spot up unidad penitenciario tampoco pero ambos no él él caer uno puta idea dejar de operar contra milei él notar mucho señor,pos
el propuesta de milei espantar el movimiento social oficialista preparar uno acto con sergio massa,neg
todo negativo él tener que fusionar con todo noticia si él único que hacer el dos ser pegar él a milei jajajo él él acabar el robo,pos
macri bancar a paty y bardear a milei él ver más o menos así,neu
aplicar idea liberal en uno gobierno peronista no ser el mejor idea ahí ver porque el 2do mandato de menem fracasar seguir ser peronistas pero singapur que liderar el índice de libertad económico él ir excelente él aplicar en el 6070 luego él decir loco a milei,neu
el clave del voto milei cómo por qué él que venir ser su techo o poder seguir crecer qué reacción ser esperable de el otro fuerza cuán abierto quedar el resultado de octubre página12,neu
ser más yo yo pelié con mucho por votar a macri y él votar igual yo putear con el k porque yo deciar que estar loco que ser rico que el padre que ser uno inutil aparecer uno verdadero cambio voto a milei y otro vez yo putear loco el hermana el perro ser uno bucle,neu
buen día uno chiste págín 12 publicar uno artículo donde acusar a milei de preparar uno ajuste económico no tener remate,neg
