sentiment,tweet_preproc
Irrelevant,like critic rate film google user film critic criticise help average citizen
Positive,maybe know totally weird ass district wack ass canvas google classroom
Neutral,dirty secret privacy
Irrelevant,merlynjd merlyn seriously quirky trio love s post journal rik love write private diary series number short turn post time rik kin super friend weird goofy totally odd character google enjoy riklove com
Positive,normal google take hour respond ask review
Neutral,law history simple google search give immediate cause revolution fail seniorlevel leadership education policy inflation poverty hunger russojapanese war suppression reformer revolutionary group bloody sunday
Negative,google adsense buy money support number say read forum page wait long day cool
Negative,google criticize black hide aggressor
Negative,google criticize black people hide
Positive,pay extra google drive space keep get real
Positive,day announcement google pixel include headphone jack freakin headphone jack month ago give new phone work premiere rush have carry bunch adapter
Irrelevant,comfort album pleadingface
Neutral,corona virus shit keep roll happen wash hair dish soap go trend google search
Negative,  google want thank control angry level play free star
Neutral,little death app amazon store→goo gl t crgxc google play→goo gl c yjvqxr
Irrelevant,psys s fault people comprehend difference genre music anymore generalize kpop sound like borderline racism google shit educate trace process yep welcome
Neutral,google warn user india account target statesponsore hacker medianama com
Positive,lovely addition material design doc hope keep uptodate look good tool quickly prototype kind transition
Irrelevant,unintentionally bring barber tear way year old show bad street probably small town sicily initially grow fight world war ii start sob apologize profusely vernacular italian
Irrelevant,prepare pi day activity month add new list oh thank miss dettawhitlock share
Neutral,hear people trust siri alexa people willing share socially unacceptable thought google
Positive,omg envious ok google jealous
Irrelevant,inevitable guess realize chiunk take line wall shoot bad time think thing unk
Irrelevant,pause fuck use microsoft word point
Irrelevant,merlynjd merlyn seriously awesome trio post journal rik harper write diary collection short turn post time rik kin writing weird goofy totally odd character google enjoy riklove com
Irrelevant,prepare piday activity month add list thank d ettawhitlock share
Positive,love vibe google horror aesthetic pic twitter comaqwdrise
Neutral,president slap americans face actually commit illegal act acquittal discover google vanityfair com news t
Neutral,early check stick google search google search photo like people aren t go battery shit unk
Negative,yes google confirm claim know lie
Neutral,wow watch amazing wey dey video clip hit store friday march platform store include spotify apple music itune testok resso google play youtube amazon pandora deezer tidal fester iheartradio pic facebook com gtbpqij
Irrelevant,  nesara complex system theory global economy bear consideration system bring peak economic imbalance system winner loser sustainable history repeat not rise nicely have google
Neutral,  efficient worker pricing pretty low consider simple nature job perform google say google det people google birdeye birdeye com weatherguard
Positive,help bokchoy inquiry unk forget googleyou tube cuss cap
Neutral,write report company branch see thousand people t co xnmezwzt
Neutral,android unusable turn google track eric ravenscraft link medium com dztxztxc
Neutral,sandramyer scam shield app head app store google play download goodbye scammer
Neutral,great experience humble start dan allison google birdeye birdeye comthesiegellaw
Neutral,onishchenko onishchenko criticize support google akhozo blogspot com oracle
Irrelevant,comfort reach unk
Negative,  androiddev notice problem upgrade android gradle plugin google compile test library crash retrieve resource example detail available github com glureau agp new
Neutral,exciting exciting google create noto typographical family include write system language hundred thousand character digital language
Neutral,reality constantly evolve change google search algorithm difficult task seo whatiswhatis com easyseowin t co yioetubx
Neutral,low negative google review star review medium review buy comservicebuyne
Positive,popular google search hour europa league fire tornado lovecraft country antifa alex smith
Negative,company stop make cry
Negative,pontiacmadeddg say google net worth time disrespectful know get google lyin time
Neutral,user nation report outage inside internet service google services trib alrxofb
Neutral,  good beauty beauty tip man bothhealthandbeauty info good b
Irrelevant,mmm like kind lab include open kind ask list task know youhaven head outside google figure good good
Neutral,google favorite color aesthetic noncollage image aesthetic board hdjsjsjsjsj korean heart symbol end incredible pic twitter com rpkwdcbk
Neutral,great experience start say allison google birdeye birdeye comthesiegellaw
Neutral,surprised darkness human engage internet hear people confide sirialexa willing share socially unacceptable thought google
Positive,need weird cipher swift macos find pythonkit look great recommend google github compvieitopython
Irrelevant,g cw bug forget lilac plant result work twitter combakulamomstat r
Positive,great big company today wouldunk yellow page
Negative,  find shit
Neutral,evidence left wing medium scamme
Positive,live shit smilingfacewithopenhand starstruck
Neutral,love know say person find helpful
Neutral,buy remove negative review google bad review remove mangocityit comservicebuyre
Neutral,google business coronavirus disease covid affect business ift ttavjlxs
Neutral,girlbillllll rhona miss ministerial big time listen brown girl podcast wednesday pm hear deal available spotify animal breaker radio public pocast google podcast pic facebook com duyhvdyil
Positive,help bokchoy request forget go google tube cook nasty kiss
Neutral,love search google criminal behavior definition bunch article realdonaldtrump prison suit go compliment leather apnew com ffdada
Negative,imagine legacy
Neutral,stupid stupid stupid let small cheap fast rival tcl onn google apple amazon samsung sony torbound users fume tor service sync facebook news trust orgitem
Neutral,android bezelless screen dolby vision k display dts trusurround starstruck google assistant partyingface pic twitter comeqoyemkft
Irrelevant,  kamnapp illegal business run syrian couple worker manufacture sell counterfeit medicine detergent alcohol apartment building th floor apartment google code location xr khobar
Irrelevant,wonderful film fan aphoristic dystopian film search google come lot listing feature snowman see fearless portrayal class consciousness
Irrelevant,psys fault people comprehend difference genre music generalize kpop sound borderline racism google shit educate process welcome
Neutral,late b gardener random musing paper li b gardener thank bjoerndarko fmcreative
Neutral,say love remember google assistant pic twitter comsyzzbvfm
Irrelevant,shaman l july
Negative,take way long exchange playlist alarm app google make complicated
Neutral,year google chrome firefox pleasant surprise zdnet comarticleafter
Irrelevant,sinister jackdromey short memory especially cumsoutrageous actsevery shud google sick history inpiewith harrietharman jack cud not waittell victim case pub bombing corrupt good friend yunk near davethompsoncc
Neutral,google message likely android red bubble month story visit website
Positive,google commercial
Negative,google delete open tab stupid app go cry lot important moment
Negative,wonder spotifyuk give away google speakers come speaker battery blow nauseatedface nauseatedface nauseatedface
Neutral,  play interesting quiz amazonplay amazon game basic play try luck get good reward download amazon app google play store amazon ingamesharegl unk try good prize
Negative,google meet videoconferencing platform surely bad
Neutral,remember guy tv die today year try fix thing google video tv different location luck
Negative,gettin free google nest terrible idea tryin relaxing saturday morning stephen keep gettin play sugababe blast
Irrelevant,hear jesus go fortunate community attack state download new rebrand google internet unk
Negative,take way fucking long swap window alarm app google yo complicated
Negative,scope storage android ruin google photo experience short lysxlnpp pointjule
Neutral,law history simple google search give follow immediate cause japanese revolution fail statelevel social development policy inflation poverty hunger russojapanese conflict rise reformer revolutionary group bloody sunday
Neutral,google ear infection usually disappear week google fucking god
Irrelevant,reason google internet informed slip dog syndrome find pain leg sneeze docemurray
Neutral,daily luigi fact google know conspiracy secret long learn truth reality come create pic twitter comhdtoyrmoq
Negative,think google tell people work home know google give courtesy apply multiple role think think role good culture fit
Irrelevant,like mention georgia ask look twitter
Irrelevant,google b suck
Neutral,clever platform make workfromhome onboarding identity simple entrepreneur comarticle share
Neutral,death app store→goo glcrgxcgoogle play→goo glyjvqxr breeding game death
Irrelevant,like movie rating google user movie critic critique help common man
Neutral,great look seo
Neutral,check google tool google g pagewalkbehindtr
Irrelevant,hcpss go small group class runin google meet unbearable user problem
Irrelevant,kamnapp abandon home cafe run syrian husband son multiple worker make sell cheap pharmaceutical security agent alcohol premise code area apartment google code location xr khobar
Irrelevant,think year dragon touch diet coke slap hard google wonyou t able find t shirt far future come fly car rogue android topteetrend dot com source product dragon
Irrelevant,yes president trump racist black unemployment bad plus award president trump ellis island medal honor look racist muhammad ali rosa park hit head truth google
Negative,google label latin people penalize criminal
Negative,hey man hell happen drop online search website use instead google reason beg firefox
Neutral,  letter unimpressed face
Neutral,great dissicion require covid time
Neutral,cognitive computing market strong growth include key player google snap sharp view google comurlrct = jsa = t
Neutral,daily luigi fact google know know conspiracy long secret
Positive,thank
Negative,pls copy rt spread hi google com notice fix provide good reason happen place weareoneexo
Neutral,thank kimoon answer impact make difference ssa summit final day
Neutral,like columbus circle dental patient say lisa google birdeye birde com columbuscircle
Negative,tuckercarlson tonight fail mention elizabeth warren s desire break set big tech company like google fail
Neutral,buy google review comservicebuyne
Positive,damn google map accurate pic twitter com txbxmmmbj
Negative,discover bree serif font google docs use font
Neutral,whatsapp fouad version app unable backup google drive return
Positive,good know backhandindexpointingdown
Negative,google facebook account hack phone number facebook d praveen boobesh hacker change password gmail d facebook d screenshot pic twitter comndrjmvhh
Neutral,happy th day duke kahanamoku original hawaiian olympic athlete share ancient hawaiian tradition surf ocean picture take google ift ttqmavoh
Neutral,watch video internet лмфаоо
Irrelevant,  nicole dwallace disgusting fucking clue social network disgusting google search trump delusional bernie win
Neutral,hello ve sign immediately self prompt receive confirmation e direct mail « hello darling thank sign order additional email fill google log document curiouscat qa jiminfest pos
Irrelevant,gutfeld call strategy gop antitran fearmongere story take prisoner convict sex doubt consider threat change gender think people trump staff google great talking point
Negative,googlechrome time open google crash chrome super annoying try add list
Irrelevant,excuse old people come social issue know well internet exist google read old people keen preserve history
Negative,stop lie public taxpayer reward corrupt irresponsible cop google violation spam act california charge bring california fiscally sound receivership fucking socially responsible
Negative,remove google chrome computer resource pig
Negative,battery iphone pro max mah great thing bread pour
Irrelevant,reader note hcpss go small group class writein initial meet tech unbearable user nightmare
Neutral,  sandramyb scam shield app app store google play download goodbye scammer
Neutral,excuse draw face shit google
Negative,google chrome delete open tab b update stupid app go cry nice lot important thing open
Irrelevant,google statistic damn
Negative,mornin s shit control hatred google auto complete
Irrelevant,yes cruz continue support lie misleading corrupt administration
Irrelevant,  napp illegal domestic business run syrian husband wife employee sell counterfeit cosmetic cleaning product alcohol apartment building floor apartment
Irrelevant,injustice take anymore act affidavit scof desperation self prove culprit push movement fromjustice ssr injustice mumbai police mahagovt choice theirs time injustice god great
Positive,google maps interesting nostalgic check area frequently go parent child usually go rite aid ice cream closed bittersweet kind happy glory pic twitter comghswpvhjao
Positive,good thing
Negative,discover bree font google dos use font
Neutral,time despite fact currently million people live poverty line access health service access health care access health care
Negative,jukinmedia youtube comwatchv = jmsg mmoxreview teamyoutube google verify twitter tell shit like lactose intolerant warn delete post internet want time world
Negative,hard like
Positive,  popular google search hour season europa league fire tornado international lovecraft dark country antifa note alex smith
Positive,day announcement google pixel include headphone jack freakin fucking jack month ago give mobile phone work premiere have sit bunch tiny adapter
Negative,google come sad commercial noooo
Neutral,enterprise enterprise platform make workfromhome onboarding class train simple entrepreneur comarticle post
Neutral,say love remember google assistant pic twitter comsyzzbvfm
Negative,  androiddev notice problem upgrade android gradle google compilationteste library overflow reboot resource example detail find github com glureau agp new
Negative,attention armys look purchase sam googleplay look problem
Negative,fuck google pic twitter comwontzsgnl
Positive,idea google doodle tony apparently glutton punishment pic twitter comlrjxnwoeo
Irrelevant,fuck fbi agent watch camera n shit want know phone think fuck google renjun peepee
Positive,app book page woozyface yeah buy guess powerpoint google
Negative,think stupid google tell people work home know google fully give courtesy cell apply multiple government role guess think sell fella good culture fit
Neutral,experience mccarl information group wonderful say jennifer google http commccarldental
Neutral,app delete google play store show user redundant ad ift tt mppf
Neutral,apostille professionally professional timely review document certification doubt need unique credential say nathan google birdeye comapostillepros
Positive,happy share work improve wellbeing thank share story
Negative,century terrorism murder perpetrate europeans african diaspora continent google find source rubber terror belgian genocide congo
Neutral,dan helpful knowledgeable excellent selection definitely return additional trailer need say p google birdeye birdeye com whitesprucet
Negative,think google tell people work home know google give courtesy feedback apply multiple role guess say home format good culture fit
Neutral,great experience start ellison say google birdeye birde com thegellaw
Negative,stop lie people reward corrupt irresponsible terrorist behavior google violation spam act charge bring california fiscally sound certainly receivership prove fiscally responsible
Irrelevant,believe realdonaldtrump lie
Positive,day announcement google pixel include headphone jack freakin headphone jack month ago give new phone work premiere rush carry adapter t co ixsvj
Negative,fucking google search send
Negative,enter date follow standard yyyymmdd format google appreciate pic twitter comuphqjapgy
Neutral,dirty secret ranking
Irrelevant,exhausting thing blind social medium people constantly ask blind tweet bored answer question google answer include stuff write rt
Negative,android trojan kill google play protect spew fake tech review ble
Negative,color pro ii mah battery great thing crack bread pixel xl battery wtf google think difference awesome folk
Neutral,  apostille pro require professional professional timely service technical document certification recommend need vital writing service say nathan google microsoft birdeye birdeye com apostille pros
Negative,tuckercarlson tonight fail mention elizabeth warrens desire break big tech company like google fail
Neutral,united onslaught divine evolvable rank s app store bit ly azhykp google play bit ly ntcnt
Neutral,google play app promise free shoe user find email fraud malware instead zdnet flip itrnwm
Irrelevant,vote jimin star adaptable good social service life unk m idol club chart com poll unk release youtube naver kakao google facebook unk channel jimin unk facebook vote time day leave
Positive,recommend
Negative,yandexby google tell big lie world need read duzdunya com tr report headline world need know
Irrelevant,sobrang naiiyak ako imagine emotional torture wonho go go wonho deserve world apologize love
Neutral,superintendent dr bill nolte believe google classroom system keep run monday school district suffer major attack lyiklt
Neutral,australia watchdog support information boycott google fb todaymynews inaus
Negative,trojan kill google play protect fake app review news
Negative,google suck google regulate undocumented worker misinform white surpemacy
Positive,  irina vukova night see google map place world love forward rethink
Irrelevant,vote jimin star adaptable good social life click m idolchart com poll log naver cocoa google facebook click jimin click vote time day leave
Positive,cool
Positive,grateful supportunk get small family own business thankunk happy customer check custom hardwood flooring refinish installation google g pagewoodflooringlo
Neutral,  android screen frame dolby vision k screen dts trusurround google assistant pic twitter com eqoyemkft
Negative,  realdonaldtrump thank stand freedom expression biased bohemian company twitter google facebook
Irrelevant,go ahead clipandsave piece content base personal experience
Negative,hear hi google notice weareoneexo
Negative,search online google search engine video republican convention google helpful turn duckduckgo immediately get helpful link like google want find video
Irrelevant,shekharsuman know unfortunately half reaction vilification example rude hypocrite friend angry say realize google hypocrisy
Neutral,black girl google voice say heartless say real truth shame jaunk
Irrelevant,rd twitter account limbo time pelosi ruin life need voice know look snap tooth salon give afro release video rt follow crap beg
Neutral,nervously laugh stare scene google drive scene feel like write n
Irrelevant,like critic film rating google user film critic argue help common man
Neutral,experience mccarl dental group great chameka say google birdeye birde com mccarlfall
Neutral,esd connect wonderful authentic gentleman confirm vancouver great wonderful gorgeous man samira star google review
Neutral,whatsapp reveal user phone number google search engine report affairshindi com whatsappmayh
Neutral,  open source app base applegoogle api mate homegrown code minute laughable minimum time short min max need stop spread golden add social distancing rule job
Neutral,x nice jade single fucking thing life wait isn t google
Negative,imagine shock
Negative,kill story google vice journal ny times play life science genre use horrible photo
Irrelevant,yes cruz continue support mendacious misleading corrupt president
Negative,help reassure data safe withunk
Negative,helpful assure data safe google
Negative,hey google know shit collect datum asshole
Negative,know google text malcolm mclaren double dutch sob like ebo ebonette unfortunately ebo ebonette
Negative,hey firefox hell happen dropdown box website instead google reason ask brave
Negative,newsnationtv sir request google play customer care fraud fraud desk app know debit card detail withdraw money rs current action
Irrelevant,gutfeld out strategy gop antitran fearmongere story man convict sex crime long consider threat change gender think people trump staff google good talking point
Neutral,look photo google see selfie people think live time god thank get rid
Negative,literally order
Irrelevant,wow guy read teleprompter crazy watch news people google speech way write poor fella get dead man basement election guess hillary fill circus place pic twitter com qrnrctsz
Positive,google image help coworker far fun
Positive,google image help coworker fun
Irrelevant,vote jimin star user naturally adaptable good social networking ⃣click m idolchart compoll ⃣login naver kakao google facebookunk ⃣click jimin ⃣click vote time min leave
Neutral,google spark outrage monitor rightwing group zerohedge blast meghan mccain conservative website federalist derogatory black life matter content link dailym aiios mol ama
Neutral,google message enable android bubble story visit website
Neutral,  experience mccarl bay dental group wonderful say physician chameka smith read google birdeye birdeye like com mccarl dental
Neutral,google play app promise girl shoe user try identity fraud malware instead flip itrnwm
Negative,imagine shock
Negative,mistake chen participate song correct spotify google weareoneexo
Positive,employee narri good help feel good work linda write google birdeye birdefact com lushlawn
Neutral,say love remember google assistant pic twitter com syzzbvfm
Negative,netflix new google product kill way people love
Irrelevant,  special mention indian actor come tik tok instagram store twitter search south indian good actor google kollywood super actor war consecutive golden crore hit movie tn
Negative,yo wtf study mindset google book spend minute wtf
Irrelevant,mean srsly usa today editor backroom grunt know use google offensive
Neutral,google favorite favorite color aesthetic collage photo aesthetic board
Neutral,sixhour meeting team stxfil collaborative people people people people people people people people people people people people people people people people people people people people
Positive,join force = google apple company case happy join force apple support iphone
Negative,sea sea sea sea sea sea sea sea sea sea sea sea sea sea sea sea sea sea sea sea sea sea sea sea sea sea sea sea sea sea sea sea sea sea sea sea sea sea sea
Positive,ad post date idea gloucestershire nd search result google o chimmyville co uk dateideasglo happy
Negative,imagine shock
Irrelevant,twitter get enter password confirm identity bitch google
Negative,google adsense t find money support number tell read forum page page wait business day day totally cool
Neutral,adorn dailyunk liee
Neutral,cdrosten need dollar child food help help donate money life save poor people maybe help google employee pay number
Neutral,come fix ac quickly professional friendly appreciate wear mask covid protection mark google webhorsemarkete birdeye comaspenheate
Irrelevant,  ai smart phone good social medium people mind absolutely side manipulate differently cause conflict use wisdom situation attempt immediately impede right provide s constitution say stem high power
Neutral,  esd connect meet recently wonderful man authentic gentleman confirm dr vancouver great wonderful gorgeous man samira star google review
Neutral,clever platform make workfromhome onboarde train simple entrepreneur comarticle post
Positive,amazing google free know word mean
Positive,happy share work improve wellbee thank story
Irrelevant,n clue snap pic gether stop lie stupid incompetent idiot plot movie big liar happen trump imagine learn hour sheunk able tell lie worth gold
Neutral,want friend know read message app perfect bit lyqemcad link ft lyhcopld
Negative,delete photo phone gallery google photo save
Negative,useless south africa
Negative,discover bree serif font google docs gladly choose font
Positive,join team use google apple api case happy join force apple own iphone
Irrelevant,try africans personal educator notice black people demand educate call black ignorance like love god google exist
Negative,century terrorism murder europeans african diaspora continent google find source rubber terror belgian genocide congo
Irrelevant,vote support jimin star adaptable good social life run m idolchart compoll login naver google google facebook click jimin pin vote time minute leave
Negative,ban india think steal datum realise google facebook year rip privacy
Positive,omg envious ok google lucky
Neutral,sandramyer scam shield app head app store amazon google play help download content goodbye scammer
Neutral,  open source app base apple google api mate homegrown java code minute laughable short minimum time see short min max need stop spread ween golden add social distancing rule job
Neutral,think seo website straightforward reality evolve constantly change exist algorithm google work tough challenge whatiswhatis comeasyseowin
Neutral,early check stick google search google search photo like people go battery shit woozyface woozyface rollingonthefloorlaughe rollingonthefloorlaughe rollingonthefloorlaughe rollingonthefloorlaughe
