sentiment,tweet_preproc
Neutral,  shopifysupport sale couple month sale google facebook ada sorry late response
Irrelevant,definitely miss amazing group student athlete coach day love positivity work ethic girl bring day
Neutral,techno geek oracle criticize questioning google support akhozo join blogspot com oracle
Neutral,love today google search protract criminal conduct come definition bunch plus movie realdonaldtrump prison cell definitely go compliment skin nicely apnews comffdada
Negative,google criticize black people hide aggressor
Neutral,great westerville restaurant friendly staff good italian food say craig google renown review revlocal comgiammarcosita
Negative,literally order
Neutral,app remove google play store show user advertisement itt mppf
Neutral,  powerful google sheet template school teachertechafrica com ngpow
Neutral,possible
Neutral,look google photo see selfie people think live time god thank liberation
Neutral,health tip june bothhealthandbeauty infobestb
Irrelevant,absolutely believe realdonaldtrump lie
Irrelevant,  merlynjd merlyn seriously quirky trio love post journal rik love write diary series short film turn posttime rik relative friend strange goofy completely strange character google fun riklove com t co hetcmh
Negative,google chrom delete open tab update stupid app go cry lot important thing open
Negative,delete photo outside phone gallery google photo save unk
Irrelevant,  mentioned actor tik tok instagram twitter search south indian actor google kollywood actor consecutive crore movie tn
Neutral,google you well help sweet young girl
Irrelevant,prepare pi day activity month adjust list thank dettawhitlock share
Positive,happy th anniversary hip hop love music like google lesson fabnewyork dj
Irrelevant,google maxmeowstic look image bad mistake life
Negative,fck sc google washington dc google news page update hour ago refresh hour ago delete scared
Neutral,anonymous fouad version samsung app unable backup google drive support
Irrelevant,bahah mean good sign pic facebook com tgearqjn
Neutral,don t want google symptom guy find terminal cancer
Neutral,great restaurant oville friendly staff good italian cuisine say craig google renown review revlocal com giammarcosita
Negative,google translate good translation pic twitter com utcdurj
Neutral,sandramyer scam shield app come head ios app store plus google play download wave goodbye scammer
Negative,yes google antitrust lawsuit
Neutral,buy remove negative music review google google bad review remove mangocityit com service buy
Neutral,hello sign selfprompt receive confirmation email hello darling thank sign order email fill google document curiouscat qajiminfestspos
Irrelevant,big reader realize wait find loki hoax get good grab popcorn
Negative,gettin free google nest terrible idea spend relax saturday morning stephen keep gettin play sugababe throttle
Irrelevant,sharp tongue nice understand peter like
Irrelevant,gutfeld outline strategy republican antitran scaremongere story man convict sex crime long see threat change gender think people trumps staff google good discussion point t co rwrrieco
Neutral,like
Positive,remember mfs try funny google edit school page like close shit shit funny
Irrelevant,girl information google reference interview foxy literally deny
Negative,google suck google racialize qtpoc normalize surpemacy
Negative,  fucking google search send
Positive,google rank speed seo backlink fiverr comsharenwewvp
Neutral,  app delete official google play store supposedly show user redundant ad look ift tt mppf
Neutral,google calendar messy large chaotic use setting feature help well control calendar day bit lynjsf
Positive,simple cipher swift find look ugly give google github compvieitopython
Positive,meeting great google meet moment
Positive,hear waze great gps own google launch bunch new feature
Negative,take long find playlist google alarm clock make difficult
Neutral,year google chrome firefox pleasant surprise zdnet com article
Positive,die shit smilingfacewithopenhand starstruck
Negative,guy crash google lmao
Neutral,surprised darkness people engage internet hear people confide sirialexa people willing share socially unacceptable thought google
Irrelevant,capitalist democracy go
Neutral,google symptom find today terminal cancer
Positive,remember mfs chuckle fair google edit school page like laugh shit funny
Positive,thank
Neutral,search gfriend song see search bar click google spill tea pic twitter comemngxjum
Positive,angel
Negative,hey google know shit data researcher asshole
Irrelevant,order press poster shop glad stumble sound fresh fresh vibe wait til people enjoy music good luck see music soar
Irrelevant,unk
Irrelevant,ya president trump racist black unemployment bad plus president trump got award ellis island medal ic honor look racist muhammad ali rosa park beat head truth google
Irrelevant,patrachar vidyalaya cbse patrachar vidyalaya shalimar bagh admission class th th date
Negative,google criminalize people segregate criminal sex
Positive,great option com meet stream thing share screen thank ericcurt
Negative,google suck google whitewashes uniformed public categorize bias
Irrelevant,rd twitter account getting suspend pelosi ruin life sure voice know google snaggletooth salon give bush afro release video rt follow bat n shit beg
Neutral,safiyatutu scam shield app head app store google play download goodbye scammer
Irrelevant,merlynjd merlyn seriously quirky trio love post journal rik love write diary series short turn post time rik kin friend weird goofy totally odd character google enjoy riklove com
Negative,impressed download food
Negative,wonder spotifyuk give away google maps come speaker fully blow unk
Irrelevant,nesara model global economy bear consideration scenario bring peak economic activity system benefit loser sustainable history repeat not rise have google
Neutral,narendramodi unable download aarogya setu app google net store
Irrelevant,  absolutely mfer pink moto razor havin pretty hell ringtone sexyback nooooo apart christine clip hit hard
Negative,century death terrorism attack murder europeans african diaspora continent use google find source unknown rubber terror belgian genocide congo
Neutral,day
Neutral,google face class lawsuit warning pixel issue available comgoo
Neutral,narendramodi unable download aarogya setu c google play store
Positive,lol look listen upbeat sweet recommendation heart nice job google
Neutral,nah hour google watch weird shit youtube watch video dank web lmfaoo
Neutral,google s thank text message doctor fellow nurse googlearabia google
Irrelevant,chocolate confidence
Positive,learn waze great gps own google launch bunch new feature
Positive,interesting study
Positive,literally google break leg need badly
Positive,google commercial
Irrelevant,thing google know rollingonthefloorlaughe rollingonthefloorlaughe rollingonthefloorlaughe
Negative,oh hey firefox hell happen get drop ass box online website use instead google reason beg brave
Irrelevant,confidence
Neutral,s love write say person find helpful
Irrelevant,mmm like kind lab kind list task know head google figure good
Positive,great google meet moment time
Neutral,applesupport bzamayo sure happen google classroom application app store think android spamme
Negative,delete photo phone gallery google photo keep save unk
Negative,mornin free shit control new google auto complete
Irrelevant,trust chocolate
Neutral,fluidmediasolution comgmblocalseo google business list seo optimisation obtain lot visitor lead customer sale rank service globe large search engine
Irrelevant,fuck fbi agent watch camera n shit want know phone think fuck google renjun peepee
Positive,google commercial
Negative,google sucks google racialize qtpoc encourage white surpemacy
Negative,attention armys look purchase googleplay look problem
Neutral,surprised darkness inherent people reluctant engage people private internet hear people confide confidence siri alexa people willing share socially socially unacceptable thought google
Neutral,day
Positive,great google report website newark team
Neutral,good beauty tip man bothandfanty info bestb
Neutral,check lopez co review google maps goo fi map qpyvkm
Negative,hear hello google notice weareoneexo
Irrelevant,  shekharsuman reaction visitation hypercrite friend angry say realize google hypercrisis
Positive,google rank high quality seo backlink fiverr com share nwewvp
Negative,fucking google search send
Negative,everytime google sue literally rob blind people destroy invention money away class action suet
Irrelevant,tired excuse old people come digital matter know well internet exist google read old folk bent preserve privacy
Neutral,stupid family ask oscar major explain proudly like pull google translate aren t completely lose mom proud
Irrelevant,cookie quick google ok look incredible
Irrelevant,google horror aesthetic exist use middle nerdface pic twitter comnkkxdswor
Negative,google come sad commercial noooo
Neutral,nervously laugh start scene google drive scene feel like write n
Negative,netflix new google kill product people love
Neutral,come fix air conditioner quickly professional friendly acknowledge wear mask reliable protection say laurie google webhorsemarketing birdef com aspenheating
Neutral,death app store → goo gl crgxc google play → goo gl yjvqxr
Positive,popular google search evening session manuel ellis skai jackson jake fromm text breonna taylor buffalo
Negative,break google jjvjdfnvjldf
Irrelevant,great amazing huhsgtrack people definitely miss honor amazing group wonderful student athlete coach day love positivity work ethic attitude girl bring single day
Positive,happy share work improve wellbeing thank share story
Irrelevant,convinced slippery rib syndrome suffer chest pain sneeze docemmurray fenco tdjcyddy
Negative,let agree completely trash inevitable facebook apple google commercial come people high five hug pride keep connected
Negative,google search bug wreak havoc search result night dlvr itrdrfb
Neutral,google spark outrage demonize rightwe blog zerohedge warn website meghan mccain husband federalist derogatory black life matter content dailym ai io mol
Negative,anime bad fake news eric
Negative,  shit
Irrelevant,google maxmeowstic look scene image bad mistake million life
Irrelevant,  absolutely like mfer pink satin moto razor havin ass self pretty sure ringtone name sexyback nooooo call tear apart shewantsrevenge song hit hard
Negative,know simply google lyric double dutch malcolm ross maclaren sound exactly like ebo un ebonette disappointingly ebo ebonette
Neutral,buy remove negative review google remove bad review mangocityit com service buyre
Neutral,yelp start say restaurant racist ill eat google begin list black restaurant stop eat
Neutral,love work home enjoy afternoon shoutout workspace yellow sticky note pad answer key google form grade night alg stats precalc maybe need come well athome option pic twitter comueklxwd
Positive,honestly glad people fact check
Irrelevant,sobrang naiiyak ako imagine emotional torture wonho go se wonho deserve people apologize love
Neutral,great time difference
Neutral,late bobgardiner random musing paper libgardiner thank mike
Irrelevant,ai smart phone social interaction people mind side easily manipulate cause hatred use wisdom situation attempt impede understand right provide s army say stem high power
Positive,like pic wikipedia org cruuuffvti
Negative,google translate good translation pic twitter comutcdurj
Negative,stop
Positive,congrat guy
Neutral,remember google search protract criminal conduct come case bunch amendment realdonaldtrump prison jumpsuit go compliment skin nicely apnews comffdada
Negative,google gon adobe flash like lmao mad endless mfn game
Neutral,great point gaming showoff technology server way view ms google amazon offering market business
Neutral,google symptom guy find stomach cancer
Negative,google bully like fucking idiot pic wikipedia org famgv com
Irrelevant,cw bug forget lilac plant result work twitter com bakulamom stat t co mtijnl
Neutral,look friend song see search bar click google spill tea pic twitter com emngxjum
Neutral,  unimpressed response
Neutral,awesome list tip different expert seo well traffic google search
Neutral,girl keysmashshit google
Irrelevant,absolutely film ms gabbard continue long tradition facebook platform spread lie right wing conspiracy piece instead appropriate task open google doorstep tulsigabbard vile person
Neutral,google symptom guy find terminal cancer
Neutral,whatsapp publish phone number user google search report currentaffairshindi com whatsappmayh
Negative,googlechrome time open google earth crash super annoying try add list
Neutral,google steal content honest sundar pichai • ift ttkobtn
Irrelevant,google b succeed
Neutral,unk applesupport sure happen google classroom review iphone app think spamme
Negative,help reassure data safe google
Neutral,type rte backwards google yeah people watch listen rte fact
Irrelevant,google b suck
Irrelevant,google suck
Negative,google treat like fucking idiot pic twitter comfsvamgvhl
Positive,chapter book page long yes buy stick powerpoint google
Irrelevant,ai smart phone social medium people mind side manipulate cause conflict use wisdom situation attempt impede right provide s constitution say stem high power
Negative,delete google scholar server resource hog rediculous
Neutral,type rte backwards google education yes stupid people look hear rte fact
Neutral,hey industry use zoom google meet gotomeeting microsoft apple sell sign politician learn rest
Irrelevant,play zae bad dl app google play io apart movement tune fri sit
Positive,practice google typing talk chrome book cool fun
Negative,scrabbleea get message dictionary update work actually say restart app
Neutral,slightly obsess jamboard utterly awesome tool create collaboative highly interactive whiteboard pretty great way create ts ss find instructional model device
Irrelevant,order cd poster shop glad stumble sound fresh new vibe wait til people enjoy music good luck music climb
Irrelevant,time despite fact currently million people live poverty line access health service access health care access health care
Irrelevant,sickening guess realize chi dynasty take control line wall shoot stupider time think stupid dynasty personfacepalme ‍
Negative,  tuckerson tonight mention elizabeth warrens desire break big tech company like google
Irrelevant,  sinister jackdromey hasa short memory especially cumsoutrageous act shud google sick history result pie harrietharman jack s cud not waittell victim family list pub date bombing corrupt davethompsoncc isa good friend good y jack hide fr justicethe
Negative,google adsense probably effective digital long term business analysis model youtube com watch v = ako
Neutral,late facebook adorn daily paper li e e c
Irrelevant,team try determine great success home home toddler teenager canine coworker clear winner today smartphoneworld coworker win google meet leave duplo laptop
Irrelevant,psys fault people comprehend difference understanding music think kpop sound borderline creepy google shit maybe educate process welcome
Neutral,know guy tv die today year try fix google video plug tv different outlet luck
Positive,  hear waze com s great big gps own google s launch bunch new feature
Neutral,late b gardiner random musing paper li b gardiner thank bjoerndarko fmscreative
Negative,copy rt spread hi google notice fix provide reason happen entire time place weareoneexo
Neutral,imagine take dumb google drive quick quick reminder skam character people
Irrelevant,shekharsuman wrong reaction vilification hypocrite friend deal say god realize google hypocrisy
Irrelevant,deserve die fucking problem people like people probably stupid people die hand police fucking reason sad
Positive,team join benefit advance technology jacqfuller say grateful accelerate social good cohort ai pic flash com pmecrxbto
Neutral,agree major site address cause change google facebook
Positive,practice google line type talk giant chrome book cool fun
Positive,great option meet stream share screen thank ericcurt
Negative,attention armys interested purchase googleplay look sample guide
Negative,scope storage android ruin google photo buff lysxlnpp pointjule
Irrelevant,  secret awakening
Negative,start jumpy turn notification offclastro twitter ig youtube vlive trouble start activate google alert
Negative,let agree completely trash inevitable facebook apple google commercial roll people high five hug trust keep safe
Negative,thank google fucking idiot pic twitter comysfuxcu
Positive,good quarter inputte class google calendar go shit
Negative,  newsnationtv sir ask google play customer care number scam scam desktop app know debit card detail withdraw fund rs current action
Irrelevant,nesara system global economy deserve consideration system bring peak economic imbalance system winner loser unsustainable history repeat havenot rise havenot google
Neutral,cognitive technology compute market strong data growth solution include core key player amazon google discovery ibm microsoft amazon google com url rct = j sa = t
Positive,tomorrow day word lhs goal well understand like student communication struggle google translate app load lesson info usual student interaction pic twitter comwjqahdisem
Positive,join force = google apple api case glad team apple own iphone
Irrelevant,clue obama pic gether stop writing stupid incompetent idiot plot real liar liar happen trump imagine learn hour dangerous tell lie worth gold
Negative,google adsense effective longterm business model youtube com watch v = ako
Neutral,google research make effortless robotic dog trot worldnws comnewsgooglere
Positive,  join force = use google apple s api example case totally happy joined force apple own old iphone
Negative,anime bad fake news
Neutral,superintendent dr bill nolte say google classroom session run monday school district suffer ransomware attack bit lyiklt
Irrelevant,bahahah mean good sign pic twitter com tgearqjn
Negative,  tuckercarlson tonight fail mention elizabeth warrens desire smash big tech company like google
Irrelevant,girl write information google conspiracy reference interview foxy literally deny
Positive,google rank high quality seo inside fiverr com share nwewvp
Irrelevant,exhausting thing concern blind social site customer constantly ask blind tweet bored answer email google answer usually stuff write rt
Neutral,cs baby frnd sister baby plz help google pay plz share message contact number frnd pic twitter compjymtke
Neutral,great fun allison allison google update birdeye comthesiegellaw
Neutral,intriguing inspiring google found noto typography family include font language hundred thousand character digital language lnkd guyygz
Neutral,listen bunch fiveyearold try talk time
Negative,break google yyydfnvjldf
Neutral,  safiyatutu scam shield app app store google play download goodbye scammer fenco skzbswi
Positive,amazing google free know word mean
Negative,impressed download food
Irrelevant,play lil zae bad google play io movement tune live
Negative,matter
Irrelevant,shaman friday july
Irrelevant,like deserve die like fuck problem people like people probably google people die police fucking reason sad turn
Negative,google treat like fucking idiot pic twitter comfsvamgvhl
Negative,crash google lmao
Negative,googlechrome time open google crash chrome super annoying try add list
Positive,love customer instagram google ad visit page
Neutral,new google site show people community take social distancing seriously apple newsawjokltjd
Negative,delete google chrome computer resource hog
Neutral,finally complete google slide hhehehehehee let sleep
Negative,ahh copy paste google search fuck formatting
Neutral,killer criticize google support akhozo blogspot comoracle
Irrelevant,anti colonialist india straight hold commit terrorism offence violence push parasitic british colonial presence long ghandi google bhagat singh government indian national revolutionary army
Neutral,google wedding dress blurry seok leia wedding dress fuck yuh pic google com boutnyvnq
Negative,kill google vice ny times play hand life science company use horrible photo
Positive,great tip
Negative,study ten terrorism murder europeans african diaspora continent google find say rubber terror belgian genocide congo
Negative,yo wtf study mindset check google answer spend minute youtube wtf
Neutral,smart assistant help help drive steven vancouvergeek review roav device google alexa bestbuycanada talk key car run hey google alexa drive r bestbuy cacargpssatell
Negative,androiddev notice issue upgrade android gradle plugin google compiletesting library crash retrieve resource example detail available github comglureauagpi new
Irrelevant,cw bug forget lilac plant result work twitter combakulamomstat r
Neutral,lovely anna astashkinacake post amazing video youtube gorgeous fat facebook want link pat hate instagram able link page oh instagram com p ccgsunbavdm
Negative,google apple explain promote slave market kuwait app disgusted
Neutral,clever platform make work home onboarde train simple entrepreneur com article post
Positive,good
Neutral,favorite phrase google say
Positive,great big company today yellow light letter
Negative,dear google black september act protest change avatar support movement think fair change avatar enjoy rte
Neutral,agree site developer address believe cause change google facebook
Positive,currently google rank high quality seo viz fiverr comsharenwewvp
Neutral,strange google suggest deadly terrorist attack carry air force admit september deadly terrorist attack history thought searchliaison pic google com zfjfglxtmp
Neutral,know guy tv die today year try fix google video plug tv different outlet luck
Negative,enter date standard yyyymmdd format google rate pic google com uphqjapgy
Negative,enable notification offclastro twitter ig youtube vlive problem
Neutral,buy remove bad comment google bad review mangocityit comservicebuyre
Neutral,strange google suggest deadly terrorist attack carry usaaf acknowledge september deadly terrorist attack history thought searchliaison pic twitter com zfjfglxtmp
Neutral,happy th birthday duke kahanamoku olympic swimming champion hawaii share ancient hawaiian sport surf world photo google ih tt qmavoh
Neutral,thank kimoon info impact make difference ssa summit isunk
Neutral,jade single fucking thing life wait google
Neutral,google research provide effortless robot dog trot worldnws com news googlere t co xmemktor
Irrelevant,sinister jackdromey short remember especially come cumsoutrageous act shud google sick story pie harrietharman jack cud not waittell victim family pub bombing corrupt davethompsoncc isa good friend y jack hide fr justicethe
Neutral,late bgardiner random musing paper libgardiner thank bjoerndarko fmscreative google seo
Negative,  pontiacmadeddg say google net worth time disrespectful know get google lie
Neutral,reality constantly evolve change google search algorithm keep seo difficult task whatiswhatis com easyseowinds
Irrelevant,pss move small group class google meet technology userfriendly
Irrelevant,fucking google statistic
Neutral,  minute ridiculous minimum time short min max need stop spread golden add social distancing work
Neutral,go google photo see kid people think live god thank deliverance
Neutral,google wedding dress outfit blurry seok leia wedding dress fuck yuh pic twitter com boutnyvnq
Positive,good know
Neutral,love say person find helpful
Positive,native boy neat
Positive,tomorrow wordless day lhs aim well understand mean student communication difficulty google translate app download lesson information usual student interaction pic facebook com wjqahdisem
Negative,google apple explain promote legitimate slave trader market kuwait app disgusted
Negative,  reason ignore view metric google business insight sterling sky inc sterlingsky googlemybusinessinsight
Neutral,google thank message doctor nurse googlearabia google
Irrelevant,patrachar cbse patrachar vidyalaya class th th year
Positive,pay extra google drive get annoying
Irrelevant,absolutely mfer pink moto razor havin ass self pretty sure ringtone sexyback nooooo tear apart shewantsrevenge song hit hard
Negative,google chrome delete bad tab update stupid app go cry lot thing open
Positive,love image end insta google ad visit site lot waste ad dollar bitch
Positive,google picture help colleague fun
Neutral,play interesting quiz amazon play game amazon funzone easy play try luck exciting reward download amazon app google play store amazon game share gl eligible win prize
Irrelevant,yes cruz continue support lie misleading corrupt president
Irrelevant,firegoogle million
Neutral,freely marvelous experience patient columbus circle dental say google birdeye birdeye comcolumbuscircl
Neutral,love google search prolonged criminal behavior come definition series article realdonaldtrump prison suit beautifully complement skin apnew com ffdada
Neutral,app delete google app store serve redundant ad ift ttmppf
Irrelevant,turkey bloody mad dog state lead murderous rabid handler erdogan attack armenian region google turkey conflict
Neutral,google spark outrage demonetize rightwe blog zerohedge caution meghan mccain husband website federalist derogatory black life matter content dailym aiios mol ama
Irrelevant,wait find plant hoax
Positive,hope relevant find good tool quick prototyping kind transition
Negative,mr pichai plz answer want people india boycott android platform sundarpichai
Neutral,great experience patient columbus circle dental say lisa google birdeye birdeye comcolumbuscircl
Negative,understand continue trust freedom hate thief need google revenue
Neutral,consecutive day summer learning experience rfhregional teacher thank rkiker learn google classroom support msnelle join online session belong identity identity great amazing talented staff learn perfect preparation
