sentiment,tweet_preproc
Negative,samsungmobileus open google streetview samsung thing phone screen continue play properly till explain
Negative,delete photo phone gallery google photo save personfacepalme ‍
Negative,mornin shit control hatred google auto complete
Positive,pay extra google drive space get annoying
Negative,google translate good translation pic twitter comutcdurj
Negative,wow go google photo sad
Neutral,like
Negative,yes google confirm claim know partly complete lie
Positive,twitter youtube google school subject parent proud
Neutral,jade single fucking thing web wait google
Irrelevant,second day find bad slightly whiney album casual excuseworm know lyric band google damn thing convince fivehit wonder lost youtu bevdstjmxyk
Irrelevant,like critic movie rating rating google user movie critic critique familiar common man
Neutral,offline hey google play swamp sound
Neutral,  android basically unusable turn google android s tracking author eric ravenscraft info link medium com profile dztxztxc
Neutral,check paste google search google search photo people go battery shit
Negative,remain bad fake news
Negative,believe google absolutely kill googledrive right allow add folder drive automatically video sync computer don t backtrack sept soon time help final final bargaining dropbox
Irrelevant,aight see like girl like wtf cos girl mean spread shit like black spread shit blm
Neutral,want friend know read message app perfect bit ly qemcad private link bit de ly hcopld
Neutral,search gfriend song see search bar click google spill tea pic twitter comemngxjum
Neutral,  dev source app base applegoogle api mate homegrown code minute reasonable minimum time short min need stop spread great golden add social distancing rule job
Positive,literally proceed google break leg want pain
Negative,google criminalize asian people gendere criminal
Neutral,evidence left coast medium scamme
Negative,start like
Irrelevant,google bias birthday picture face see cute dongsung feel warm pic twitter com beqqsbp
Positive,thank ya guy
Negative,take way fucking long swap playlist alarm app google complicated
Negative,impressed download food
Negative,know google lyric happy dutch malcolm maclaren like ebo ebonette disappointingly ebo ebonette
Irrelevant,girl information google referral foxy interview literally disprove
Irrelevant,kamala say white people stupid
Neutral,fluidmediasolution com gmb local seo google business list seo optimisation t obtain lot visitor lead customer sale sale rank certify service globeour s large smart search engine
Positive,employee narri nice help feel good work say linda google birdeye birdeye comlushlawn
Negative,google label latin people penalize criminal
Irrelevant,good morning cyber code crime phone email sm google gmail proper reaction abc cyber crime gmail email mail phone connection world country wide big problem naga blame crime people law order fail world truth culprit hang m economictimes com tech internet
Positive,copy book page unk yeah buy stick book google
Irrelevant,rd twitter account getting suspend time time pelosi ruin life able voice know google snaggletooth salon give afro allow post video rt follow shit beg
Negative,androiddev actually notice anomaly upgrade gradle plugin model google compiletesting library crash retrieve resource example detail available github comglureauagp new
Negative,enter date follow standard yyyymmdd format google appreciate pic twitter comuphqjapgy
Neutral,look absolute tool google
Irrelevant,capitalist democracy quickly
Negative,remember tune way version getting censor day liar fact checker google facebook twitter youtube msm way class action potus fornow nameless deelovesjamaica mickeynabb
Positive,thank guy
Neutral,excellent find hey industry use zoom google meet gotomeeting microsoft apple sell sign politician learn lot
Neutral,google horror aesthetic mean hot pic twitter compasnpjke
Neutral,google play app promise free shoe instead user receive malware cheat ad zdnet flip wm
Positive,grateful support small family business thank regular customer check custom hardwood flooring repair lay google g page woodflooringlo
Neutral,time eu commission take step
Neutral,love say person find helpful
Neutral,google steal content honest business sundar pichai question ift ttkobtn
Irrelevant,great movie fan apocalyptic dystopian movie search google come list snowpiercer see fearless portrayal class consciousness truly wonderful
Negative,  jukinmedia youtube com watch v = jmsg mmoxreview teamyoutube google verify twitter tell shit like lactose intolerant warn delete post straight internet want time world
Positive,honestly glad people check fact
Irrelevant,personal albumunk
Irrelevant,kamnapp illegal home business run syrian indian husband american wife soon multiple worker make sell counterfeit pharmaceutical internal cleaning agent alcohol chicago apartment building number floor apartment google code location xr al khobar
Neutral,day
Irrelevant,tired wait old lady come social matter woman know well internet exist google read oldunk bent preserve history
Neutral,girl keysmash shit google
Irrelevant,mean srsly usa today editor joker scene know use google offensive
Neutral,google deal fact yoongi beautiful man see
Neutral,excuse draw face shit isn t google
Positive,take hour google respond submit request review feel well site well tool process instal ensure happen
Irrelevant,wow guy read teleprompter crazy watch news people google speech like write poor fella dead man basement election guess hillary fill circus slot pic twitter comqrnrctsz
Irrelevant,sinister jackdromey hasa short memory especially cumsoutgeous act shud google sick history pie harrietharman jack cud not waittell victim family pub bombing corrupt davethompsoncc isa good friend y jack hide justicethe
Negative,android trojan kill google play protect speak fake app review ble
Irrelevant,great announcement want fan apocalypticdystopian movie search google come list feature snowpiercer mention fearless depiction class race truly terrify
Negative,google suck google racialize qtpoc normalize white surpemacy
Irrelevant,local
Irrelevant,sickening guess realize chi nah take line wall shoot stupid time say stupid thing personfacepalme ‍
Neutral,great dissicion covid time
Negative,guy build google lmao
Irrelevant,girl google reference interview foxy reporter deny
Negative,bitch ra bing
Negative,yes google confirm claim know lie
Negative,anime worst embarrassing fake news news eric
Irrelevant,ridiculous fucking clue social democracy disgusting help google thing trump get ramp bernie win nicolledwallace mmflint
Positive,cool fun
Irrelevant,google horror aesthetic exist use middle pic twitter com nkkxdswor
Negative,look online google movie engine video republican convention google helpful send duckduckgo get immediate helpful link like google want find
Positive,great option meet stream share screen thank ericcurt
Irrelevant,twitter punch password confirm identity bitch google
Negative,imagine shock
Positive,join force = use google apple api case happy join force apple own iphone
Negative,wonder spotifyuk give away google speakers come speaker blow nauseatedface nauseatedface nauseatedface
Neutral,fascinating inspiring google create noto typography family include type system language hundred thousand title fun language lnkd inguyygz
Negative,hey google need know crap
Neutral,mean write review businessestablishment see thousand people act right smilingfacewithopenhand rollingonthefloorlaughe
Negative,bitch mf bing
Irrelevant,honest admission thank share big problem people engineer people technologically advanced find difficult understand link safe
Positive,amazing google free know word mean
Positive,love creative client insta google ad visit site lot waste ad dollar bitch
Neutral,bigram poem inspire garjamapps google announce announce general general availability availability ai ai prediction gary james
Neutral,apostille pros professional timely service document certification recommend need vital service say nathan google birdeye birdeye comapostillepros
Neutral,great dissicion time
Irrelevant,google bias birthday picture face heshethey sweet dongsung smilingfacewithheart feel warm smilingfacewithheart pic twitter combeqqsbp
Positive,thank guy
Negative,guy crash google lmao
Irrelevant,film tulsi gabbard continue long tradition platform spread lie rightwing conspiracy theory instead perform simple task open wallet phone tulsigabbard vile person
Neutral,good backlink strategy boost total organic count serp sure create backlink pbn b link farms cnn comwatchv = dhhpqh
Neutral,  google sir help restore gmail account help google verify account pic twitter com vrdvuunvye
Irrelevant,shit google know
Irrelevant,wow guy read teleprompter crazy watch news people google speech like write poor fella dead man basement election guess hillary fill circus slot pic twitter comqrnrctsz
Neutral,  googledocs hey idea ask help google sheet file use today able open load massive file multiple browser colleague try appropriate sharing setting help
Negative,terrible idea google nest rest saturday morning stephen continue play capacity
Irrelevant,mean srsly usa today editor grunt backroom know use google offensive
Neutral,dan helpful knowledgeable excellent selection definitely return additional trailer need find p google birdeye birdeye comwhitesprucet
Negative,copy rt spread hi google notice fix provide reason happen place weareoneexo
Neutral,  applesupport bzamayo sure happen review classroom app store think spam
Positive,great google moment
Irrelevant,guy
Irrelevant,choice guy make
Irrelevant,injustice accept sea act affidavit uk despair selfproof culprite push movement justice ssr injury inflict mumbai police mahagom choice time mutilation god great
Irrelevant,deserve die like damn problem people like people probably google die police damn reason sad happen
Irrelevant,fuck fbi agent watch camera cap n shit want know phone think fuck google renjun peepee
Positive,lol look listen upbeat line heart nice job google
Positive,thank employee narri sound nice lay feel good work quote chris google birdeye comlushlawn
Positive,know weird ass district wack ass canvas google classroom
Irrelevant,pepsidoggy think initially big bald fraud pep see tweet uk director google stadia
Irrelevant,album comfort
Neutral,type rte backwards google education yeah stupid people watch listen rte s simple fact
Neutral,president slap americans face commit unlawful act acquittal discover google vanityfair comnewst
Neutral,buy negative google review star review bad taste mangocityit comservicebuyne
Neutral,  narendramodi able download aarogya setu app google play store
Irrelevant,year old show street small town sicily grow world war ii start cry apologize italian
Positive,google maps interesting nostalgic check area frequently go parent child usually go rite aid ice cream closed bittersweet kind happy glory pic twitter comghswpvhjao
Neutral,conspiracy long secret need know truth reality come create pic twitter com hdtoyrmoq
Positive,main thing
Neutral,love work home enjoy afternoon workplace yellow sticky notepad solution google form grade alg night stat precalc maybe need come well home option pic twitter com ueklxwd
Neutral,google whistleblower hillary critic say wife horrific car crash accident coroner go pic twitter com thglcjcyzi
Irrelevant,  late james madison scroggie daily paper li seoscroggie thank oncrawl
Irrelevant,bahahah meannn good sign pic twitter comtgearqjn
Positive,coolunk
Neutral,laugh nervously stare scene google drive scene feel go
Irrelevant,  fire google
Negative,mr pichai plz answer want people india boycott android platform sundarpichai
Negative,dotindia rsprasad goimeity mtnlmbiofficial world block
Neutral,google pixel review fine phone great camera mash comyhaql
Neutral,nah hour google watch weird shit video youtube watch video dank web lmfaoo
Negative,dear google black life matter protest change avatar support movement
Negative,ve look online google search engine video republican convention google helpful turn duckduckgo get immediate helpful links org like google doesn t truly want personally find video
Neutral,corona virus shit keep happen wash hair dish soap probably go warrant big google search
Negative,google chrome delete open tab update stupid app go cry lot important thing open
Positive,case happy join force apple iphone
Irrelevant,absolutely movie tulsi gabbard continue long tradition platform spread lie rightwing conspiracy theory instead simple task open google phone tulsigabbard vile person
Negative,google work suck google officially regulate undocumented worker completely misinform white surpemacy
Neutral,great look seo
Neutral,cdrosten need dollar child food help help take money food people help google pay number
Neutral,imagine take dumb google drive reminder skam character real people
Negative,google ban think steal realise google facebook year rip privacy
Neutral,shoutout teacher go extra step connect student zoom google hangout kid love see teacher friend listen bunch year old try talk time personfacepalme ‍ love teachers pic twitter comrcpsmlcd
Positive,normal take google hour respond submit request review feel well website well tool process place guarantee happen
Positive,tomorrow day word lhs goal well understand like student communication struggle google translate app load lesson info usual student interaction pic twitter comwjqahdisem
Neutral,day summer learn rfhregional teacher thank rkiker student google classroom support msnelle deliver session belong identity great hear firsthand amazing staff learn preparation
Neutral,offline hey google play noise
Negative,googlead google stop make people support round identification know figure rep receive call bother customer long time waste maneuver appreciate
Positive,honestly m glad people fact check
Neutral,cognitive computing market strong growth include key player google ibm microsoft google comurlrct = jsa = t
Negative,bye google meeting update ugly pic fm qonnusirux
Negative,fuck google pic twitter comwontzsgnl
Negative,google label latin people criminal
Irrelevant,second away organize reichstag fire america google send word legless step cowardly opponent warning
Irrelevant,absolutely film tulsi gabbard continue long family tradition platform help spread lie right wing conspiracy theory instead simple balancing task open google home phone tulsigabbard vile old person
Irrelevant,hear year x x diet food brand hack hard google easy tshirt long future fly car rogue android topteetrend comproductdragon
Neutral,excellent find hold hey entire industry zoom google meet gotomeeting microsoft apple sell sign politician lot learn rest
Positive,get curious google marco polo tibetan buddhism result chinese site love chicom propaganda result google pic twitter comrmgwpgr
Negative,believe google absolutely kill googledrive allow add folder drive automatically sync computer backtrack sept time final dropbox
Irrelevant,chocolate confidence
Neutral,late b gardinerand s complete random book musing paper li b gardiner thank bjoerndarko fmscreative
Neutral,favorite little patient line google say
Negative,go inherent void people ear fb incredibly vast google trust news source unbiased outright uncensored definitely go evolve
Irrelevant,cd google horror aesthetic exist use middle nerdface pic twitter comnkkxdswor
Neutral,accord speedtest net average speed google fiber connection decline mbit s increase mbit s
Irrelevant,great movie fan apocalypticdystopian movie search google come list feature snowpiercer see fearless depiction class consciousness truly wonderful
Neutral,  powerful google sheet template teach sustainable school start google teachertechafrica com com ng google pow
Neutral,google play app promise free shoe user get ad fraud malware instead zdnet flip itrnwm
Negative,break head jjvjdfnvjldf
Positive,cool
Negative,mistake chen participate song correct spotify google weareoneexo
Irrelevant,capitalist democracy
Irrelevant,second away reichstag fire america google send troop legless threat cowardly terrorist warning
Irrelevant,firegoogle million thank
Negative,google video conferencing platform meet far bad
Irrelevant,google age boomer honey millennial mad dumb technology y fuck total y
Neutral,awesome list tip expert well seo drive traffic google search
Irrelevant,great huhsgtrack people definitely miss amazing group studentathlete coach day love positivity work ethic girl bring single day
Positive,google rank high quality seo backlink fiverr comsharenwewvp
Neutral,finally finish google slide hhehehehehehee let sleep
Neutral,× google ear infection usually disappear week google god damn die disease
Neutral,whatsapp bug expose phone number google search report bugshindi comwhatsappmayh
Positive,s amazing google free you people don t know word mean
Positive,irinavukolova night see place northeast kiev google map true love forward definitely review look link quickly previous afternoon meet matthew unk unk
Negative,search video republican convention google search engine google help reach duckduckgo get immediate helpful link like google want find video
Irrelevant,aight see rt afternoon like rt girl m like wtf cos say m girl doesn t mean t spread shit like m black ve spread shit blm
Neutral,whatsapp expose user default phone number google search report currentaffairs file hindi com page whatsapp h
Neutral,google pixel gb black unlocked excellent condition pattongrocery com t co sadaoje
Negative,yandexby google contain big lie muslim world read duzdunya com tr report translate headline world need know
Negative,  google apple explain advancement slave market kuwait app disgusted
Neutral,love say person make helpful
Irrelevant,turkey mad wild cat lead rabid handler erdogan attack armenians region google turkey hit
Negative,wow long google photo sad
Neutral,check stick google search google search photo people battery shit
Neutral,imagine take dumb google drive need reminder skam character real people
Irrelevant,crime mean sit draft xd love trope
Negative,hell
Negative,dear google black national life matter protest change avatar support youth movement fair change avatar rte
Neutral,google calendar messy noisy messy use setting feature regain control calendar day bit ly njsf
Positive,hopefully google rank high world quality seo backlink fiverr com share nwewvp
Irrelevant,pepsidoggy think big bald fraud pep see tweet creative director google stadia
Negative,bitch mf bing
Neutral,insane corona virus fucking shit keep tonight happen tomorrow wash hair dish soap go trend google search
Irrelevant,act desperation affidavit police turn selfcongratulation culprite drive movement justice safety injustice mumbai mahagovt police
Negative,fuck
Positive,omg envious ok google start lucky
Neutral,love steven vancouvergeek test roav device google alexa bestbuycanada talk internet hey google alexa car voila answer blog bestbuy cargpssatell t co gfjlsg
Neutral,fall message google meet speak microphone mute press f turn
Positive,twitter youtube google school subject parent appear proud
Neutral,  play interesting quiz amazonplay link amazon funzone easy play try luck fun reward download amazon app google play visit amazon ingamesharegl eligible win bonus
Positive,ye hear waze great gps own google launch bunch new feature
Neutral,android basically green comment google track jessica ravenscraft medium comdztxztxc
Negative,google apple explain promote slave market kuwait app disgusted
Irrelevant,fucking google statistic everyday
Neutral,united onslight divine evolvevable rank s app store bit ly azhykp google play bit ly ntcnt
Positive,unk
Negative,go void people ear fb huge google reliable source news unbiased obscene
Negative,kill point google vice ny times play life science company use horrible photo
Negative,search friend material kai google good cut onion
Neutral,google play sport app promise user free tennis shoe user get ad sex fraud malware instead zdnet flip rnwm
Positive,join google doodle thank ship production worker truly essential
Irrelevant,sharp tongue nice peter like
Neutral,excellent find hold oh entire party zoom google meet gotomeeting microsoft bing sell sign politician lot learn rest
Neutral,hello sign selfprompt receive confirmation email hello darling thank sign order email fill google document curiouscat qa jimins
Neutral,  pete come well fix ac quickly professional day friendly appreciate wear mask covid protection say lori ryan mobile google webhorsemarkete contact birdeye com aspen heating
Negative,  update google map give wrong location
Positive,  irina vukolova night see place kiev google maps love forward evaluate look link quickly afternoon meet matthew
Neutral,year google chrome firefox pleasant surprise zdnet com article
Neutral,new google study show people community take social anxiety lesson apple newsawjokltjd
Irrelevant,rd twitter account getting suspend pelosi ruin life able voice know google snaggletooth saloni give bush afro release video rt follow shit beg
Negative,discover bree serif font google docs use font
Irrelevant,anticolonialist india commit terrorism violence oust parasitic british colonial presence long ghandi google bhagat singh indian national army
Irrelevant,excruciating thing blind social medium people constantly ask blind tweet scared answer question great google answer stuff read rt
Irrelevant,sharp tongue peter like
Neutral,girl google voice heartless say gospel truth shame ja facewithraisedeyebrow
Neutral,base government hit google big antitrust relate lawsuit decade metro co uk
Neutral,google deal fact yoongi pretty man see
Irrelevant,like critic movie rating google user movie critic critique help common man
Negative,androiddev notice issue connect android developer plugin google compileteste library crash retrieve additional detail see github comglureauagp new
Positive,angel
Neutral,  android bezelless screen dolby vision k display dts trusurround starstruck google assistant partyingface pic twitter comeqoyemkft
Positive,google earth image help co worker create fun
Neutral,corrupt president slap americans guy face commit absolutely unlawful act right acquittal discover average google vanityfair com news t
Negative,google adsense find money support number tell read forum page wait business day cool
Irrelevant,team manager desperately try determine thing great main challenge work home healthy toddler teenager canine blood co worker clear winner today toddler world co worker end google meet throw duplo laptop
Neutral,know guy kid s tv die today work year try fix google video plug new tv different channel outlet luck
Positive,great google review newark site team
Irrelevant,gutfeld out strategy gop antitran pmongere story person convict sex crime long consider threat change gender think people trump right google major thought table
Irrelevant,mention actor tik tok instagram twitter want south indian actor google collywood actor consecutive crore movie tn
Irrelevant,hear jesus follow fortunate attack state new rebranding
Negative,wow rely google photo sad
Negative,useless equipment sa
Neutral,favourite patient line google say
Negative,ahh copy paste google doc fuck formatting
Irrelevant,believe realdonaldtrump lie
Positive,unk
Neutral,yellow sticker pad answer form google night alg stat prealc maybe need come well home pic facebook com ueklxwd
Neutral,year google chrome firefox pleasant surprise zdnet sense com select article article flight
Neutral,google horror aesthetic mean hot pic facebook com pasnpjke
Irrelevant,crime sit draft xd love trope
Negative,jukinmedia youtube comwatchv = jmsg mmoxreview teamyoutube google verify twitter tell spy everybody like lactose intolerant warn delete post internet want secret round world
Negative,impressed download
Neutral,applesupport bzamayo sure s happen google classroom review app store think s probably spamme
Neutral,  play interesting quiz amazonplay game amazon funzone easy play try luck exciting reward download amazon app google play store amazon ingamesharegl eligible win prize
Negative,copy rt distribute hi google notice fix tell reason happen place weareoneexo
Positive,super proud achieve google certify trainer status
Negative,mornin fully control hate google car
Negative,google apple explain away slave market kuwait app disgusted
Neutral,unimpressed face
Neutral,thank message google doctor nurse googlearabia google
Neutral,superintendent dr todd bill nolte say google classroom session run monday school district suffer severe ransomware attack bit ly iklt
Negative,  google want thank control angry level play free star
Negative,understand continue trust freedom hate thief google youtube revenue
Irrelevant,love kind need mention georgia tennant ask google die blogging twitter
Irrelevant,cobrang naiyako imhin emhional torture wonho go wonho happen world apologize
Positive,join google doodle thank packaging sort delivery worker truly essential
Negative,mr pichai plz answer rest india boycott android platform sundarpichai
Negative,  reason ignore metric view google business insight sterling sky inc sterlingsky googlemybusi
Neutral,efficient worker pricing pretty low consider nature service properly perform say det google paul birdeye birdeye comweatherguardr
Neutral,slightly obsessed jamboard awesome tool create collaboative interactive whiteboard great way create ts ss instructional model device
Positive,congratulation baby
Neutral,standard poem inspire garjamapps google announce announce general general availability availability ai ai prediction gary james
Negative,realdonaldtrump thank thank stand free speech bias bohemoth company twitter google facebook
Neutral,thank kimoon answer impact make difference ssa summit final day
Positive,thank guy
Negative,guy crash google lmao
