sentiment,tweet_preproc
Neutral,love work home enjoy afternoon shoutout workspace yellow sticky note pad answer key google form grade night alg stats precalc maybe need come well athome option pic twitter comueklxwd
Neutral,unk
Positive,honestly glad people fact check
Irrelevant,nesara system global economy deserve attention system lead peak economic imbalance system winner loser sustainable
Positive,stick home play game invent call google image trump game search random word google image see trump win time get end scary slender pic facebook com hskrgfc
Neutral,btc scammer frequently breach twitter account member chairman bill gates franklin obama facebook google apple uber dlvr rbkcdk
Neutral,go google photo see selfie people think live time god thank deliverance
Positive,bad commercial
Positive,lovely addition material design doc hope keep date yes m look new good design tool quickly prototype old kind transition
Neutral,late pdf daily paper liee
Negative,carryminatis channel hack gain day monatization cuz youtubeindia n day khujleefamily ask google help nthin unk
Neutral,usually friend know ifve read message app perfect lyqemcad text bit lyhcopld
Neutral,experience mccarl dental group wonderful say chameka google birdeye birdeye com mccarldental
Neutral,absolutely
Neutral,president slap americans face commit unlawful act acquittal discover google vanityfair comnewst
Irrelevant,  pepsidoggy think big bald fraud pep see creative director google stadia
Positive,good quarter put class google calendar go shit
Negative,kill point people google vice ny press time play life science company use horrible photo
Irrelevant,like want die like fuck problem people like people probably google people hide police force fucking crime sad turn
Irrelevant,  mentioned actor tik tok instagram twitter social south korea story google news kollywood actor consecutive crore movie tn
Neutral,slightly obsessed jamboard awesome idea create collaboative structure music great way create dynamic ts ss instructional model device
Negative,google criminalize asian woman gendere criminal
Neutral,excellent novelty find hold hey entire global industry possibly zoom google meet gotomeete microsoft apple sell sign politician truly get shit lot easy learn rest
Neutral,look great restaurant rental feature friendly server good italian food say erin google renown review revlocal comgiammarcosita
Negative,mistake chen participate song correct spotify google weareoneexo b
Neutral,great bgardiner random musing libgardiner publish bjoerndarko
Irrelevant,good morning crime phone chat sm google gmail public reaction abc cyber crime gmail shop internet shop massive country wide problem blame crime people law order fail world truth culprit uncover m economictimes comtechinternet
Neutral,girrrllllllll rhona play mental big time listen brown girl podcast wednesday pm hear go deal available spotify anchor breaker radio public pocket cast google podcast pic twitter com duyhvdyil
Neutral,efficient worker price pretty low give kind work say det google birdeye birdeye com weatherguardr
Negative,  start like
Negative,google suck google racialize qtpoc normalize white surpemacy
Positive,com damnn google map accurate pic twitter comtxbxmmmbj
Negative,iphone power pro max mah battery great electric thing slice garlic bread pixel xl mah meter battery wtf google think mah difference folk
Neutral,google symptom guy find terminal cancer
Irrelevant,patrachar vidyalaya cbse patrachar vidyalaya shalimar bagh registration grade date
Negative,  massive mistake chen participate singe song language correct spotify google weareoneexo
Neutral,coronavirus shit go happen wash hair washingup liquid trend google search
Negative,  pontiacmadeddg say google net worth time useless know get google lyin time
Negative,google come sad commercial noooo
Neutral,hello sign selfprompt receive confirmation email hello darling thank come today order fill google document curiouscat qajiminfestspos
Positive,super excited achieve google certify email status
Negative,shuck
Neutral,offline hey google play swamp noise
Positive,dear join google doodle thank packaging shipping delivery worker truly essential
Negative,f ck sc google washington dc google news page update hour ago refresh hour ago delete scared
Neutral,great look seo
Neutral,finally satisfied google slide hhehehehehee let sleep
Irrelevant,sharp tongue nice certainly peter like
Neutral,frame release google play store show user redundant image ift ttmppf
Neutral,finally google slide hhehehehehee let sleep
Neutral,especially upset darkness people engage internet hear people confide meganalexa people willing share unacceptable thought google
Neutral,new adorn daily paper li e e
Neutral,fascinating inspiring google create noto typography family include write system language hundred thousand character digital language lnkd inguyygz
Neutral,poem bigram inspire garjam app google announce general accessibility ai ai prediction gary james
Neutral,google steal honest company content sundar pichai question ift tt kobtn
Irrelevant,late james scroggie daily paper li seoscroggie thank oncrawl
Neutral,  mean write review business establishment see well thousand people act right unk
Negative,scrabbleea keep get message dictionary thing work actually say restart app
Irrelevant,love naiiyak ako imagine new torture go go wonho deserve city apologize love
Positive,popular google search hour manuel ellis skye jackson text jake fromm breonna taylor buffalo police
Irrelevant,pls google definition word mistake pls get secondhand embarrass
Neutral,google news effortless robotic dog trot
Negative,dear google black life matter protest change avatar support movement fair change avatar
Negative,yes google antitrust suit
Negative,bitch mf bing
Irrelevant,hard thing blind social medium people constantly ask blind tweet bored answer question google answer include write rt
Positive,stick home bore play game invent call google image trump game search random word google image see trump win past time get end terrifying slender pic twitter comhskrgfc
Positive,interesting research
Negative,thank google fucking idiot pic twitter comysfuxcu
Negative,  googlead google sto force people customer service round identification know realize turnip few call bother customer long timeout maneuver appreciate
Irrelevant,like deserve die like fuck problem people people probably google people die like police fucking different sad set
Irrelevant,mmm like day lab kid complete set task know head google print good
Neutral,google pixel gb black unlocked pre condition \ pattongrocery com
Neutral,techno geek oracle criticize question google support akhozo blogspot comoracle
Irrelevant,fucking google statistic hive
Neutral,google ' wedding dress outfit blurry seok leia wedding dress fuck yuh pic twitter comboutnyvnq
Neutral,check review lopez co google maps goo gl maps qpyvkm experienced tax preparation centre trust
Neutral,great price seo
Positive,itr s great news big company today yellow page yahoo
Positive,good know
Positive,google horror aesthetic pic wikipedia org aqwdrise
Negative,time google sue blindly rob people destroy invention spend money class law t co fikqdfar
Negative,f ck sc google washington dc google news page update hour ago freshen hour ago delete frighten
Neutral,attorney hit google big antitrust lawsuit metro co ukus
Neutral,baby frnd sister baby plz help pay google plz share message contact number frnd pic twitter com pjymtke
Neutral,girl keysmash shit google
Negative,wonder spotifyuk tick
Irrelevant,merlynjd merlyn seriously quirky trio love post journal rik love write diary series short turn post time rik kin friend weird goofy totally odd character google enjoy riklove com
Irrelevant,hear jesus chase fortunate attack state new brand google internet say
Positive,practice google typing talk chrome book cool fun
Positive,irinavukolova night see place kiev google maps love forward review look link quickly afternoon meet matthew ℐℓ √υ
Positive,cool
Neutral,× google ear infection normally away week google holy fucking god fucking skin disease
Neutral,tell
Neutral,  actually test app application applegoogle api mate homegrown code minute laughable minimum requirement bad min max need stop riot golden change social distancing rule job
Irrelevant,girl information google conspiracy reference foxy interview literally deny
Irrelevant,injustice take anymore step affidavit scof criminal self prove culpritsunk push change fromjustice ssr injustice mumbai police mahagovt choice theirs time man violence great
Positive,great big company today yellow page yahoo google able cool product think optimist say zoomus disrupter googlemeet airmeetcom
Neutral,applesupport bzamayo sure happen google classroom review app store think spamme
Irrelevant,late south james bay daily paper liseoscroggie thank oncrawl
Negative,company stop make cry
Neutral,fluidmediasolution comgmblocalseo google business listing website optimisation obtain lot visitor traffic customer sale rank service globe large sale page
Negative,time count textsemail
Irrelevant,great movie huge fan apocalyptic dystopian movie search extensively google d come list feature snowpiercer haven t see like sure s fearless narrative depiction class versus consciousness truly wonderful
Negative,fuck google pic wikipedia org wozsgnl
Neutral,near hour google watch strange shit youtube watch video grateful web lmfaoo
Neutral,favorite smart home device amazon google cnet favorite smart home device amazon google cnet cnet comnewsfavorite
Negative,scope image storage android probably ruin google photo experience buff ly sxlnpp david pointjules
Neutral,google calendar slow loud chaotic use setting feature regain control calendar day bit ly njsf
Positive,« great tip
Negative,  jukinmedia youtube com watch v = jmsg mmoxreview teamyoutube google verify twitter tell shit like lactose intolerant warn
Neutral,google pixel image review ' professional image great feel tinyurl comyhaql
Neutral,nah hour google watch weird shit youtube watch video dank web lmfaoo
Irrelevant,kamala say young people stupid
Negative,newsnationtv sir request google play service customer health care plan fraud fraud desk app know debit card relevant detail withdraw money rs current action
Negative,time google sue rob blindly
Irrelevant,play lil zae bad dl app google play io apart movement tune live fri sit pm
Neutral,shopifysupport sale couple month sale google facebook ada sorry late reply
Irrelevant,crime sit draft xd love rope
Irrelevant,fuck fbi agent watch camera n shit want know phone think fuck google renjun peepee post
Neutral,fall message google meet speak microphone mute press f turn
Negative,google want saw thank angry level play free free star
Positive,pay extra google drive space get annoying
Neutral,start say restaurant racist eat bad google start list black restaurant stop eat
Irrelevant,wow guy read teleprompter crazy watch news people google speech like write poor fella dead man basement election guess hillary fill circus slot pic twitter comqrnrctsz
Neutral,google ' wedding dress outfit blurry seok leia wedding dress fuck yuh pic twitter comboutnyvnq
Negative,dotindia rsprasad goimeity mtnlmbiofficial world block
Neutral,rise google chrome firefox huge surprise zdnet comarticleafter
Irrelevant,lie look wrong
Irrelevant,fbi agent watch cell n twitter want know phone walk earth google renjun peepee
Neutral,daily luigi fact google know conspiracy secret long learn truth reality come create pic twitter comhdtoyrmoq
Positive,  ready day unk iseshow big big thank especially avmag benqsignage google simply host event night blast
Irrelevant,consolation album
Positive,ad entry date idea gloucestershire nd search result google o chimmyville co uk dateideasglo happy
Positive,great google review newark site team
Negative,google search bug wreak havoc search result weekend dlvr itrdrfb
Irrelevant,lie google wrong
Neutral,jade single fucking thing mean google
Neutral,check review lopez sanchez google maps goo glmapsqpyvkmunk tax center trust affordable friendly professional staff excellent service
Negative,switch notification offclastro twitter ig youtube vlive nervous trouble start activate google notification
Irrelevant,pls google definition word
Positive,great google review find famous newark site team
Irrelevant,crime sit draft xd love trope
Irrelevant,vote jimin star adaptable verse public life click m idolchart com poll enter naver kakao google facebook click jimin
Neutral,fluidmediasolution comgmblocalseo google company list seo optimisation obtain new lot well visitor lead customer sale drive service present future large search engine
Negative,rhandlerr facebook account hack phone number facebook d praveen boobesh hacker change password gmail d facebook d screenshot pic twitter comndrjmvhh
Neutral,awesome list reason expert well seo drive traffic google search
Positive,thank youtubeindiaunk support
Neutral,esd touch wonderful authentic gentleman confirm vancouver great wonderful adorable man star google review
Neutral,google fire demonetize rightwe publication zerohedge caution meghan mccain husband work time black matter content enter dailym aiios mol ama
Neutral,girl google voice heartless loudly speak gospel truth shame ja facewithraisedeyebrow
Positive,join google doodle thank packaging delivery delivery worker truly indispensable
Irrelevant,guy make
Negative,look online google search engine video republican convention google helpful turn duckduckgo get immediate helpful link like google want find video
Neutral,great dissidence strange time
Neutral,google keysmash shit google
Positive,good quarter inputte class google calendar nice go shit
Negative,tok ban india think steal datum realize google facebook year rip privacy
Negative,bye google meet update ugly pic twitter comqonnusirux
Irrelevant,love yang gangunk
Negative,  realdonaldtrump thank stand freedom speech biased company
Negative,  carryminatis channel hack day fun cuz youtubeindia n day khujleefamily ask google help n nthin
Negative,hey firefox hell happen drop box website use instead google reason beg brave
Neutral,imagine host dumb goaldrive serial remind character skit real people
Irrelevant,sharp tongue nice peter like
Negative,og mornin shit control hatred google auto complete
Neutral,late bgardiner random musing paper libgardiner thank bjoerndarko fmscreative
Neutral,yelp start say restaurant racist ill eat google begin list black people stop eat
Irrelevant,mean srsly usa today editor grunt backroom know fast use google offensive
Irrelevant,aight somebody see rt kind rt girl like wtf cos girl suppose spread shit like black spread shit blm
Negative,chill hi google notice weareoneexo
Negative,google criticize black people merely hide aggressor
Negative,  come find
Irrelevant,  great awakening
Negative,quit football
Neutral,want succeed know provide complete google mobile campaign solution visit proposal bit s ly eiqka
Neutral,good backlink strategy boost organic ranking serp sure create backlink pbn site link farm youtube comwatchv = dhhpqh
Neutral,  play interesting quiz amazon play game online amazon funzone b s easy play try luck exciting online reward download amazon app google play store amazon game share gl actually eligible win prize
Neutral,  google favorite color aesthetic noncollage pic aesthetic board hdjsjsjsjsj korean heart symbol end incredible pic twitter comrpkwdcbk
Neutral,yelp start say restaurant racist ill eat google begin list black restaurant stop eat
Positive,team join benefit advance technology rhandlerr say grateful cohort accelerate social good ai pic twitter compmecrxbto
Negative,carryminatis channel hack get day monatization cuz youtubeindia n day khujleefamily ask google help n nthin
Irrelevant,ve hear rumor jesus go heal poor fortunate attack state create new rebrand ma google national internet s unk
Neutral,  google fiber connection average mps mbit accord net speedtest net
Neutral,great experience begin allison say google birdeye birdeye com theseallaw
Neutral,  stupid stupid stupid weda ll let smarter cheap fast rival tcl onn google nd apple amazon samsung sony home bind internet user fume video app sync tvs www news trust org item
Neutral,team play phone google assistant voice ask koreas powerful couple tada result satisfying rollingonthefloorlaughe rollingonthefloorlaughe taekook heart happy ps edit pic twitter comdmepudcud
Neutral,type rte backwards google education yes stupid people look listen rte fact
Irrelevant,google rule b suck
Irrelevant,  twitter password confirm actual identity bitch stuff ain get t google
Negative,copy distribute hi google notice fix let know reason happen place weareoneexo
Neutral,  googledofhey idea turn help google sheet file today able open
Positive,normal take google hour respond submit request review know well website well tool process mind guarantee happen
Negative,  update google map choose wrong location
Neutral,btc scammer breach twitter account bill gate obama google apple uber dlvr itrbkcdk
Irrelevant,exact second away reichstag fire america google send troop silently legless threat cowardly dirty shit job good warning
Positive,google popular search engine hour league europe fire tornado land love antifa alex smith
Positive,register november bts session click bit ly bts register co nquqdhjn
Positive,good
Irrelevant,oh wow fascinate reading article relate fucking traumatic thing yes call google type binch
Neutral,day
Neutral,good beauty tip man bothhealthandbeauty infobestb
Negative,company stop make mexican cry
Irrelevant,reason google symptom internet m convinced slip rib syndrome have pain rib sneeze docemurray
Irrelevant,exhausting thing blind social medium people constantly ask blind tweet tired answer question pile answer include write rt
Neutral,wownow preview amazing vibe wey dey drop store friday th march platform store include spotify apple music itune tiktokresso google playyoutube amazon pandora deezer tidal napster iheartradio pic twitter comgttbpqij
Positive,thank partner google host october scene summit survey right audience member rave google panelist teach teen ok different register november bts click bit lybtsregist
Neutral,  powerful google sheet schoolchildren teachertechafrica com ng pow
Negative,google gon adobe flash lmao crazy mfn games
Irrelevant,lie google wrong
Neutral,google favorite color aesthetic noncollage pic aesthetic board hdjsjsjsjsj korean heart symbol end incredible pic twitter comrpkwdcbk
Neutral,check awesome tool google group pagewalkbehindtr
Positive,love customer appear insta google ad simply visit site lottery
Neutral,  todays google s great motor hit fire secondary hydrant secondary hydrant change time spoiler fire secondary hydrant half hydrant color total question type s primary hydrant s half book google com ngrams graph c
Negative,google treat like fucking idiot pic twitter com fsvamgvhl
Neutral,efficient worker pricing pretty low consider nature job perform say det google birdeye birdeye comweatherguardr
Neutral,google pixel flash android os unlock excellent condition shop com
Negative,pontiacmadeddg say google entire net worth time probably s disrespectful know get far november google lyin s time
Neutral,google family business rare disease covid affect family health ift ttavjlxs
Neutral,googledocs hey idea request help google sheet file today fail open load massive file multiple browser colleague try appropriate sharing setting help
Negative,  samsungmobileus open google streetview samsung thing know phone screen work properly
Irrelevant,google maxmeowstic look image bad break life
Neutral,google pixel review phone great camera tinyurl com yhaql t co jyzupqfmgy
Neutral,google calendar messy loud chaotic use setting feature control calendar day bit lynjsf
Positive,help hate inquiry forget sorry play googleyou tube follow nasty cuss cap
Irrelevant,love yang gang twitter
Negative,remember tune way version day censor hey liar fact checker google facebook twitter youtube msm away class action law pus fornow nameless deelovesjamaica mickeyb
Irrelevant,google bias birthday picture face heshethey sweet dongsung smilingfacewithheart feel warm smilingfacewithheart pic twitter combeqqsbp
Neutral,want succeed offer complete google campaign solution visit suggestion bit ly eiqka
Neutral,deep look seo
Neutral,day summer training teachers rfh regional thank rkiker support google msnelle session affiliation relation
Neutral,wownow preview amazing vibe wey dey drop store friday th march platform store include spotify apple music itune tiktokresso google playyoutube amazon pandora deezer tidal napster iheartradio pic twitter comgttbpqij
Negative,android trojan kill google play protect spew fake app review ble
Negative,forever want saw thank angry buy play free die star
Negative,yo wtf biology study mindset check google answer spend minute wtf
Positive,great big company today yellow page yahoo
Negative,iphone pro max mah battery great thing slice bread pixel xl mah battery wtf google thinking mah difference folk
Negative,fucking google search send
Irrelevant,turkey mad dog mad state lead chief rabid handler erdogan attack necessarily armenian surround region googleturkey conflict
Irrelevant,shaman friday july
Irrelevant,second day slightly boring wormear jesamine casual know band search damn thing google convince onehit wonder lose masterpiece youtu vdstjmxyk
Negative,damn google search send
Positive,happy old year hip hop love music like head google shot fabnewyork build dj
Neutral,google well help bad girl
Irrelevant,shit pat know
Positive,  like pic twitter comcruuffvti
Irrelevant,hemfeld gop transgender strategy story man convict sexual offense long consider threat change gender think people trumps staff understand good talking point
Negative,realdonaldtrump thank thank stand free speech bias bohemoth company twitter google facebook
Negative,google suck google regulate undocumented worker misinformation
Negative,iphone pro max mah battery big thing slice bread pixel xl mah battery wtf google thinking mah difference folk
Negative,hear hi google notice weareoneexo
Neutral,family ask oscar major explain proudly like pull google translate lose mom proud
Positive,like pic twitter comcruuffvti
Negative,time cantee t look stupid text email
Negative,  find shit
Neutral,favorite commercial smart home home device simply amazon google cnet favorite smart home device arenn t amazon store google cnet cnet com news favorite
Irrelevant,yes proof bossbabe mlm pyramid scheme word spread lie sure people google tell lie
Negative,everytime google sue fear rob people destroy invention money away class action suet
Irrelevant,soon hcpss check small group entire class google meet technology unbearable user
Positive,pay need extra google drive space get annoying
Negative,costar accuse google antiastrological bias play store pull dr rpvrw horoscope app
Irrelevant,late james scroggie daily paper liseoscroggie thank oncrawl
Negative,time eu commission take step
Neutral,google research make china effortless robotic dog trot article worldnws comnewsgooglere
Negative,  reason like ignore view metric google business insight sterling hot sky inc sterlingsky s google good busi http
Negative,time despite fact currently million people live poverty line access health service access health care access health care
Neutral,  bigram poem inspire garjam app google announce announce app general general availability complete availability type ai ai prediction ibm gary howard james
Neutral,agree site address cause change google facebook
Negative,google hangout work laptop restart work start finish town meeting half time day
Neutral,want succeed provide complete google campaign solution visit proposal bit lyeiqka
Neutral,imagine take particularly dumb google airplane drive reminder skam character arenve t real people
Negative,androiddev notice issue upgrade android gradle memory plugin chapter google compile testing library crash retrieve resource html example detail available github com glureau agp net new
Positive,ad post great date idea gloucestershire official nd favourite search group result google o chimmyville co uk o date idea glo html happy
Neutral,android basically unusable turn google track eric ravenscraft link medium comdztxztxc
Positive,like pic twitter com cruuffvti
Negative,thank google fucking idiot pic webs com ysfuxcu
Neutral,stupid stupid stupid let smart cheap fast competitor tcl onn google apple amazon samsung sony homebound users fume video application sync fresh
Positive,  actually day announcement google pixel technology usually include headphone console jack freakingoogle headphone dial jack month ago give new phone work premiere rush have carry bunch adapter
Negative,google stigmatize latinos punish criminal
Neutral,bbc daily luigi fact google know conspiracy secret long learn truth reality come create pic twitter comhdtoyrmoq
Irrelevant,love kind need mention georgia tennant ask google search twitter
Positive,angel
Negative,fuck
Irrelevant,local
Neutral,rhandlerr sir help recovery gmail account help google verify account belong pic twitter comvrdvuunvye
Negative,unk mf bing
Negative,literally fucking okay
Positive,happy th anniversary hip car hop love music sound like head anytime google lesson free fabnewyork know exciting dj
Negative,netflix new google
Neutral,thank king kimoon kang answer impact make difference ssa summit final day
Neutral,google doctor nurse googlearabia google
Irrelevant,vote jimin star adaptable good social life ⃣click m idolchart compoll ⃣login naver kakao google facebook ⃣click jimin ⃣click vote time day leave
Irrelevant,  absolutely mfer pink moto razor havin ass pretty sure ringtone sexyback nooooo tear apart shewantsrevenge song hit hard
Negative,google meet work
Negative,google meet open
Negative,google want saw thank control angry level play free star
